"record_id","modified","institutionCode","collectionCode","catalogNumber","basisOfRecord","kingdom","phylum","family","genus","specificEpithet","scientificName","scientificNameAuthorship","identifiedBy","yearIdentified","monthIdentified","recordedBy","recordNumber","year","month","day","continentOcean","country","stateProvince","county","locality","decimalLongitude","decimalLatitude","verbatimLongitude","verbatimLatitude","minimumElevationInMeters","maximumElevationInMeters","occurrenceRemarks","barcode","imagecode","coordinatePrecision","geoFlag","dayIdentified","order","class"
"1","2019-10-09 11:27:25-03","UFBA","ALCB","131782","PreservedSpecimen","Plantae","Monocotyledon","Araceae","Asterostigma","tweedianum","Asterostigma tweedianum","Schott","Caxambu, MG","2017","10","Caxambu, MG; Siqueira, EL","7920","2017","10","05","Southern America","Brasil","Paraná","Céu Azul","Parque Nacional do iguaçu","-53.844444","-25.153611","-53.844444","-25.153611","651","651","ca 0,80m de altura, terrícola, rizomatosa. Caule de coloraçãomesclada entre castanho claro e castanho escuro. frutos imaturos verdes.; Floresta Estacional Semidecidual Submontana","ALCB048441","ALCB048441",NA,NA,NA,NA,NA
"2","2020-12-20 21:15:31-03","UFV","VIC","025175","PreservedSpecimen","Plantae",NA,"Araceae","Asterostigma","tweedianum","Asterostigma tweedianum","Schott",NA,NA,NA,"Carvalho, A.F.; et al.","731","2000","10","13",NA,"Brasil","Minas Gerais","Diogo de Vasconcelos","Miguel Rodrigues.","-43.198299407959","-20.4878005981445",NA,NA,NA,NA,"Planta bulbosa, de local sombreado, sob mata, inflorescência vermelho vivo.","VIC025175","VIC025175","15070","auto",NA,NA,NA
"3","2019-11-08 08:49:09-03","FURB","FURB","39064","PreservedSpecimen","Plantae",NA,"Araceae","Asterostigma","tweedianum","Asterostigma tweedianum","Schott","Nadruz, M","2013","03","Funez, L.A.","893","2012","09","08",NA,"Brasil","Santa Catarina","Blumenau","RPPN Bugerkopf.","-49.0697223","-27.0038889","-49.0697223","-27.0038889","170","170",NA,"FURB15906","FURB15906 FURB15906_1",NA,NA,"19",NA,NA
"4","2019-11-08 08:49:09-03","FURB","FURB","39082","PreservedSpecimen","Plantae",NA,"Araceae","Asterostigma","tweedianum","Asterostigma tweedianum","Schott","Nadruz, M","2013","03","Funez, L.A.","906","2012","09","20",NA,"Brasil","Santa Catarina","Blumenau","RPPN Bugerkopf.","-49.0711111","-27.0030556","-49.0711111","-27.0030556","223","223",NA,"FURB15907","FURB15907",NA,NA,"19",NA,NA
"5","2020-10-14 09:58:30-03","FURB","FURB","8757","PreservedSpecimen","Plantae",NA,"Araceae","Asterostigma","tweedianum","Asterostigma tweedianum","Schott","Uller, HF; Stival-Santos, A","2008","09","Dreveck, S.; Verdi, M. & Godoy, M.B.","267","2008","02","25",NA,"Brasil","Santa Catarina","São Cristovão do Sul",NA,"-50.4002778","-27.2697223","-50.4002778","-27.2697223","993","993","Florística IFFSC 453. Habitat: Floresta Ombrófila Mista; Habito: epífita;","FURB00592","FURB00592",NA,NA,"18",NA,NA
"6","2019-08-16 08:38:22-03","UTFPR","HCF","7450","S","Plantae",NA,"Araceae","Asterostigma","tweedianum","Asterostigma tweedianum","Schott","L.G. Temponi & L.P. Poli","2010","03","M.G. Caxambu","2445","2008","12","08",NA,"Brasil","PR","Turvo","Propriedade da família Rickli","-51.551722","-25.038806","51°33'06,2 W","25°02'19,7 S","1055","1055","erva ca. 1,10 m, ciófila, terrestre, com frutos protegidos por bráctea.",NA,NA,NA,NA,NA,NA,NA
"7","2019-08-16 08:38:22-03","UTFPR","HCF","5956","S","Plantae",NA,"Araceae","Asterostigma","tweedianum","Asterostigma tweedianum","Schott","L.G. Temponi & L.P. Poli","2010","03","M.G. Caxambu","1715","2007","09","27",NA,"Brasil","PR","Campo Mourão","Parque Estadual Lago Azul (PELA)","-52.318472","-24.100889","52°19'06,5 W","24°06'03,2 S","586","586","erva ereta ca. 0,50 cm. Flores esverdeadas.",NA,NA,NA,NA,NA,NA,NA
"8","2019-08-16 08:38:22-03","UTFPR","HCF","23882","S","Plantae",NA,"Araceae","Asterostigma","tweedianum","Asterostigma tweedianum","Schott","M.G. Caxambu","2017","10","M.G. Caxambu","7920","2017","10","05",NA,"Brasil","PR","Céu Azul","Parque Nacional do Iguaçu, Trilha Manoel","-53.844583","-25.153778","53°50'40,5 W","25°09'13,6 S","651","651","erva ca. 0,80 m, semi-ciófila, terrícola, rizomatosa. Caule de coloração mesclada entre castanho claro e castanho escuro. Frutos imaturos verdes.",NA,NA,NA,NA,"24",NA,NA
"9","2019-08-16 08:38:22-03","UTFPR","HCF","15806","S","Plantae",NA,"Araceae","Asterostigma","tweedianum","Asterostigma tweedianum","Schott","S.F. Pereira","2013",NA,"E.D. Lozano","1062","2012","10","03",NA,"Brasil","PR","Tijucas do Sul","Rodovia BR-376","-49.1988983154297","-25.9281005859375",NA,NA,NA,NA,"terrícola, 60 cm, espata creme, caule carnoso, sub-bosque de plantio de Pinus.",NA,NA,"25228","auto",NA,NA,NA
"10","2020-12-21 16:13:17-03","MBM","MBM","269609","PreservedSpecimen","Plantae",NA,"Araceae","Asterostigma","tweedianum","Asterostigma tweedianum","Schott",NA,NA,NA,"Tessmann, G.","2626","1947","11","07","Southern America","Brazil","Paraná","Paranaguá","Caiobá","-48.5092010498047","-25.5200004577637",NA,NA,NA,NA,NA,"MBM269609","MBM269609","24916","auto",NA,NA,NA
"11","2020-12-21 16:13:17-03","MBM","MBM","387556","PreservedSpecimen","Plantae",NA,"Araceae","Asterostigma","tweedianum","Asterostigma tweedianum","Schott","Pereira, S.F.","2013",NA,"Lozano, E.D.; Daniel, V.A.; Daniel, V.A.","1062","2012","10","03","Southern America","Brazil","Paraná","Tijucas do Sul","Rodovia BR-376","-49.1988983154297","-25.9281005859375",NA,NA,NA,NA,"Terrícola, 60 cm, espata creme, caule carnoso, sub-bosque de plantio de Pinnus.","MBM387556","MBM387556","25228","auto",NA,NA,NA
"12","2021-02-11 17:17:54-03","UFPR","UPCB","27839","PreservedSpecimen","Plantae",NA,"Araceae","Asterostigma","tweedianum","Asterostigma tweedianum","Schott","Pereira, S.F.",NA,NA,"Bidá, A.",NA,"1993","09","17",NA,"Brasil","Paraná","Araucária","Campina dos Martins","-49.4103012084961","-25.5930995941162",NA,NA,NA,NA,"Herbácea, frequente no interior da floresta com Araucaria..",NA,NA,"21346","auto",NA,NA,NA
"13","2021-02-11 17:17:54-03","UFPR","UPCB","53508","PreservedSpecimen","Plantae",NA,"Araceae","Asterostigma","tweedianum","Asterostigma tweedianum","Schott","Pereira, S.F.","2014","06","Labiak, P.H.","3020","2003","10","20",NA,"Brasil","Paraná","Morretes","Estrada da Graciosa, Caminho dos Jesuítas","-48.834400177002","-25.476900100708",NA,NA,"1000","1000","Terrestre, interior da floresta. Floresta ombrófila densa montana..",NA,NA,"30514","auto","02",NA,NA
"14","2021-02-11 17:17:54-03","UFPR","UPCB","43681","PreservedSpecimen","Plantae",NA,"Araceae","Asterostigma","tweedianum","Asterostigma tweedianum","Schott","Pereira, S.F.","2014","06","Kozera, C.","1277","1999","10","20",NA,"Brasil","Paraná","Morretes","Parque Estadual Pico do Marumbi","-48.834400177002","-25.476900100708",NA,NA,NA,NA,"Terrícola com espata verde. Trilha no sub-bosque, Floresta Ombrófila Densa de Encosta..",NA,NA,"30514","auto","02",NA,NA
"15","2021-02-11 17:17:54-03","UFPR","UPCB","21364","PreservedSpecimen","Plantae",NA,"Araceae","Asterostigma","tweedianum","Asterostigma tweedianum","Schott","Pereira, S.F.","2014","06","Negrelle, R.R.B.","A337","1992","08","25",NA,"Brasil","Santa Catarina","Itapoá","Reserva Volta Velha","-48.6161003112793","-26.1168994903564",NA,NA,NA,NA,"Terrícola, com inflorescência branca e espata rajada com estrias marrons..",NA,NA,"18121","auto","02",NA,NA
"16","2009-06-25 21:28:00-03","MO","MOBOT","2818542","PreservedSpecimen","Plantae",NA,"Araceae","Asterostigma","tweedianum","Asterostigma tweedianum","Schott",NA,NA,NA,"Anonymous","Anonymous s.n.",NA,NA,NA,"South America","Brazil",NA,NA,NA,NA,NA,NA,NA,NA,NA,NA,NA,NA,NA,NA,NA,NA,NA
"17","2008-05-27 22:02:00-03","MO","MOBOT","1792877","PreservedSpecimen","Plantae",NA,"Araceae","Asterostigma","tweedianum","Asterostigma tweedianum","Schott","E.G. Goncalves",NA,NA,"J. Cordeiro","Cordeiro 144","1985","9","11","South America","Brazil","Paraná",NA,"Véu de Noiva (mun. Morretes)",NA,NA,NA,NA,NA,NA,NA,NA,NA,NA,NA,NA,NA,NA
"18","2008-05-27 22:02:00-03","MO","MOBOT","370554","PreservedSpecimen","Plantae",NA,"Araceae","Asterostigma","tweedianum","Asterostigma tweedianum","Schott","T. Croat",NA,NA,"Jan C. Lindeman","Lindeman 4968a","1967","3","18","South America","Brazil","Paraná",NA,"Fazenda Reserva, ca. 85 km SW of Guarapuava, planalto, capão Cachambu N of Rio dos Torres",NA,NA,NA,NA,"900.00000000",NA,NA,NA,NA,NA,NA,NA,NA,NA
"19","2018-12-10 13:05:00-02","MO","MOBOT","101087507","PreservedSpecimen","Plantae",NA,"Araceae","Asterostigma","tweedianum","Asterostigma tweedianum","Schott",NA,NA,NA,"Y.S. Kuniyoshi","Kuniyoshi 114",NA,NA,NA,"South America","Brazil","Paraná","Curitiba",NA,"-49.2731018066406","-25.4277992248535",NA,NA,NA,NA,NA,NA,NA,"25180","auto",NA,NA,NA
"20","2016-04-07 14:03:33-03","UNIOESTE","UNOP","8161","S","Plantae",NA,"Araceae","Asterostigma","tweedianum","Asterostigma tweedianum","Schott","Temponi, L.G.","2012","09","Temponi, L.G.","1168","2012","08","17",NA,"Brasil","Paraná","Cascavel","Cultivada na Rua Agronomia 633, oriunda de Céu Azul, Parque Nacional do Iguaçu, na Trilha do Rio Azul.","-53.4552993774414","-24.9557991027832",NA,NA,NA,NA,NA,NA,NA,"47841","auto",NA,NA,NA
"21","2015-10-22 10:02:28-02","UNIOESTE","UNOP","5535","S","Plantae",NA,"Araceae","Asterostigma","tweedianum","Asterostigma tweedianum","Schott","Buturi, C. .V.; Temponi, L. .G.","2013","03","Temponi, L.G.; et al.; et al.","583","2009","10","09",NA,"Brasil","Paraná","Céu Azul","Parque Nacional do Iguaçu. Trilha de Educação Ambiental.","-53.8485984802246","-25.1466999053955",NA,NA,NA,NA,"Terricola. Unicata. Floresta Estacional Semidecidual.",NA,NA,"51148","auto","20",NA,NA
"22","2015-10-22 10:02:28-02","UNIOESTE","UNOP","2896","S","Plantae",NA,"Araceae","Asterostigma","tweedianum","Asterostigma tweedianum","Schott",NA,NA,NA,"Ferneda Rocha, L.C.; Cardoso, A.P.; Escher, A.R.; Engels, M.E.; Cardoso, A.P.; Escher, A.R.; Engels, M.E.","324","2014","09","05",NA,"Brasil","Paraná","Morretes","Parque Nacional Saint Hilaire e Lange.","-48.834400177002","-25.476900100708",NA,NA,NA,NA,"Em cultivo na UNIOESTE. Geófita. Catáfilo alvo-avermelhado com máculas verde a marrom. Pecíolo e pedúnculo alvos com máculas verde a marrom. Lâmina foliar membranácea, concolor. Espata alva com máculas verde a marrom externamente, alva internamente.",NA,NA,"30514","auto",NA,NA,NA
"23","2016-06-16 10:16:51-03","UNIOESTE","UNOP","3106","S","Plantae",NA,"Araceae","Asterostigma","tweedianum","Asterostigma tweedianum","Schott","Pereira, S.F.","2013","10","Pereira, S.F.; Buturi, C.; Barbosa, J.F.; Engels, M.; Losano, E.D.; Buturi, C.; Barbosa, J.F.; Engels, M.; Losano, E.D.","284","2013","10","13",NA,"Brasil","Paraná","São José dos Pinhais","RPPN - Inhandara Guaricana","-49.2064018249512","-25.5347003936768",NA,NA,NA,NA,"Terrestre, ca 1,5m. Inflorescência pós antese.",NA,NA,"45291","auto","16",NA,NA
"24","2020-11-12 16:58:00-03","UEL","FUEL","45199","PreservedSpecimen","Plantae","Tracheophyta","Araceae","Asterostigma","tweedianum","Asterostigma tweedianum","Schott","Cotarelli, VM","2009",NA,"Cotarelli, VM; Francisco, EM","529","2008","11","20",NA,"Brasil","Paraná","Mauá da Serra","Mata do Pinhão","-51.15","-23.883333","-51.15","-23.883333",NA,NA,NA,"OK",NA,NA,NA,NA,"Alismatales",NA
"25","2020-11-12 16:58:00-03","UEL","FUEL","44882","PreservedSpecimen","Plantae","Tracheophyta","Araceae","Asterostigma","tweedianum","Asterostigma tweedianum","Schott","Nadruz, M","2009","05","Cotarelli, VM; Francisco, EM","631","2008","12","04",NA,"Brasil","Paraná","Londrina","Estância Patrial","-51.233333","-23.366667","-51.233333","-23.366667",NA,NA,NA,NA,NA,NA,NA,"19","Alismatales",NA
"26","2020-11-12 16:58:00-03","UEL","FUEL","9191","PreservedSpecimen","Plantae","Tracheophyta","Araceae","Asterostigma","tweedianum","Asterostigma tweedianum","Schott","Temponi, LG","2009","08","Cordeiro, J; Silva, JM","144","1985","09","11",NA,"Brasil","Paraná","Morretes","Véu da Noiva","-48.834400177002","-25.476900100708",NA,NA,NA,NA,NA,NA,NA,"30514","auto",NA,"Alismatales",NA
"27","2019-11-01 15:12:49-03","UnB","UB",NA,"PreservedSpecimen","Plantae","Monocotyledonae","Araceae","Asterostigma","tweedianum","Asterostigma tweedianum","Schott","Gonçalves, EG","1999","10","Gonçalves, EG; Vieira, S","302","1999","10","21","Southern America","Brasil","Santa Catarina",NA,"Ilha de Santa Catarina. Unidade de Conservação Ambiental Desterro (UCAD), trilha azul",NA,NA,NA,NA,NA,NA,"Planta tuberosa. Poucos indivíduos férteis. Flores já passadas; Floresta ombrófila densa","UB0000895","UB0000895",NA,NA,NA,NA,NA
"28","2019-11-01 15:12:49-03","UnB","UB",NA,"PreservedSpecimen","Plantae","Monocotyledonae","Araceae","Asterostigma","tweedianum","Asterostigma tweedianum","Schott","Gonçalves, EG","2008","06","Silva, JM; Abe, LM","4167","2004","10","26","Southern America","Brasil","Paraná ","Adrianópolis",NA,"-48.9911003112793","-24.6571998596191",NA,NA,NA,NA,"Terrícola, espiga creme com manchas vinosas; Interior da floresta atlântica","UB0000887","UB0000887","49901","auto",NA,NA,NA
"29","2019-11-01 15:12:49-03","UnB","UB",NA,"PreservedSpecimen","Plantae","Monocotyledonae","Araceae","Asterostigma","tweedianum","Asterostigma tweedianum","Schott","Gonçalves, EG","1999","10","Gonçalves, EG; Vieira, S","357","1999","10","24","Southern America","Brasil","Santa Catarina","Ilhota","Parque Botânico do Morro do Baú","-48.8272018432617","-26.8997001647949",NA,NA,NA,NA,"Terrestre, algumas vezes em terreno alagado. Pecíolo verde puro, levemente mosqueado de cinza. Espata verde, eventualmente com estrias cinzentas, bagas imaturas branco-esverdeadas; Floresta ombrófila densa. Sopé do morro","UB0000899","UB0000899","18275","auto",NA,NA,NA
"30","2019-11-01 15:12:49-03","UnB","UB",NA,"PreservedSpecimen","Plantae","Monocotyledonae","Araceae","Asterostigma","tweedianum","Asterostigma tweedianum","Schott","Gonçalves, EG","1999","10","Gonçalves, EG; Vieira, S","315","1999","10","24","Southern America","Brasil","Santa Catarina","Ilhota","Parque Botânico do Morro do Baú. Morro do Filhote","-48.8272018432617","-26.8997001647949",NA,NA,NA,NA,"Crescendo sobre a serrapilheira que se acumula sobre as pedras, muito comum no local formando pequenas colônias. espata toda verde ou atropurpúrea, base dos sinândrios roseos; Floresta ombrófila densa","UB0000889","UB0000889","18275","auto",NA,NA,NA
"31","2019-11-01 15:12:49-03","UnB","UB",NA,"PreservedSpecimen","Plantae","Monocotyledonae","Araceae","Asterostigma","tweedianum","Asterostigma tweedianum","Schott","Gonçalves, EG","2002","07","Gonçalves, EG","447","1999","09",NA,"Southern America","Brasil","São Paulo",NA,"Cultivado na estufa mergulhada do Instituto de Biologia. Origem desconhecida",NA,NA,NA,NA,NA,NA,"Terrestre","UB0000903","UB0000903",NA,NA,NA,NA,NA
"32","2019-11-01 15:12:49-03","UnB","UB",NA,"PreservedSpecimen","Plantae","Monocotyledonae","Araceae","Asterostigma","tweedianum","Asterostigma tweedianum","Schott","Gonçalves, EG","1999","10","Gonçalves, EG; Vieira, S","302","1999","10","21","Southern America","Brasil","Santa Catarina",NA,"Ilha de Santa Catarina. Unidade de Conservação Ambiental Desterro (UCAD), trilha azul",NA,NA,NA,NA,NA,NA,"Planta tuberosa. Poucos indivíduos férteis. Flores já passadas; Floresta ombrófila densa","UB0000893","UB0000893",NA,NA,NA,NA,NA
"33","2019-11-01 15:12:49-03","UnB","UB",NA,"PreservedSpecimen","Plantae","Monocotyledonae","Araceae","Asterostigma","tweedianum","Asterostigma tweedianum","Schott","Gonçalves, EG","1999","10","Gonçalves, EG; Vieira, S","316","1999","10","24","Southern America","Brasil","Santa Catarina","Ilhota","Parque Botânico do Morro do Baú. Morro do Filhote","-48.8272018432617","-26.8997001647949",NA,NA,NA,NA,"Crescendo em uma fina camada de serrapilheira acumulado sobre uma pedra achatada. Espata verde oliva com tons cinzentos, flores passadas. Algumas plantas com uma folhas modificada no lugar da segunda inflorescência; Floresta ombrófila","UB0000897","UB0000897","18275","auto",NA,NA,NA
"34","2019-11-01 15:12:49-03","UnB","UB",NA,"PreservedSpecimen","Plantae","Monocotyledonae","Araceae","Asterostigma","tweedianum","Asterostigma tweedianum","Schott","Gonçalves, EG","2000","12","Gonçalves, EG; Lorenzi, H","630","2000","12","06","Southern America","Brasil","Santa Catarina","Porto União","Estrada para Matos Costa","-51.0783004760742","-26.2381000518799",NA,NA,NA,NA,"Planta terrestre, estéril, apenas um indivíduo visto; Floresta à margem da rodovia","UB0000888","UB0000888","41804","auto",NA,NA,NA
"35","2019-11-01 15:12:49-03","UnB","UB",NA,"PreservedSpecimen","Plantae","Monocotyledonae","Araceae","Asterostigma","tweedianum","Asterostigma tweedianum","Schott","Gonçalves, EG","2002","07","Gonçalves, EG","473","2000","08","18","Southern America","Brasil","São Paulo","São Paulo","Cultivado na estufa do Departamento de Botânica da Universidade de São Paulo","-46.6300010681152","-23.5400009155273",NA,NA,NA,NA,"Planta ainda áfila, com duas inflorescências. Espata verde claro por fora, branco esverdeado por dentro, margens róseas. Espádice com flores masculinas vermelhas na base, estaminódios também vermelhos, estigma planar","UB0000901","UB0000901","53584","auto",NA,NA,NA
"36","2020-08-20 20:37:45-03","UFSC","FLOR","61150","PreservedSpecimen","Plantae",NA,"Araceae","Asterostigma","tweedianum","Asterostigma tweedianum","Schott","Pereira, S.F.","2013",NA,"Lozano, E.D.; Daniel, V.A.","1062","2012","10","03",NA,"Brasil","Paraná","Tijucas do Sul","Rodovia BR-376.","-49.1988983154297","-25.9281005859375",NA,NA,NA,NA,"Terrícola, 60cm, espata creme, caule carnoso","FLOR0061150","FLOR0061150","25228","auto",NA,"Alismatales",NA
"37","2020-08-20 14:54:31-03","UFSC","FLOR","46444","PreservedSpecimen","Plantae",NA,"Araceae","Asterostigma","tweedianum","Asterostigma tweedianum","Schott","Gonçalves, E.G.","1999","10","Gonçalves, E.G.; Vieira, S.","302","1999","10","21",NA,"Brasil","Santa Catarina","Florianópolis","Ilha de Santa Catarina, Unidade de Conservação Ambiental Desterro (UCAD), trilha Azul.","-48.5491981506348","-27.596700668335",NA,NA,NA,NA,"planta tuberosa, flores já passadas. Poucos indivíduos.","FLOR0046444","FLOR0046444","27000","auto",NA,"Alismatales",NA
"38","2020-08-20 14:54:31-03","UFSC","FLOR","46374","PreservedSpecimen","Plantae",NA,"Araceae","Asterostigma","tweedianum","Asterostigma tweedianum","Schott","Gonçalves, E.G.","1999","10","Gonçalves, E.G.; Vieira, S.","315","1999","10","24",NA,"Brasil","Santa Catarina","Ilhota","Parque Botânico do Morro do Baú, Morro do Filhote.","-48.8272018432617","-26.8997001647949",NA,NA,NA,NA,"flor espata toda verde ou atropupúrea. base dos sinândrios róseos. Crescendo sobre a serrapilheira que se acúmula sobre as pedras, muito comum no local formando pequenas colonias.","FLOR0046374","FLOR0046374","18275","auto",NA,"Alismatales",NA
"39","2021-03-04 15:41:55-03","IF","SPSF","52502","PreservedSpecimen","Plantae","Magnoliophyta","Araceae","Asterostigma","tweedianum","Asterostigma tweedianum","Schott","M.Nadruz","2017","08","A.Maruyama & L.Cicco","900","2017","08","25","América do Sul","Brasil","SP","São Paulo",NA,"-46.726944","-23.639444",NA,NA,"776","776","COLETA: Erva com aprox. 40cm de altura. Flores brancas.; GEOGRAFIA: Floresta próximo ao Parque Burle Marx. Interior. Área institucional.;",NA,NA,NA,NA,"26","Arales","Liliopsida"
"40","2019-11-21 09:59:14-03","IBt","SP","23184","S","Plantae",NA,"Araceae","Asterostigma","tweedianum","Asterostigma tweedianum","Schott","Krause, K",NA,NA,"Hoehne, FC","s.n.","1928","10","25",NA,"Brasil","Santa Catarina",NA,"Paraty.",NA,NA,NA,NA,NA,NA,NA,"SP049450","SP049450",NA,NA,NA,NA,NA
