X,Y,record_id,modified,institutionCode,collectionCode,catalogNumber,basisOfRecord,kingdom,phylum,order,family,genus,specificEpithet,scientificName,scientificNameAuthorship,recordedBy,recordNumber,year,month,continentOcean,country,stateProvince,county,locality,decimalLongitude,decimalLatitude,minimumElevationInMeters,maximumElevationInMeters,preparationType,occurrenceRemarks,barcode,imagecode,identifiedBy,day,coordinatePrecision,geoFlag,yearIdentified,monthIdentified,dayIdentified,class,verbatimLongitude,verbatimLatitude,typeStatus,fieldNumber,individualCount,CD_UF,NM_UF,SIGLA_UF,NM_REGIAO
-44.5699996948242,-22.6399993896484,"12",2021-03-01 16:33:58-03,UNICAMP,UEC,"109437",S,Plantae,Magnoliopsida,NA,Melastomataceae,Huberia,minutifolia,Huberia minutifolia,Bochorny & R.Goldenb.,"Freitas, L","748","1999","11",NA,Brazil,São Paulo,São José do Barreiro,Limite entre floresta ombrófila mista altomontanae campo de altitude. Lado direito Guarita do Ibama.,-44.5699996948242,-22.6399993896484,NA,NA,NA,"Arbusto/ca. 1 m. Flores: corola branca, filetes e gineceu verde amarelado, anteras amarelo vivo.",UEC007335,UEC007335,NA,"17","30784",auto,NA,NA,NA,NA,NA,NA,NA,NA,NA,"35",São Paulo,SP,Sudeste
-44.5699996948242,-22.6399993896484,"13",2021-03-01 16:33:58-03,UNICAMP,UEC,"104863",S,Plantae,Magnoliopsida,NA,Melastomataceae,Huberia,minutifolia,Huberia minutifolia,Bochorny & R.Goldenb.,"Freitas, L; Ravetta, AL","463","1998","11",NA,Brazil,São Paulo,São José do Barreiro,Margem da cachoeira Sto. Isidro.,-44.5699996948242,-22.6399993896484,NA,NA,NA,"Arbusto, 1 m. Corola branco, anteras amarelo vivo a vermelho (velhas).; Floresta mista aluvial.",UEC004510,UEC004510,"Martins, AB","07","30784",auto,NA,NA,NA,NA,NA,NA,NA,NA,NA,"35",São Paulo,SP,Sudeste
-44.615278,-22.7475,"14",2020-06-29 09:31:05-03,UFRRJ,RBR,"46308",S,Plantae,NA,NA,Melastomataceae,Behuria,parvifolia,Behuria parvifolia,Cogn.,"J.F.A. Baumgratz; M.G. Bovini, M. Nadruz","1350","2014","06",NA,Brasil,São Paulo,São José do Barreiro,Trilha para Cachoeira São Isidro.,-44.615278,-22.7475,"1469","1469",NA,NA,RBR00046308,RBR00046308,J.F.A. Baumgratz,"04",NA,NA,"2014","07",NA,NA,44º36'55''W,22º44'51''S,NA,NA,NA,"35",São Paulo,SP,Sudeste
-44.5699996948242,-22.6399993896484,"15",2020-06-29 09:31:05-03,UFRRJ,RBR,"36072",S,Plantae,NA,NA,Melastomataceae,Behuria,parvifolia,Behuria parvifolia,Cogn.,J.F.A. Baumgratz,"1169","2011","10",NA,Brasil,São Paulo,São José do Barreiro,Parque Nacional da Serra da Bocaina,-44.5699996948242,-22.6399993896484,NA,NA,NA,NA,RBR00036072,NA,NA,"06","30784",auto,NA,NA,NA,NA,NA,NA,NA,NA,NA,"35",São Paulo,SP,Sudeste
-44.615,-22.7475,"26",2020-08-20 14:57:41-03,UFSC,FLOR,"62932",PreservedSpecimen,Plantae,NA,Myrtales,Melastomataceae,Behuria,parvifolia,Behuria parvifolia,Cogn.,"Baumgratz, J.F.A.; Mynssen, C.; Pinheiro, F.M.; Meneguzzo, T. & Ribeiro, R.","1169","2011","10",NA,Brasil,São Paulo,São José do Barreiro,"Parque Nacional da Serra da Bocaina, Lageado; Trilha da cachoira São Isidro, em encosta na margem do rio que forma a cachoeira São Isidro (afluente do rio Mambucaba).",-44.615,-22.7475,"1478","1478",NA,"Subarbusto ca. 50cm alt.; indumento vinoso; ramos castanhos; pecíolo verde, vinoso face adaxial; folhas verdes subconcolores, margem levemente vinosa; botões florais c/ hipanto e cálice verdes, corola alvo-rosada; frutos senís cinéreo",FLOR0062932,FLOR0062932,NA,"06",NA,NA,NA,NA,NA,NA,44º36'54''W,22º44'51''S,NA,NA,NA,"35",São Paulo,SP,Sudeste
