"record_id","modified","institutionCode","collectionCode","catalogNumber","basisOfRecord","kingdom","class","order","family","genus","specificEpithet","scientificName","scientificNameAuthorship","typeStatus","recordedBy","year","month","day","continentOcean","country","stateProvince","locality","occurrenceRemarks","barcode","imagecode","identifiedBy","yearIdentified","monthIdentified","dayIdentified","phylum","recordNumber","county","decimalLongitude","decimalLatitude","coordinatePrecision","minimumElevationInMeters","maximumElevationInMeters","geoFlag","verbatimLongitude","verbatimLatitude"
"1","2020-02-08 08:54:42-03","NBC","NL-BOTANY","U 0102187","PreservedSpecimen","Plantae","Magnoliopsidae","Caryophyllales","Cactaceae","Cipocereus","pusilliflorus","Cipocereus pusilliflorus","(F.Ritter) Zappi & N.P.Taylor","holotype","Ritter F","1964","01","01","Southern America","Brazil","Minas Gerais","Brazil; Minas Gerais; Monte Azul.","<a href=https://data.biodiversitydata.nl/naturalis/specimen/U%20%200102187 target=other class=eLink> <mi>dwc_moreinfo</mi></a>","NL-U0102187","NL-U0102187",NA,NA,NA,NA,NA,NA,NA,NA,NA,NA,NA,NA,NA,NA,NA
"2","2020-02-08 08:54:42-03","NBC","NL-BOTANY","U 0104040","PreservedSpecimen","Plantae","Magnoliopsidae","Caryophyllales","Cactaceae","Cipocereus","pusilliflorus","Cipocereus pusilliflorus","(F.Ritter) Zappi & N.P.Taylor",NA,"Horst L",NA,NA,NA,"Southern America","Brazil",NA,NA,"<a href=https://data.biodiversitydata.nl/naturalis/specimen/U%20%200104040 target=other class=eLink> <mi>dwc_moreinfo</mi></a>","NL-U0104040",NA,"Zappi DC; Taylor NP","1991","10","01",NA,NA,NA,NA,NA,NA,NA,NA,NA,NA,NA
"3","2020-12-11 11:34:14-03","UFMG","BHCB","21281","PreservedSpecimen","Plantae",NA,NA,"Cactaceae","Cipocereus","pusilliflorus","Cipocereus pusilliflorus","(Ritter) Zappi & N.P.Taylor",NA,"Taylor, NP; Zappi, DC; Eggli, V","1991","01","29","Southern America","Brasil","Minas Gerais","7 km E of monte azul towards and beyond Vila Angical on road to a small farmhouse, then c. 7km on foot following a small footpath turning off to the right into the Serra Geral from the path to the village of Gerais towards the farm called Montevideo","Stems half-upright or decumbent, branching mainly at base, to 50 cm long, not woody, tissue highly mucilaginous; cut stem obviously not darkening; damaged tissue slowly discolours orange and damaged spaces fill with mucilage; Plants only in cliff wal",NA,NA,NA,NA,NA,NA,"Dicotyledon","1486","Monte Azul","-42.874698638916","-15.1549997329712","41110","1150","1150","auto",NA,NA
"4","2020-06-15 15:29:44-03","UNESP-RC","HRCB","13995","PreservedSpecimen","Plantae",NA,NA,"Cactaceae","Floribunda","pusilliflora","Floribunda pusilliflora","(Gürke) P.J.Braun & Esteves",NA,"Taylor, N. P.","1991","01","29",NA,"Brasil","Minas Gerais",NA,"Plants only in cliff walls and on ledges, associated with Opuntia inamoema and Micranthocereus ( Austrocephalocereus) albicephalus. Stems haf-upright or decumbent, branching mainly at base, to 50 cm l",NA,NA,NA,NA,NA,NA,NA,"1486","Monte Azul ( or Mpio Espinosa)",NA,NA,NA,"1150","1150",NA,NA,NA
"5","2019-10-07 09:18:38-03","UEFS","HUEFS","226071","PreservedSpecimen","Plantae","Caryophyllanae","Caryophyllales","Cactaceae","Cipocereus","pusilliflorus","Cipocereus pusilliflorus","(Ritter) Zappi & N.P.Taylor",NA,"Fantinati, M.R.","2017","01","21",NA,"Brasil","Minas Gerais","Serra de Montevidéu.","Areal em afloramento rochoso.","HUEFS0226071","HUEFS0226071",NA,NA,NA,NA,"Angiospermae","178","Monte Azul","-42.801944","-15.175278",NA,"1132","1132",NA,"42W48'7''","15S10'31''"
