"record_id","modified","institutionCode","collectionCode","catalogNumber","basisOfRecord","kingdom","phylum","family","genus","specificEpithet","scientificName","scientificNameAuthorship","identifiedBy","yearIdentified","monthIdentified","dayIdentified","typeStatus","recordedBy","recordNumber","year","month","day","country","stateProvince","county","locality","decimalLongitude","decimalLatitude","coordinatePrecision","barcode","imagecode","geoFlag","continentOcean","verbatimLongitude","verbatimLatitude","occurrenceRemarks","minimumElevationInMeters","maximumElevationInMeters"
"1","2019-08-20 10:01:54-03","UNICAMP","UEC","205393","S","Plantae","Liliopsida","Xyridaceae","Xyris","cervii","Xyris cervii","E.D. Lozano & Wand.","Wanderley, MGL","2018","04","19","paratypus","Wanderley, MGL","CFSC5487","1978","07","04","Brazil","Minas Gerais","Santana Do Riacho","Serra do Cipó, km 98 da rodovia Belo Horizonte - Conceição do Mato Dentro.","-43.7144012451172","-19.1688995361328","26557","UEC190967","UEC190967","auto",NA,NA,NA,NA,NA,NA
"2","2020-12-21 16:47:46-03","MBM","MBM","367391","PreservedSpecimen","Plantae",NA,"Xyridaceae","Xyris","cervii","Xyris cervii","E.D. Lozano & Wand.",NA,NA,NA,NA,"PARATYPE","Wanderley, M.G.L.; Mota, N.F.O.; Viana, P.L.; Giorni, V.; Louzada, R.; Mota, N.F.O.; Viana, P.L.; Giorni, V.; Louzada, R.","2579","2007","05","23","Brazil","Minas Gerais","São Gonçalo do Rio Preto","Parque Estadual do Rio Preto","-43.345","-18.116111",NA,"MBM367391","MBM367391",NA,"Southern America","-43.345","-18.116111","Campo rupestre.",NA,NA
"3","2020-12-21 16:47:46-03","MBM","MBM","401615","PreservedSpecimen","Plantae",NA,"Xyridaceae","Xyris","cervii","Xyris cervii","E.D. Lozano & Wand.","Lozano, E.D.","2014",NA,NA,"PARATYPE","Lozano, E.D.; Damasceno, B.; Damasceno, B.","2516","2013","12","20","Brazil","Paraná","Ponta Grossa","Estrada para o Capão da Onça","-50.023056","-25.106667",NA,"MBM401615","MBM401615",NA,"Southern America","-50.023056","-25.106667","Isolada ou cespitosa, 50 cm, flor amarela, bainha subterrânea.; Campos Gerais. Campo úmido.",NA,NA
"4","2020-12-21 16:47:46-03","MBM","MBM","429231","PreservedSpecimen","Plantae",NA,"Xyridaceae","Xyris","cervii","Xyris cervii","E.D. Lozano & Wand.","Lozano, E.D.","2017",NA,NA,NA,"Lozano, E.D.; Martins-Filho, V.S.; Oliveira, A.A.; Silva, A.A.; Martins-Filho, V.S.; Oliveira, A.A.; Silva, A.A.","3604","2017","03","14","Brazil","Paraná","Ponta Grossa","Sítio da Família Martins","-50.035444","-25.060333",NA,"MBM429231",NA,NA,"Southern America","-50.035444","-25.060333","Herbácea, isolada, 50 cm, flor amarela, em campo úmido.; Campos Gerais.",NA,NA
"5","2020-12-21 16:47:46-03","MBM","MBM","68083","PreservedSpecimen","Plantae",NA,"Xyridaceae","Xyris","cervii","Xyris cervii","E.D. Lozano & Wand.",NA,NA,NA,NA,"PARATYPE","Anderson, W.R.; et al.; et al.","35423","1972","02","04","Brazil","Minas Gerais","Gouveia","Ca. 8km of Gouveia on road to Diamantina","-43.7407989501953","-18.4543991088867","37970","MBM068083","MBM068083","auto","Southern America",NA,NA,"Herb in wet sand; petals yellow.; Rocky (sandstone) cerrado and open rocky hollsides with white sandy soil, sloping down to grassy brejo, creek, and adjacent gallery forest.","1220","1220"
"6","2020-12-21 16:47:46-03","MBM","MBM","398014","PreservedSpecimen","Plantae",NA,"Xyridaceae","Xyris","cervii","Xyris cervii","E.D. Lozano & Wand.","Lozano, E.D.","2015",NA,NA,NA,"Engels, M.E.; Mazziero, F.F.F.; Michelon, C.; Canestraro, B.K.; Mazziero, F.F.F.; Michelon, C.; Canestraro, B.K.","902","2013","03","21","Brazil","Paraná","Carambeí","Rio Tamanduá","-50.0971984863281","-24.9178009033203","26641","MBM398014","MBM398014","auto","Southern America",NA,NA,"Folhas cilíndricas verdes com base castanha. Inflorescência castanha. Flor amarela.; Em campo úmido.",NA,NA
"7","2020-12-21 16:47:46-03","MBM","MBM","261061","PreservedSpecimen","Plantae",NA,"Xyridaceae","Xyris","cervii","Xyris cervii","E.D. Lozano & Wand.",NA,NA,NA,NA,"PARATYPE","Prata, A.P.; et al.; et al.","863","2000","04","26","Brazil","São Paulo","Itararé","Fazenda Santa Izabel","-49.3400001525879","-24.1100006103516","27729","MBM261061","MBM261061","auto","Southern America",NA,NA,"Afloramentos rochosos.",NA,NA
"8","2020-12-21 16:47:46-03","MBM","MBM","401614","PreservedSpecimen","Plantae",NA,"Xyridaceae","Xyris","cervii","Xyris cervii","E.D. Lozano & Wand.","Lozano, E.D.","2014",NA,NA,"HOLOTYPE","Lozano, E.D.; Saridakis, D.P.; Saridakis, D.P.","2682","2014","03","11","Brazil","Paraná","Ponta Grossa","Fazenda Pinheirinhos, Capão da Onça","-50.025278","-25.102222",NA,"MBM401614","MBM401614",NA,"Southern America","-50.025278","-25.102222","Cespitosa, 50 cm, flores amarelas, campo úmido.; Campos Gerais.",NA,NA
"9","2020-12-21 16:47:46-03","MBM","MBM","401616","PreservedSpecimen","Plantae",NA,"Xyridaceae","Xyris","cervii","Xyris cervii","E.D. Lozano & Wand.","Lozano, E.D.","2014",NA,NA,"PARATYPE","Lozano, E.D.; Saridakis, D.P.; Saridakis, D.P.","2642","2014","03","11","Brazil","Paraná","Ponta Grossa","PARNA dos Campos Gerais, Cachoeira São Jorge","-50.055556","-25.034444",NA,"MBM401616","MBM401616",NA,"Southern America","-50.055556","-25.034444","Cespitosa, 40 cm, bainhas deliquescentes, flores amarelas. campo úmido.; Campos Gerais. Campo úmido.",NA,NA
"10","2020-12-21 16:47:46-03","MBM","MBM","401617","PreservedSpecimen","Plantae",NA,"Xyridaceae","Xyris","cervii","Xyris cervii","E.D. Lozano & Wand.","Lozano, E.D.","2015",NA,NA,NA,"Lozano, E.D.; Saridakis, D.P.; Saridakis, D.P.","3023","2015","08","08","Brazil","Paraná","Piraí do Sul","Fazenda Garrote","-49.855667","-24.398278",NA,"MBM401617","MBM401617",NA,"Southern America","-49.855667","-24.398278","Isolada, 50 cm, bainha subterranea, flores amarelas, em plantio de pinus cortado. Área antrópica.; Campos Gerais.",NA,NA
"11","2020-12-21 16:47:46-03","MBM","MBM","318939","PreservedSpecimen","Plantae",NA,"Xyridaceae","Xyris","cervii","Xyris cervii","E.D. Lozano & Wand.","Lozano, E.D.","2015",NA,NA,"PARATYPE","Barboza, E.; Costa, E.F.; Von Lisingen, L.; Costa, E.F.; Von Lisingen, L.","1369","2006","05","05","Brazil","Paraná","Piraí do Sul","Estrada de ferro Jaguariaíva - Piraí do Sul","-49.948600769043","-24.5261001586914","37171","MBM318939","MBM318939","auto","Southern America",NA,NA,"Ereta, flor amarela.; Depressão úmida do campo.",NA,NA
"12","2020-12-11 11:45:33-03","UFMG","BHCB","144440","PreservedSpecimen","Plantae","Monocotyledon","Xyridaceae","Xyris","cervii","Xyris cervii","E.D.Lozano & Wand.",NA,"2017","02","23",NA,"Mota, NFO; Thode, VA; Lu-Irving, P; Toledo, MM","1763","2010","11","13","Brasil","Minas Gerais","Serra do Cabral",NA,"-44.264722","-17.700278",NA,"BHCB040797",NA,NA,"Southern America","-44.264722","-17.700278","Erva terrestre, cespitosa, dispersando.; Brejo.","1125","1125"
"13","2020-12-11 11:45:33-03","UFMG","BHCB","191523","PreservedSpecimen","Plantae","Monocotyledon","Xyridaceae","Xyris","cervii","Xyris cervii","E.D.Lozano & Wand.",NA,"2018","08","10",NA,"Paiva, JAM; Souza, JAM; Silva, SHA","1658","2018","02","20","Brasil","Minas Gerais","Raposos","Fazenda Cutão","-43.749722","-20.018333",NA,"BHCB191523",NA,NA,"Southern America","-43.749722","-20.018333","Erva, 0,55 m. Flor amarela. Solo hidromórfico.; Campo Rupestre Quartzítico","1192","1192"
"14","2020-12-11 11:45:33-03","UFMG","BHCB","198206","PreservedSpecimen","Plantae","Monocotyledon","Xyridaceae","Xyris","cervii","Xyris cervii","E.D.Lozano & Wand.",NA,"2018","04","19","Paratypus","Wanderley, MGL","s.n.","1978","07","04","Brasil","Minas Gerais","Santana do Riacho","Serra do Cipó, Km 98 ao longo da rodovia Belo Horizonte - Conceição do Mato Dentro","-43.714444","-19.168889",NA,"BHCB198206","BHCB198206",NA,"Southern America","-43.714444","-19.168889","CFSC5487",NA,NA
"15","2020-12-11 11:45:33-03","UFMG","BHCB","48577","PreservedSpecimen","Plantae","Monocotyledon","Xyridaceae","Xyris","cervii","Xyris cervii","E.D.Lozano & Wand.",NA,"2018","12",NA,NA,"Nogueira, MM; et al.","s.n.","1999","07","10","Brasil","Minas Gerais","São Gonçalo do Rio Preto","Parque Estadual do Rio Preto.","-43.3908004760742","-18.0041999816895","26697","BHCB049157",NA,"auto","Southern America",NA,NA,"Flores amarelas, erva; Campo rupestre",NA,NA
"16","2016-07-25 15:01:53-03","UNIOESTE","UNOP","3298","S","Plantae",NA,"Xyridaceae","Xyris","cervii","Xyris cervii","E.D. Lozano & Wand.","Lozano, E.D.","2016","02","25",NA,"Liesenfeld, V.; Souza, T.; Cavali, A.P.; Bernardon, E.; Silva, S.M.; Souza, T.; Cavali, A.P.; Bernardon, E.; Silva, S.M.","7","2015","03","26","Brasil","Paraná","Tibagi","Parque Estadual do Guartelá","-50.4136009216309","-24.5093994140625","56988",NA,NA,"auto",NA,NA,NA,"Herbácea. Folhas dísticas, lâminas foliares achatadas, inflorescência castanho-clara.",NA,NA
"17","2019-11-21 10:19:55-03","IBt","SP","244719","S","Plantae",NA,"Xyridaceae","Xyris","cervii","Xyris cervii","E.D.Lozano & Wand.","Wanderley, MGL","2018","04","19","Paratype","Heringer, EP; Castellanos, A","22007","1958","03","03","Brasil","Minas Gerais",NA,"Serra do Cipó",NA,NA,NA,"SP003978","SP003978",NA,NA,NA,NA,NA,NA,NA
"18","2019-11-21 10:19:55-03","IBt","SP","467910","S","Plantae",NA,"Xyridaceae","Xyris","cervii","Xyris cervii","E.D.Lozano & Wand.","Wanderley, MGL","2018","04","06","Isotype","Lozano, ED; Saridakis, DP","2682","2014","03","11","Brasil","Paraná","Ponta Grossa","Capão da Onça. Faz. Pinheirinhos","-50.025278","-25.102222",NA,"SP003974","SP003974",NA,NA,"-50.025278","-25.102222",NA,NA,NA
"19","2019-11-21 10:19:55-03","IBt","SP","467911","S","Plantae",NA,"Xyridaceae","Xyris","cervii","Xyris cervii","E.D.Lozano & Wand.","Wanderley, MGL","2018","04","19","Paratype","Lozano, ED; Saridakis, DP","2642","2014","03","11","Brasil","Paraná","Ponta Grossa","Parque Nacional dos Campos Gerais, Cachoeira São Jorge","-50.055556","-25.034444",NA,"SP003977","SP003977",NA,NA,"-50.055556","-25.034444",NA,NA,NA
"20","2019-11-21 10:19:55-03","IBt","SP","154389","S","Plantae",NA,"Xyridaceae","Xyris","cervii","Xyris cervii","E.D.Lozano & Wand.","Wanderley, MGL","2018","04","19","Paratype","Wanderley, MGL","CFSC5487","1978","07","04","Brasil","Minas Gerais","Santana do Riacho","Serra do Cipó, Km 98 da rodovia Belo Horizonte - Conceição do Mato Dentro","-43.7144012451172","-19.1688995361328","26557","SP003976","SP003976","auto",NA,NA,NA,NA,NA,NA
"21","2019-11-21 10:19:55-03","IBt","SP","499919","S","Plantae",NA,"Xyridaceae","Xyris","cervii","Xyris cervii","E.D.Lozano & Wand.","Wanderley, MGL","2018","06","05","Paratype","Silva, GO; et al.","31","2008","01","20","Brasil","Minas Gerais","Santana do Riacho","Serra do Cipó, Trilha da Vellozia gigantea","-43.7144012451172","-19.1688995361328","26557","SP004046","SP004046","auto",NA,NA,NA,NA,NA,NA
"22","2019-11-21 10:19:55-03","IBt","SP","499918","S","Plantae",NA,"Xyridaceae","Xyris","cervii","Xyris cervii","E.D.Lozano & Wand.","Wanderley, MGL","2016","09","14","Paratype","Silva, GO; et al.","32","2008","01","20","Brasil","Minas Gerais","Santana do Riacho","Serra do Cipó, Trilha da Vellozia gigantea","-43.7144012451172","-19.1688995361328","26557","SP004042","SP004042","auto",NA,NA,NA,NA,NA,NA
"23","2021-01-21 15:30:05-03","IBt","SP","498058","S","Plantae",NA,"Xyridaceae","Xyris","cervii","Xyris cervii","E.D.Lozano & Wand.",NA,NA,NA,NA,NA,"Mota, NFO","884","2007","09","09","Brasil","Minas Gerais","São Gonçalo do Rio Preto",NA,"-43.3908004760742","-18.0041999816895","26697",NA,NA,"auto",NA,NA,NA,NA,NA,NA
"24","2021-01-21 15:30:05-03","IBt","SP","497959","S","Plantae",NA,"Xyridaceae","Xyris","cervii","Xyris cervii","E.D.Lozano & Wand.",NA,NA,NA,NA,NA,"Mota, NFO","818","2007","07","11","Brasil","Minas Gerais","São Gonçalo do Rio Preto",NA,"-43.3908004760742","-18.0041999816895","26697",NA,NA,"auto",NA,NA,NA,NA,NA,NA
"25","2021-01-21 15:30:05-03","IBt","SP","497958","S","Plantae",NA,"Xyridaceae","Xyris","cervii","Xyris cervii","E.D.Lozano & Wand.",NA,NA,NA,NA,NA,"Mota, NFO","1405","2008","08","29","Brasil","Minas Gerais","São Gonçalo do Rio Preto",NA,"-43.3908004760742","-18.0041999816895","26697",NA,NA,"auto",NA,NA,NA,NA,NA,NA
"26","2019-11-21 10:19:55-03","IBt","SP","396422","S","Plantae",NA,"Xyridaceae","Xyris","cervii","Xyris cervii","E.D.Lozano & Wand.","Wanderley, MGL","2018","04","19","Paratype","Wanderley, MGL; et al.","2579","2007","05","22","Brasil","Minas Gerais","São Gonçalo do Rio Preto","Parque Estadual do Rio Preto, Subida para Chapada do Couto","-43.3908004760742","-18.0041999816895","26697","SP003975","SP003975","auto",NA,NA,NA,NA,NA,NA
"27","2021-01-07 09:34:38-03","IBt","SP","453952","S","Plantae",NA,"Xyridaceae","Xyris","cervii","Xyris cervii","E.D.Lozano & Wand.",NA,NA,NA,NA,"Paratype","Lozano, ED","2516","2013","12","20","Brasil","Paraná","Ponta Grossa",NA,"-50.1618995666504","-25.0949993133545","46557",NA,NA,"auto",NA,NA,NA,NA,NA,NA
"28","2020-10-22 10:13:55-03","IBt","SP","345120","S","Plantae",NA,"Xyridaceae","Xyris","cervii","Xyris cervii","E.D.Lozano & Wand.",NA,NA,NA,NA,"Paratype","Prata, AP","863","2000","04","26","Brasil","São Paulo","Itararé",NA,"-49.3400001525879","-24.1100006103516","27729",NA,NA,"auto",NA,NA,NA,NA,NA,NA
