"record_id","modified","institutionCode","collectionCode","catalogNumber","basisOfRecord","kingdom","phylum","order","family","genus","specificEpithet","scientificName","scientificNameAuthorship","identifiedBy","recordedBy","recordNumber","year","month","day","continentOcean","country","stateProvince","county","locality","decimalLongitude","decimalLatitude","minimumElevationInMeters","maximumElevationInMeters","preparationType","occurrenceRemarks","barcode","imagecode","yearIdentified","monthIdentified","dayIdentified","coordinatePrecision","geoFlag","verbatimLongitude","verbatimLatitude","class","typeStatus"
"1","2021-03-15 16:37:00-03","NY","NYBG","777538","PreservedSpecimen","Plantae","Magnoliophyta","Alismatales","Araceae","Anthurium","organense","Anthurium organense","Engl.","M. A. Nadruz Coelho","G. Martinelli","8687","1982","09","16","South America","Brazil","Rio de Janeiro","Macaé","Pico do Frado de Macé","-41.7867","-22.3708","1000","1200","sheet","<a href='http://sweetgum.nybg.org/science/vh/specimen_details.php?irn=112377' target='other'> <mi>dwc_moreinfo</mi></a>","NY00777538","NY00777538_01",NA,NA,NA,NA,NA,NA,NA,NA,NA
"2","2021-03-30 12:51:16-03","EAO","IAN","72884","PreservedSpecimen","Plantae","Monocotiledônea",NA,"Araceae","Anthurium","organense","Anthurium organense","Engl.",NA,"Sch","2873",NA,NA,NA,"Southern America","Brasil",NA,NA,NA,NA,NA,NA,NA,NA,NA,"IAN072884",NA,NA,NA,NA,NA,NA,NA,NA,NA,NA
"3","2019-09-27 18:03:37-03","UFES","VIES","34043","S","Plantae",NA,NA,"Araceae","Anthurium","organense","Anthurium organense","Engl.","R.T. Valadares","Zorzanelli, J.P.F.","1058","2014","07","19",NA,"Brasil","Espírito Santo","Iúna","Serra do Valentim.","-41.5358009338379","-20.3458003997803","1520","1520",NA,NA,"VIES034043","VIES034043","2018","12","17","32198","auto",NA,NA,NA,NA
"4","2015-01-24 13:40:00-02","MO","MOBOT","2788257","PreservedSpecimen","Plantae",NA,NA,"Araceae","Anthurium","organense","Anthurium organense","Engl.",NA,"Gustavo Martinelli","Martinelli 13364","1989","6","28","South America","Brazil","Rio de Janeiro",NA,"Santa Maria Masteno, Parque Estadual do Retengono, Pedra do Desengano, campos de altitude e transiap para mata de altitude.",NA,NA,"1800.00000000","1850.00000000",NA,NA,NA,NA,NA,NA,NA,NA,NA,NA,NA,NA,NA
"5","2008-05-27 22:02:00-03","MO","MOBOT","2982593","PreservedSpecimen","Plantae",NA,NA,"Araceae","Anthurium","organense","Anthurium organense","Engl.","L.G. Temponi","* TEMPONI","TEMPONI 347","2004","6","15","South America","Brazil","Rio de Janeiro",NA,"Nova Friburgo: Pico da Caledônea. Estrada calçada para o alto da montanha, próximo à queda d'água.","-42.58611","-22.34583","1696.00000000",NA,NA,NA,NA,NA,NA,NA,NA,NA,NA,NA,NA,NA,NA
"6","2010-07-23 16:42:00-03","MO","MOBOT","3004964","PreservedSpecimen","Plantae",NA,NA,"Araceae","Anthurium","organense","Anthurium organense","Engl.","A. Engler","J.H.R. Schenck","Schenck 2873","1887",NA,NA,"South America","Brazil",NA,NA,NA,NA,NA,NA,NA,NA,NA,NA,NA,NA,NA,NA,NA,NA,NA,NA,NA,NA
"7","2015-01-24 13:40:00-02","MO","MOBOT","375968","PreservedSpecimen","Plantae",NA,NA,"Araceae","Anthurium","organense","Anthurium organense","Engl.","T. Croat","Gustavo Martinelli","Martinelli 13156","1988","10","5","South America","Brazil","Rio de Janeiro",NA,"Santo Paris Modsleno (handwritten label very hard to decipher!)",NA,NA,"1800.00000000",NA,NA,NA,NA,NA,NA,NA,NA,NA,NA,NA,NA,NA,NA
"8","2018-12-10 13:05:00-02","MO","MOBOT","101087716","PreservedSpecimen","Plantae",NA,NA,"Araceae","Anthurium","organense","Anthurium organense","Engl.",NA,"Gustavo Martinelli|Cyl Farney","Martinelli 8687",NA,NA,NA,"South America","Brazil","Rio de Janeiro","Macaé",NA,"-41.7868995666504","-22.3708000183105",NA,NA,NA,NA,NA,NA,NA,NA,NA,"47209","auto",NA,NA,NA,NA
"9","2018-12-10 13:05:00-02","MO","MOBOT","101087712","PreservedSpecimen","Plantae",NA,NA,"Araceae","Anthurium","organense","Anthurium organense","Engl.",NA,"Gustavo Martinelli","Martinelli 2509",NA,NA,NA,"South America","Brazil","Rio de Janeiro","Nova Friburgo",NA,"-42.5311012268066","-22.2819004058838",NA,NA,NA,NA,NA,NA,NA,NA,NA,"33190","auto",NA,NA,NA,NA
"10","2020-05-02 04:38:00-03","MO","MOBOT","101088999","PreservedSpecimen","Plantae",NA,NA,"Araceae","Anthurium","organense","Anthurium organense","Engl.",NA,"Lívia G. Temponi|et al.","Temponi 347",NA,NA,NA,"South America","Brazil","Rio de Janeiro","Nova Friburgo",NA,"-42.5311012268066","-22.2819004058838",NA,NA,NA,NA,NA,NA,NA,NA,NA,"33190","auto",NA,NA,NA,NA
"11","2017-02-01 11:30:57-02","UNIOESTE","UNOP","4201","S","Plantae",NA,NA,"Araceae","Anthurium","organense","Anthurium organense","Engl.","Temponi, L.G.","Temponi, L.G.; Calió, M.F.A.; Frozza, R.C.; Mello-Silva, R.; Calió, M.F.A.; Frozza, R.C.; Mello-Silva, R.","347","2004","06","15",NA,"Brasil","Rio de Janeiro","Nova Fribugo","Pico da Caledônea. Estrada calçada para o alto da montanha.","-42","-22","1696","1696",NA,"Erva, terrestre. Caule ereto, catáfilo fibroso. Pecíolo e pedunculo cilíndricos, lâmina cartácea leve discolor, nervura levemente saliente na face abaxial e leve marcada na face adaxial. Espata vinácea espádice vinho, estípite verde, base do pedúncul",NA,NA,"2016","11","03",NA,NA,"-42","-22",NA,NA
"12","2015-10-22 10:02:28-02","UNIOESTE","UNOP","6939","S","Plantae",NA,NA,"Araceae","Anthurium","organense","Anthurium organense","Engl.","Temponi, L.G.","Temponi, L.G.; et al.; et al.","985","2011","04","13",NA,"Brasil","Rio de Janeiro","Teresópolis","Parque Nacional da Serra dos Órgãos. Base de acampamento, no final para trilha para a Pedra do Sino.","-42.9655990600586","-22.4122009277344",NA,NA,NA,"Área de campo de altitude. Erva terrestre. Nervura principal levemente proeminente em ambas as faces, estípete e espata esverdeados e espádice vináceo.",NA,NA,"2011","04",NA,"38539","auto",NA,NA,NA,NA
"13","2020-06-15 15:28:33-03","UNESP-RC","HRCB","58977","PreservedSpecimen","Plantae",NA,NA,"Araceae","Anthurium","organense","Anthurium organense","Engl.","Temponi, L.G.","Grupo Vermelho (Araújo, D.; Lautert, M.; Lopes, N.; Moreira, S.N. & Temponi, L.)","93","2012","10","25",NA,"Brasil","Rio de Janeiro","Teresópolis","Pedra do Sino","-43.03105","-22.46225","2248","2248",NA,"Terrestre. Pecíolo levemente sulcado. Folhas cartáceas verdes em ambas as faces. Nervura central saliente em ambas as faces. Pedúnculo, espata e estipe vináceos. Espádice vinho.",NA,NA,NA,NA,NA,NA,NA,"43º01.863'W","22º27.735'S",NA,NA
"14","2019-09-04 18:43:00-03","F","FMNH-SEEDPLANTS",NA,"PreservedSpecimen","Plantae","Spermatophyta",NA,"Araceae","Anthurium","organense","Anthurium organense",NA,NA,"J. H. R. Schenck","2873","1887","2","26","South America","Brazil",NA,NA,NA,"-52.8731","-10.8339",NA,NA,NA,NA,NA,NA,NA,NA,NA,NA,NA,NA,NA,"Monocotyledoneae","Type [status unknown]"
"15","2019-11-21 09:59:10-03","IBt","SP","490810","S","Plantae",NA,NA,"Araceae","Anthurium","organense","Anthurium organense","Engl.","Nadruz, M","Baez, C; et al.","880","2016","08","25",NA,"Brasil","Rio de Janeiro","Santa Maria Madalena","Parque Estadual do Desengano, Pico do Desengano.","-41.911667","-21.9","1758","1758",NA,NA,"SP049290","SP049290","2016","10","03",NA,NA,"-41.911667","-21.9",NA,NA
