X,Y,record_id,modified,institutionCode,collectionCode,catalogNumber,basisOfRecord,kingdom,family,genus,specificEpithet,scientificName,scientificNameAuthorship,identifiedBy,yearIdentified,monthIdentified,dayIdentified,recordedBy,year,month,day,country,stateProvince,county,locality,decimalLongitude,decimalLatitude,verbatimLongitude,verbatimLatitude,minimumElevationInMeters,maximumElevationInMeters,occurrenceRemarks,barcode,imagecode,phylum,order,typeStatus,recordNumber,continentOcean,coordinatePrecision,preparationType,geoFlag,class,individualCount,NM_MUNICIP,CD_GEOCMU
-45.36,-23.45,"9",2020-11-04 11:03:01-03,ESALQ,ESA,"79246",PreservedSpecimen,Plantae,Begoniaceae,Begonia,itatinensis,Begonia itatinensis,Irmsh. ex Brade,"Souza, V.C.",NA,NA,NA,"Souza, J.P.; Scalon, V.R.; Siqueira, L.P.; Souza, S.C.P.M.; Sorreano, M.C.M.; Buchianeri, V.C.; Rodrigues, R.R.; Souza, V.C.; Tamashiro, J.Y.","2000","04","20",Brasil,São Paulo,São Sebastião,"Parque Estadual da Serra do Mar, Trilhas das Cachoeiras do Ribeirão Itu. Floresta Ombrófila Densa. Interior de mata.",-45.36,-23.45,"-45.36","-23.45",NA,NA,"Erva com ramos pendentes, frutos róseos",ESA079246,ESA079246,Magnoliophyta,NA,NA,"3314.0",NA,NA,NA,NA,NA,NA,NATIVIDADE DA SERRA,"3532306"
-45.36,-23.45,"10",2020-11-04 11:03:01-03,ESALQ,ESA,"79249",PreservedSpecimen,Plantae,Begoniaceae,Begonia,itatinensis,Begonia itatinensis,Irmsh. ex Brade,"Souza, J.P.",NA,NA,NA,"Souza, J.P.; Scalon, V.R.; Siqueira, L.P.; Souza, S.C.P.M.; Sorreano, M.C.M.; Buchianeri, V.C.; Rodrigues, R.R.; Souza, V.C.; Tamashiro, J.Y.","2000","04","20",Brasil,São Paulo,São Sebastião,"Parque Estadual da Serra do Mar, Trilhas das Cachoeiras do Ribeirão Itu. Floresta Ombrófila Densa. Interior de mata",-45.36,-23.45,"-45.36","-23.45","600","600","Erva, flores (masculinas e femininas no mesmo ramo) alvas, frutos róseos",ESA079249,ESA079249,Magnoliophyta,NA,NA,"3349.0",NA,NA,NA,NA,NA,NA,NATIVIDADE DA SERRA,"3532306"
-46.9900016784668,-24.3199996948242,"35",2020-12-21 16:18:01-03,MBM,MBM,"144873",PreservedSpecimen,Plantae,Begoniaceae,Begonia,itatinensis,Begonia itatinensis,Irmscher ex Brade,"Sobral, M.",NA,NA,NA,"Sobral, M.; et al.; et al.","1991","01",NA,Brazil,São Paulo,Peruíbe,Parque Estadual da Juréia,-46.9900016784668,-24.3199996948242,NA,NA,NA,NA,NA,MBM144873,MBM144873,NA,NA,NA,"6664",Southern America,"21922",NA,auto,NA,NA,PERUÍBE,"3537602"
-46.9900016784668,-24.3199996948242,"41",2020-06-15 15:29:00-03,UNESP-RC,HRCB,"15400",PreservedSpecimen,Plantae,Begoniaceae,Begonia,itatinensis,Begonia itatinensis,Irmsch. ex Brade,"Sobral, M.","1991",NA,NA,"Sobral, M.","1991","01",NA,Brasil,São Paulo,Peruíbe,Parque Estadual da Juréia,-46.9900016784668,-24.3199996948242,NA,NA,NA,NA,"Erva ereta até 1m, em interior de mata, ocorrendo em grande densidade no local; flores brancas, frutos imaturos.",NA,NA,NA,NA,NA,"6664",NA,"21922",NA,auto,NA,NA,PERUÍBE,"3537602"
-46.6300010681152,-23.5400009155273,"54",2021-03-16 18:32:00-03,USP,SPF,"83022",PreservedSpecimen,Plantae,Begoniaceae,Begonia,adiantiformis,Begonia adiantiformis,Toledo,"Handro, O","1957","06",NA,"Gehrt, A","1943","10","22",Brasil,São Paulo,São Paulo,"Jardim Botânico de São Paulo, Cultivada proveniente de Ubatuba, São Paulo.",-46.6300010681152,-23.5400009155273,NA,NA,NA,NA,Planta arbustiforme. Flores alvas.,SPF00083022,SPF00083022,NA,NA,isotype,s.n.,NA,"53584",NA,auto,NA,NA,SÃO PAULO,"3550308"
-45.8400001525879,-23.5300006866455,"57",2019-10-07 09:24:03-03,UEFS,HUEFS,"189724",PreservedSpecimen,Plantae,Begoniaceae,Begonia,itatinensis,Begonia itatinensis,Irmsch. ex Brade,NA,NA,NA,NA,"Silva, S.J.G.da","1991","12","28",Brasil,São Paulo,Salesópolis,"Km 31,5 da estrada da Petrobrás, sentido Caraguatatuba, margem do rio Pardo.",-45.8400001525879,-23.5300006866455,NA,NA,NA,NA,NA,HUEFS0189724,HUEFS0189724,Angiospermae,Cucurbitales,NA,"294",NA,"18032",NA,auto,Rosanae,NA,SALESÓPOLIS,"3545001"
-46.9900016784668,-24.3199996948242,"81",2021-02-08 12:38:47-03,UFRGS,ICN,"090709",S,Plantae,Begoniaceae,Begonia,itatinensis,Begonia itatinensis,Irmsch. ex Brade,"Sobral, M","1991",NA,NA,"Sobral, M; Attili, D","1991","01",NA,Brasil,SP,Peruíbe,Parque Nacional da Juréia,-46.9900016784668,-24.3199996948242,NA,NA,NA,NA,"Erva ereta até 1m altura; flores brancas; frutos imaturos.; Região de mata atlântica; interior de mata; ocorre em grande densidade no local.",NA,NA,Dicotyledon,NA,NA,"6664",América do Sul,"21922",NA,auto,NA,NA,PERUÍBE,"3537602"
-45.8400001525879,-23.5300006866455,"94",2019-11-21 10:01:49-03,IBt,SP,"252556",S,Plantae,Begoniaceae,Begonia,itatinensis,Begonia itatinensis,Irmsch. ex Brade,"Smith, SF","1997","06","20","Gomes da Silva, SJ; Piacentin, EP","1991","12","28",Brasil,São Paulo,Salesópolis,"km 31,5 da Estrada de Petrobrás, sentido Caraguatatuba, margem do Rio Pardo",-45.8400001525879,-23.5300006866455,NA,NA,NA,NA,"Subarbusto escandente 0,4-1,2m alt., caules e ramos avermelhados quando jovens, depois pardacentos. Folhas verdes levemente discolores; estípulas verdes; brácteas hialinas, pedicelos e tépalas alvas, estigmas amarelos. Frutos jovens verdes passando a",NA,NA,NA,NA,NA,"294",NA,"18032",NA,auto,NA,NA,SALESÓPOLIS,"3545001"
