"record_id","modified","institutionCode","collectionCode","catalogNumber","basisOfRecord","kingdom","phylum","order","family","genus","specificEpithet","scientificName","scientificNameAuthorship","identifiedBy","recordedBy","recordNumber","year","month","day","continentOcean","country","stateProvince","county","locality","decimalLongitude","decimalLatitude","preparationType","occurrenceRemarks","barcode","imagecode","minimumElevationInMeters","maximumElevationInMeters","yearIdentified","coordinatePrecision","geoFlag","class","typeStatus","verbatimLongitude","verbatimLatitude","monthIdentified","dayIdentified","fieldNumber","individualCount"
"1","2021-03-15 16:37:00-03","NY","NYBG","503208","PreservedSpecimen","Plantae","Magnoliophyta","Poales","Xyridaceae","Xyris","hatschbachii","Xyris hatschbachii","L.B.Sm. & Downs","R. Kral","R. Kummrow","2431","1983","11","18","South America","Brazil","Paraná","Campo Largo","Serra do Puruna","-49.5281","-25.4586","sheet","<a href='http://sweetgum.nybg.org/science/vh/specimen_details.php?irn=64740' target='other'> <mi>dwc_moreinfo</mi></a>","NY00503208","NY00503208_01",NA,NA,NA,NA,NA,NA,NA,NA,NA,NA,NA,NA,NA
"2","2021-03-15 16:37:00-03","NY","NYBG","503207","PreservedSpecimen","Plantae","Magnoliophyta","Poales","Xyridaceae","Xyris","hatschbachii","Xyris hatschbachii","L.B.Sm. & Downs","L. B. Smith","R. Reitz","17483","1965","12","12","South America","Brazil","Paraná","Ponta Grossa","Rodovia do Café, Rio Tibagi","-49.891776","-25.299294","sheet","<a href='http://sweetgum.nybg.org/science/vh/specimen_details.php?irn=64741' target='other'> <mi>dwc_moreinfo</mi></a>","NY00503207","NY00503207_01","900","900",NA,NA,NA,NA,NA,NA,NA,NA,NA,NA,NA
"3","2020-06-29 11:32:53-03","UFRJ","RFA","11185","PreservedSpecimen","Plantae",NA,NA,"Xyridaceae","Xyris","hatschbachii","Xyris hatschbachii","L.B.Sm. & Downs","L.B. Smith; Downs","P. Occhioni","4762","1971","11","09",NA,"Brasil","Paraná","Ponta Grossa","Vila Velha","-50.1618995666504","-25.0949993133545",NA,"25 cm altura, flor amarela","RFA32058",NA,NA,NA,"1975","46557","auto",NA,NA,NA,NA,NA,NA,NA,NA
"4","2020-02-08 10:21:02-03","NBC","NL-BOTANY","L.1429569","PreservedSpecimen","Plantae",NA,"Poales","Xyridaceae","Xyris","hatschbachii","Xyris hatschbachii","L.B.Sm. & Downs",NA,"Düsen P",NA,"1906","02","11","Southern America","Brazil",NA,NA,"Sao Paulo - Campos de Bocains i la Vacca Cahio.",NA,NA,NA,"<a href=https://data.biodiversitydata.nl/naturalis/specimen/L.1429569 target=other class=eLink> <mi>dwc_moreinfo</mi></a>","NL-L1429569","NL-L1429569",NA,NA,NA,NA,NA,"Magnoliopsidae",NA,NA,NA,NA,NA,NA,NA
"5","2019-08-27 13:26:43-03","IAP","PACA-AGP","36939","PreservedSpecimen","Plantae","Magnoliophyta","Commelinales","Xyridaceae","Xyris","hatschbachii","Xyris hatschbachii","Smith & Downs","Smith & Downs","Hatschbach, G.","828","1948","01","06",NA,"Brasil","PR","Campo Largo","Purunã","-49.5283012390137","-25.4585990905762",NA,"Há possibilidade de ser um Typus. Aguardar referências.&nf;Lozano: In. Proc. Ciol. Soc. Wash, 73:248(1960) Habitat: in paludosis Fenofase: flor","PACA036939","PACA036939",NA,NA,"1960","53742","auto","Liliopsida","Holotipo",NA,NA,NA,NA,NA,NA
"6","2021-03-16 17:54:43-03","UCS","HUCS","28342","PreservedSpecimen","Plantae","Angiospermae","Poales","Xyridaceae","Xyris","hatschbachii","Xyris hatschbachii","L. B. Sm. & Downs","Lozano, E.D.","Dombrowski, L.T.","14013","1989","11","22",NA,"Brasil","Paraná","Palmeira","Fazenda Santa Rita","-50.0064010620117","-25.4293994903564",NA,"Herbário MBM; rupestre",NA,NA,NA,NA,"2015","35166","auto",NA,NA,NA,NA,NA,NA,NA,NA
"7","2019-08-16 08:41:25-03","UTFPR","HCF","20982","S","Plantae",NA,NA,"Xyridaceae","Xyris","hatschbachii","Xyris hatschbachii","L.B.Sm. & Downs","E.D. Lozano","E.D. Lozano","2198","2013","12","10",NA,"Brasil","PR","Palmeira","Recanto dos Papagaios","-49.768056","-25.465833",NA,"isolada. 30 cm, flores amarelas murchas, afloramentos rochosos, pouco frequente.",NA,NA,NA,NA,"2014",NA,NA,NA,NA,"49°46'05 W","25°27'57 S",NA,NA,NA,NA
"8","2019-08-16 08:41:25-03","UTFPR","HCF","20981","S","Plantae",NA,NA,"Xyridaceae","Xyris","hatschbachii","Xyris hatschbachii","L.B.Sm. & Downs","E.D. Lozano","E.D. Lozano","2447","2013","12","18",NA,"Brasil","PR","Ponta Grossa","Parque Estadual de Vila Velha","-49.991667","-25.2475",NA,"Isolada e cespitosa, 20-50 cm, flores amarelas, campo semi-hidromórfico.",NA,NA,NA,NA,"2014",NA,NA,NA,NA,"49°59'30 W","25°14'51 S",NA,NA,NA,NA
"9","2019-08-16 08:41:25-03","UTFPR","HCF","20980","S","Plantae",NA,NA,"Xyridaceae","Xyris","hatschbachii","Xyris hatschbachii","L.B.Sm. & Downs","E.D. Lozano","E.D. Lozano","2357","2013","12","14",NA,"Brasil","PR","Lapa","Parque Estadual da Gruta do Monge","-49.700278","-25.7725",NA,"isolada ou cespitosa, 40 cm, flores amarelas, campo higrófilo, solo arenoso.",NA,NA,NA,NA,NA,NA,NA,NA,NA,"49°42'01 W","25°46'21 S",NA,NA,NA,NA
"10","2019-08-16 08:41:25-03","UTFPR","HCF","5175","S","Plantae",NA,NA,"Xyridaceae","Xyris","hatschbachii","Xyris hatschbachii","L.B.Sm. & Downs","E.D. Lozano","L.T. Dombrowski","14444","1990","12","20",NA,"Brasil","PR","Palmeira","Fazenda Santa Rita","-50.0064010620117","-25.4293994903564",NA,"nas depressões úmidas, próximas aos afloramentos de arenito.",NA,NA,NA,NA,"2015","35166","auto",NA,NA,NA,NA,NA,NA,NA,NA
"11","2019-11-15 20:23:39-03","UTFPR","HCF","29641","S","Plantae",NA,NA,"Xyridaceae","Xyris","hatschbachii","Xyris hatschbachii","L.B.Sm. & Downs","O.A. Guimarães","A.C. Cervi","4014","1992","12","23",NA,"Brasil","PR","Tibagi","Guartelá","-50.4136009216309","-24.5093994140625",NA,"erva ereta. Flores amarelas. Lugares úmidos.",NA,NA,NA,NA,"1998","56988","auto",NA,NA,NA,NA,"10",NA,NA,NA
"12","2020-12-21 16:47:46-03","MBM","MBM","401633","PreservedSpecimen","Plantae",NA,NA,"Xyridaceae","Xyris","hatschbachii","Xyris hatschbachii","L.B. Sm. & Downs","Lozano, E.D.","Lozano, E.D.","2151","2013","12","04","Southern America","Brazil","Paraná","Balsa Nova","São Luís do Purunã, Próximo a Pousada Cainã","-49.724444","-25.438611",NA,"Isolada, 30 cm, flores amarelas, Próximo a afloramento rochoso, população pequena.; Campos Gerais.","MBM401633","MBM401633",NA,NA,"2014",NA,NA,NA,NA,"-49.724444","-25.438611",NA,NA,NA,NA
"13","2020-12-21 16:47:46-03","MBM","MBM","401636","PreservedSpecimen","Plantae",NA,NA,"Xyridaceae","Xyris","hatschbachii","Xyris hatschbachii","L.B. Sm. & Downs","Lozano, E.D.","Lozano, E.D.; Engels, M.E.; Engels, M.E.","2357","2013","12","14","Southern America","Brazil","Paraná","Lapa","Parque Estadual do Monge, arredores","-49.700278","-25.7725",NA,"Isolada ou cespitosa, 40 cm, flores amarelas, campo higrófilo, solo arenoso.; Campos Gerais.","MBM401636","MBM401636",NA,NA,"2014",NA,NA,NA,NA,"-49.700278","-25.7725",NA,NA,NA,NA
"14","2020-12-21 16:47:46-03","MBM","MBM","401638","PreservedSpecimen","Plantae",NA,NA,"Xyridaceae","Xyris","hatschbachii","Xyris hatschbachii","L.B. Sm. & Downs","Lozano, E.D.","Lozano, E.D.","2478","2013","12","19","Southern America","Brazil","Paraná","Palmeira","Fazenda Boiada","-49.8625","-25.285556",NA,"Isolada ou cespitosa, 25-40 cm, flores amarelas, campo semi-hidromorfico, solo arenoso.; Campos Gerais.","MBM401638","MBM401638",NA,NA,"2014",NA,NA,NA,NA,"-49.8625","-25.285556",NA,NA,NA,NA
"15","2020-12-21 16:47:46-03","MBM","MBM","401641","PreservedSpecimen","Plantae",NA,NA,"Xyridaceae","Xyris","hatschbachii","Xyris hatschbachii","L.B. Sm. & Downs","Lozano, E.D.","Lozano, E.D.; Saridakis, D.P.; Saridakis, D.P.","1886","2013","11","26","Southern America","Brazil","Paraná","Piraí do Sul","Chácara Santa Rita da Serra","-50.028333","-24.466389",NA,"Isolada, 40 cm, espiga jovem, flores amarelas, campo úmido.; Campos Gerais.","MBM401641","MBM401641",NA,NA,"2014",NA,NA,NA,NA,"-50.028333","-24.466389",NA,NA,NA,NA
"16","2020-12-21 16:47:46-03","MBM","MBM","401643","PreservedSpecimen","Plantae",NA,NA,"Xyridaceae","Xyris","hatschbachii","Xyris hatschbachii","L.B. Sm. & Downs","Lozano, E.D.","Lozano, E.D.; Saridakis, D.P.; Saridakis, D.P.","1969","2013","11","27","Southern America","Brazil","Paraná","Piraí do Sul","Pousada Pirahy da Serra, no entorno","-50.020278","-24.466944",NA,"Isolada, 40 cm, flores amarelas, campo úmido, pouco frequente.; Campos Gerais.","MBM401643","MBM401643",NA,NA,"2014",NA,NA,NA,NA,"-50.020278","-24.466944",NA,NA,NA,NA
"17","2020-12-21 16:47:46-03","MBM","MBM","401644","PreservedSpecimen","Plantae",NA,NA,"Xyridaceae","Xyris","hatschbachii","Xyris hatschbachii","L.B. Sm. & Downs","Lozano, E.D.","Lozano, E.D.; Saridakis, D.P.; Saridakis, D.P.","1993","2013","11","28","Southern America","Brazil","Paraná","Piraí do Sul","Fazenda Esterco, Propriedade da Iguaçu Celulose","-50.008056","-24.425833",NA,"Isolada, 30 cm, espiga jovem, campo úmido, solo arenoso.; Campos Gerais.","MBM401644","MBM401644",NA,NA,"2014",NA,NA,NA,NA,"-50.008056","-24.425833",NA,NA,NA,NA
"18","2020-12-21 16:47:46-03","MBM","MBM","401646","PreservedSpecimen","Plantae",NA,NA,"Xyridaceae","Xyris","hatschbachii","Xyris hatschbachii","L.B. Sm. & Downs","Lozano, E.D.","Lozano, E.D.; Damasceno, B.; Damasceno, B.","2522","2013","12","20","Southern America","Brazil","Paraná","Ponta Grossa","PARNA dos Campos Gerais, Cachoeira da Mariquinha","-49.9525","-25.195",NA,"Isolada, 40 cm, flores amarelas, local úmido em afloramento rochoso.; Campos Gerais.","MBM401646","MBM401646",NA,NA,"2014",NA,NA,NA,NA,"-49.9525","-25.195",NA,NA,NA,NA
"19","2020-12-21 16:47:46-03","MBM","MBM","401647","PreservedSpecimen","Plantae",NA,NA,"Xyridaceae","Xyris","hatschbachii","Xyris hatschbachii","L.B. Sm. & Downs","Lozano, E.D.","Lozano, E.D.; Damasceno, B.; Damasceno, B.","2500","2013","12","20","Southern America","Brazil","Paraná","Ponta Grossa","PARNA dos Campos Gerais, Cachoeira São Jorge","-50.055556","-25.034444",NA,"Isolada ou cespitosa, 50 cm, fores amarelas, campo semi-hidromorfico, margem do Rio São Jorge.; Campos Gerais.","MBM401647","MBM401647",NA,NA,"2014",NA,NA,NA,NA,"-50.055556","-25.034444",NA,NA,NA,NA
"20","2020-12-21 16:47:46-03","MBM","MBM","401649","PreservedSpecimen","Plantae",NA,NA,"Xyridaceae","Xyris","hatschbachii","Xyris hatschbachii","L.B. Sm. & Downs","Lozano, E.D.","Lozano, E.D.; Damasceno, B.; Damasceno, B.","2537","2013","12","21","Southern America","Brazil","Paraná","Tibagi","Parque Estadual do Guartelá","-50.259722","-24.5675",NA,"Cespitosa, 30 cm, flores amarelas, em afloramento rochoso.; Campos Gerais.","MBM401649","MBM401649",NA,NA,"2014",NA,NA,NA,NA,"-50.259722","-24.5675",NA,NA,NA,NA
"21","2020-12-21 16:47:46-03","MBM","MBM","412854","PreservedSpecimen","Plantae",NA,NA,"Xyridaceae","Xyris","hatschbachii","Xyris hatschbachii","L.B. Sm. & Downs","Lozano, E.D.","Völtz, R.R.; Nunes, M.G.; Nunes, M.G.","1473","2017","12","19","Southern America","Brazil","Paraná","Jaguariaíva","Parque Estadual Vale do Codó","-49.694444","-24.268889",NA,"Erva cespitosa formando pequena população em solo arenoso próximo ao canal de drenagem; flores com brácteas marrons e pétalas amarelas.; Estepe Gramíneo-Lenhosa.","MBM412854","MBM412854","840","840","2018",NA,NA,NA,NA,"-49.694444","-24.268889","03","29",NA,NA
"22","2020-12-21 16:47:46-03","MBM","MBM","429471","PreservedSpecimen","Plantae",NA,NA,"Xyridaceae","Xyris","hatschbachii","Xyris hatschbachii","L.B. Sm. & Downs","Lozano, E.D.","Lozano, E.D.; Barboza, E.; Canestraro, B.K.; Barboza, E.; Canestraro, B.K.","4629","2020","01","22","Southern America","Brazil","Santa Catarina","Campo Alegre","Campos do Quiriri","-48.975861","-26.024861",NA,"Herbácea, cespitosa com poucos indivíduos, 30 cm, em campo limpo.; Campo de Altitude.","MBM429471",NA,NA,NA,"2020",NA,NA,NA,NA,"-48.975861","-26.024861",NA,NA,NA,NA
"23","2020-12-21 16:47:46-03","MBM","MBM","429494","PreservedSpecimen","Plantae",NA,NA,"Xyridaceae","Xyris","hatschbachii","Xyris hatschbachii","L.B. Sm. & Downs","Lozano, E.D.","Lozano, E.D.; Martins-Filho, V.S.; Oliveira, A.A.; Silva, A.A.; Martins-Filho, V.S.; Oliveira, A.A.; Silva, A.A.","3608","2017","03","14","Southern America","Brazil","Paraná","Ponta Grossa","Sítio da Família Martins","-50.035444","-25.060333",NA,"Herbácea, isolada, 60 cm, flor amarela, em campo úmido.; Campos Gerais.","MBM429494",NA,NA,NA,"2017",NA,NA,NA,NA,"-50.035444","-25.060333",NA,NA,NA,NA
"24","2020-12-21 16:47:46-03","MBM","MBM","429495","PreservedSpecimen","Plantae",NA,NA,"Xyridaceae","Xyris","hatschbachii","Xyris hatschbachii","L.B. Sm. & Downs","Lozano, E.D.","Lozano, E.D.; Silva, J.M.; Reis-Silva, G.A.; Silva, J.M.; Reis-Silva, G.A.","4088","2018","01","02","Southern America","Brazil","Paraná","Porto Amazonas","Recanto dos Papagaios, no entorno","-49.768806","-25.468361",NA,"Herbácea, cespitosa com poucos indivíduos, 30 cm, flor amarela, em campo úmido próximo a afloramento rochoso. Material fértil coletada de espécime em cultivo. Coletada estéril em campo no dia 23.XI.2017.; Campos Gerais.","MBM429495",NA,NA,NA,"2017",NA,NA,NA,NA,"-49.768806","-25.468361",NA,NA,NA,NA
"25","2020-12-21 16:47:47-03","MBM","MBM","86982","PreservedSpecimen","Plantae",NA,NA,"Xyridaceae","Xyris","hatschbachii","Xyris hatschbachii","L.B. Sm. & Downs","Kral, R.","Kummrow, R.","2431","1983","11","18","Southern America","Brazil","Paraná","Campo Largo","Serra do Purunã","-49.5283012390137","-25.4585990905762",NA,NA,"MBM086982","MBM086982",NA,NA,NA,"53742","auto",NA,NA,NA,NA,NA,NA,NA,NA
"26","2020-12-21 16:47:46-03","MBM","MBM","35975","PreservedSpecimen","Plantae",NA,NA,"Xyridaceae","Xyris","hatschbachii","Xyris hatschbachii","L.B. Sm. & Downs",NA,"Hatschbach, G.; Rodrigues Jr., H.; Rodrigues Jr., H.","828","1948","01","06","Southern America","Brazil","Paraná","Campo Largo","Serra São Luiz do Purunã","-49.5283012390137","-25.4585990905762",NA,"Erva flor amarela. Campo, terreno arenoso; Erva flor amarela.; Campo, terreno arenoso.","MBM035975","MBM035975",NA,NA,NA,"53742","auto",NA,"ISOTYPE",NA,NA,NA,NA,NA,NA
"27","2020-12-21 16:47:46-03","MBM","MBM","401632","PreservedSpecimen","Plantae",NA,NA,"Xyridaceae","Xyris","hatschbachii","Xyris hatschbachii","L.B. Sm. & Downs","Lozano, E.D.","Lozano, E.D.","2134","2013","12","04","Southern America","Brazil","Paraná","Balsa Nova","São Luís do Purunã, Fazenda Tamanduá","-49.714722","-25.538611",NA,"Isolada, 30 cm, flores amarelas, em barranco Próximo a mergem do rio.; Campos Gerais.","MBM401632","MBM401632",NA,NA,"2014",NA,NA,NA,NA,"-49.714722","-25.538611",NA,NA,NA,NA
"28","2020-12-21 16:47:46-03","MBM","MBM","401634","PreservedSpecimen","Plantae",NA,NA,"Xyridaceae","Xyris","hatschbachii","Xyris hatschbachii","L.B. Sm. & Downs","Lozano, E.D.","Lozano, E.D.","2127","2013","12","01","Southern America","Brazil","Paraná","Jaguariaíva","Estrada para o Parque Estadual do Cerrado","-49.683611","-24.207222",NA,"Isolada ou cespitosa, 30 cm, flores amarelas, em afloramento rochoso com solo raso e úmido.; Campos Gerais.","MBM401634","MBM401634",NA,NA,"2014",NA,NA,NA,NA,"-49.683611","-24.207222",NA,NA,NA,NA
"29","2020-12-21 16:47:46-03","MBM","MBM","401635","PreservedSpecimen","Plantae",NA,NA,"Xyridaceae","Xyris","hatschbachii","Xyris hatschbachii","L.B. Sm. & Downs","Lozano, E.D.","Lozano, E.D.; Saridakis, D.P.; Saridakis, D.P.","2062","2013","11","29","Southern America","Brazil","Paraná","Jaguariaíva","Parque Estadual do Cerrado","-49.664722","-24.163889",NA,"Cespitosa, 50 cm, flores amarelas, em afloramento rochoso, solo arenoso.; Cerrado.","MBM401635","MBM401635",NA,NA,"2014",NA,NA,NA,NA,"-49.664722","-24.163889",NA,NA,NA,NA
"30","2020-12-21 16:47:46-03","MBM","MBM","401637","PreservedSpecimen","Plantae",NA,NA,"Xyridaceae","Xyris","hatschbachii","Xyris hatschbachii","L.B. Sm. & Downs","Lozano, E.D.","Lozano, E.D.","2389","2013","12","17","Southern America","Brazil","Paraná","Palmeira","Rodovia BR-376, Km 543, rio lajeado a beira da estrada","-49.811111","-25.374444",NA,"Isolada, 30 cm, flor amarela, margem de rio lajeado.; Campos Gerais.","MBM401637","MBM401637",NA,NA,"2014",NA,NA,NA,NA,"-49.811111","-25.374444",NA,NA,NA,NA
"31","2020-12-21 16:47:46-03","MBM","MBM","401639","PreservedSpecimen","Plantae",NA,NA,"Xyridaceae","Xyris","hatschbachii","Xyris hatschbachii","L.B. Sm. & Downs","Lozano, E.D.","Lozano, E.D.","2454","2013","12","19","Southern America","Brazil","Paraná","Palmeira","Fazenda Santa Rita","-49.820833","-25.316111",NA,"Isolada ou cespitosa, 20-50 cm, flores amarelas, campo semi-hidromórfico.; Campos Gerais.","MBM401639","MBM401639",NA,NA,"2014",NA,NA,NA,NA,"-49.820833","-25.316111",NA,NA,NA,NA
"32","2020-12-21 16:47:46-03","MBM","MBM","401640","PreservedSpecimen","Plantae",NA,NA,"Xyridaceae","Xyris","hatschbachii","Xyris hatschbachii","L.B. Sm. & Downs","Lozano, E.D.","Lozano, E.D.; Engels, M.E.; Engels, M.E.","2198","2013","12","10","Southern America","Brazil","Paraná","Palmeira","Recanto dos Papagaios","-49.768056","-25.465833",NA,"Isolada, 30 cm, flores amarelas murchas, afloramento rochoso, pouco frequente.; Campos Gerais.","MBM401640","MBM401640",NA,NA,"2014",NA,NA,NA,NA,"-49.768056","-25.465833",NA,NA,NA,NA
"33","2020-12-21 16:47:46-03","MBM","MBM","401642","PreservedSpecimen","Plantae",NA,NA,"Xyridaceae","Xyris","hatschbachii","Xyris hatschbachii","L.B. Sm. & Downs","Lozano, E.D.","Lozano, E.D.; Saridakis, D.P.; Saridakis, D.P.","1903","2013","11","26","Southern America","Brazil","Paraná","Piraí do Sul","Chácara Santa Rita da Serra","-50.025","-24.471944",NA,"Isolada, 30 cm, flor amarela murcha, campo úmido, solo arenoso.; Campos Gerais.","MBM401642","MBM401642",NA,NA,"2014",NA,NA,NA,NA,"-50.025","-24.471944",NA,NA,NA,NA
"34","2020-12-21 16:47:46-03","MBM","MBM","401645","PreservedSpecimen","Plantae",NA,NA,"Xyridaceae","Xyris","hatschbachii","Xyris hatschbachii","L.B. Sm. & Downs","Lozano, E.D.","Lozano, E.D.; Saridakis, D.P.; Saridakis, D.P.","2028","2013","11","29","Southern America","Brazil","Paraná","Piraí do Sul","Rodovia PR-151, próximo ao viaduto Joaquim Murtinho","-49.859444","-24.393333",NA,"Cespitosa, 25 cm, espiga jovem, margem de riacho a beira da estrada, solo arenoso.; Campos Gerais.","MBM401645","MBM401645",NA,NA,"2014",NA,NA,NA,NA,"-49.859444","-24.393333",NA,NA,NA,NA
"35","2020-12-21 16:47:46-03","MBM","MBM","401648","PreservedSpecimen","Plantae",NA,NA,"Xyridaceae","Xyris","hatschbachii","Xyris hatschbachii","L.B. Sm. & Downs","Lozano, E.D.","Lozano, E.D.","2447","2013","12","18","Southern America","Brazil","Paraná","Ponta Grossa","Parque Estadual de Vila Velha","-49.991667","-25.2475",NA,"Isolada ou cespitosa, 20-50 cm, flores amarelas, campo semi-hidromórfico.; Campos Gerais.","MBM401648","MBM401648",NA,NA,"2014",NA,NA,NA,NA,"-49.991667","-25.2475",NA,NA,NA,NA
"36","2015-09-03 21:07:03-03","MNHN","RECOLNAT_MNHN_P","P01679903","PreservedSpecimen",NA,NA,NA,"Xyridaceae","Xyris","hatschbachii","Xyris hatschbachii","L.B.Sm. & Downs",NA,"Reitz|Klein",NA,"1965","12","12",NA,"Brasil","Paraná","Ponta Grossa","Rodovia do Café, Rio Tibagi. Ponta Grossa, Paraná, Sul, Brasil, América do Sul","-50.1618995666504","-25.0949993133545","hb",". . 7 <a href='http://coldb.mnhn.fr/catalognumber/mnhn/p/p01679903' target='other'> <mi>dwc_moreinfo</mi></a>","P01679903","P01679903_01","900",NA,NA,"46557","auto",NA,NA,NA,NA,NA,NA,"17483",NA
"37","2021-02-11 17:22:10-03","UFPR","UPCB","33543","PreservedSpecimen","Plantae",NA,NA,"Xyridaceae","Xyris","hatschbachii","Xyris hatschbachii","L.B.Sm. & Downs","Lozano, E.D.","Cervi, A.C.","4014","1992","12","23",NA,"Brasil","Paraná","Tibagi","Guartelá","-50.4136009216309","-24.5093994140625",NA,"Erva ereta. Flores amarelas. Lugares úmidos..",NA,NA,NA,NA,"2015","56988","auto",NA,NA,NA,NA,NA,NA,NA,NA
"38","2021-02-11 17:22:10-03","UFPR","UPCB","6063","PreservedSpecimen","Plantae",NA,NA,"Xyridaceae","Xyris","hatschbachii","Xyris hatschbachii","L.B.Sm. & Downs","Lozano, E.D.","Hatschbach, G.","13051","1965","10","22",NA,"Brasil","Paraná","Palmeira","Rodovia do Café, Rio Tibagi","-50.0064010620117","-25.4293994903564",NA,"Flor amarela. Brejo..",NA,NA,NA,NA,"2015","35166","auto",NA,NA,NA,NA,NA,NA,NA,NA
"39","2008-05-27 22:02:00-03","MO","MOBOT","2999842","PreservedSpecimen","Plantae",NA,NA,"Xyridaceae","Xyris","hatschbachii","Xyris hatschbachii","L.B. Sm. & Downs","R. Kral","R. Kummrow","Kummrow 2431","1983","11","18","South America","Brazil","Paraná",NA,"Serra do Puruna.",NA,NA,NA,NA,NA,NA,NA,NA,NA,NA,NA,NA,NA,NA,NA,NA,NA,NA,NA
"40","2016-07-25 15:01:53-03","UNIOESTE","UNOP","3335","S","Plantae",NA,NA,"Xyridaceae","Xyris","hatschbachii","Xyris hatschbachii","L.B.Sm. & Downs","Lozano, E.D.","Liesenfeld, V.; Souza, T.; Jesus, C.S.; Souza, T.; Jesus, C.S.","44","2015","06","02",NA,"Brasil","Paraná","Tibagi","Parque Estadual do Guartelá","-50.4136009216309","-24.5093994140625",NA,"Herbácea. Rupícola. Folhas distícas com lâmina achatada, escapo cilíndrico, inflorescência castanho escura.",NA,NA,NA,NA,"2016","56988","auto",NA,NA,NA,NA,"02","25",NA,NA
"41","2016-07-25 15:01:53-03","UNIOESTE","UNOP","3329","S","Plantae",NA,NA,"Xyridaceae","Xyris","hatschbachii","Xyris hatschbachii","L.B.Sm. & Downs","Lozano, E.D.","Liesenfeld, V.; Souza, T.; Jesus, C.S.; Souza, T.; Jesus, C.S.","38","2015","06","02",NA,"Brasil","Paraná","Tibagi","Parque Estadual do Guartelá","-50.4136009216309","-24.5093994140625",NA,"Herbácea. Folhas distícas com lâmina achatada, escapo cilíndrico, inflorescência castanho escura.",NA,NA,NA,NA,"2016","56988","auto",NA,NA,NA,NA,"02","25",NA,NA
"42","2019-08-29 16:18:56-03","UNIOESTE","UNOP","3296","S","Plantae",NA,NA,"Xyridaceae","Xyris","hatschbachii","Xyris hatschbachii","L.B.Sm. & Downs","Lozano, E.D.","Liesenfeld, V.; Souza, T.; Cavali, A.P.; Bernardon, E.; Silva, S.M.; Souza, T.; Cavali, A.P.; Bernardon, E.; Silva, S.M.","5","2015","03","26",NA,"Brasil","Paraná","Tibagi","Parque Estadual do Guartelá","-50.4136009216309","-24.5093994140625",NA,"Herbácea. Rupícola. Folhas achatadas, inflorescência castanho-escura.",NA,NA,NA,NA,"2016","56988","auto",NA,NA,NA,NA,"02","25",NA,NA
"43","2016-07-25 15:01:53-03","UNIOESTE","UNOP","3313","S","Plantae",NA,NA,"Xyridaceae","Xyris","hatschbachii","Xyris hatschbachii","L.B.Sm. & Downs","Lozano, E.D.","Liesenfeld, V.; Souza, T.; Cavali, A.P.; Bernardon, E.; Silva, S.M.; Souza, T.; Cavali, A.P.; Bernardon, E.; Silva, S.M.","22","2015","10","26",NA,"Brasil","Paraná","Tibagi","Parque Estadual do Guartelá","-50.4136009216309","-24.5093994140625",NA,"Herbácea. Solo arenoso úmido. Folhas de lâmina acchatada, inflorescência castanho-clara com flores amarelas.",NA,NA,NA,NA,"2016","56988","auto",NA,NA,NA,NA,"02","25",NA,NA
"44","2016-07-25 15:01:53-03","UNIOESTE","UNOP","3336","S","Plantae",NA,NA,"Xyridaceae","Xyris","hatschbachii","Xyris hatschbachii","L.B.Sm. & Downs","Lozano, E.D.","Liesenfeld, V.; Souza, T.; Jesus, C.S.; Souza, T.; Jesus, C.S.","45","2015","06","02",NA,"Brasil","Paraná","Tibagi","Parque Estadual do Guartelá","-50.4136009216309","-24.5093994140625",NA,"Herbácea. Rupícola. Folhas distícas com lâmina achatada, escapo cilíndrico, inflorescência castanho escura.",NA,NA,NA,NA,"2016","56988","auto",NA,NA,NA,NA,"02","25",NA,NA
"45","2020-09-12 05:00:02-03","US","US","2755552","PreservedSpecimen","Plantae",NA,"Commelinales","Xyridaceae","Xyris","hatschbachii","Xyris hatschbachii","L.B. Sm. & Downs",NA,"P. Occhioni",NA,"1971","11","9","South America - Neotropics","Brazil","Paraná","Ponta Grossa","Vila Velha","-50.1618995666504","-25.0949993133545",NA,NA,"US01915671","US01915671_01",NA,NA,NA,"46557","auto","Monocotyledonae",NA,NA,NA,NA,NA,NA,"1"
"46","2020-09-12 05:00:02-03","US","US","2321976","PreservedSpecimen","Plantae",NA,"Commelinales","Xyridaceae","Xyris","hatschbachii","Xyris hatschbachii","L.B. Sm. & Downs",NA,"G. Hatschbach","828","1948","1","6","South America","Brazil","Paraná",NA,"Puruna.",NA,NA,NA,NA,"US00088162","US00088162_01",NA,NA,NA,NA,NA,"Monocotyledonae","Isotype",NA,NA,NA,NA,NA,"1"
"47","2020-09-12 05:00:02-03","US","US","2573051","PreservedSpecimen","Plantae",NA,"Commelinales","Xyridaceae","Xyris","hatschbachii","Xyris hatschbachii","L.B. Sm. & Downs",NA,"R. Reitz & D. Klein",NA,"1965","12","12","South America - Neotropics","Brazil","Paraná","Ponta Grossa","Rodovia do Café, Rio Tibagi.","-50.1618995666504","-25.0949993133545",NA,NA,"US01915672","US01915672_01","900",NA,NA,"46557","auto","Monocotyledonae",NA,NA,NA,NA,NA,NA,"1"
"48","2019-12-09 17:31:05-03","UFPR","EFC","16807","PreservedSpecimen","Plantae",NA,NA,"Xyridaceae","Xyris","hatschbachii","Xyris hatschbachii","L.B.Sm. & Downs","Lozano, E.D.","Völtz, R.R.; Nunes, M.G.","1473","2017","12","19",NA,"Brasil","Paraná","Jaguariaíva","Parque Estadual Vale do Codó","-49.6944","-24.2688",NA,"Erva cespitosa formando pequena população em solo arenoso próximo ao canal de drenagem; flores com brácteas marrons e pétalas amarelas. Savana","EFC016807",NA,"840","840","2018",NA,NA,NA,NA,"-49.6944","-24.2688","03","29",NA,NA
"49","2020-08-20 20:41:45-03","UFSC","FLOR","64256","PreservedSpecimen","Plantae",NA,"Poales","Xyridaceae","Xyris","hatschbachii","Xyris hatschbachii","L.B.Sm. & Downs","Lozano, E.D.","Lozano, E.D.; Damasceno, B.","2522","2013","12","20",NA,"Brasil","Paraná","Ponta Grossa","PARNA dos Campos Gerais, Cachoeira da Mariquitinha.","-49.9525","-25.195",NA,"isolada, 40cm, flores amarelas","FLOR0064256","FLOR0064256",NA,NA,"2014",NA,NA,NA,NA,"49º57'9''W","25º11'42''S",NA,NA,NA,NA
"50","2020-08-20 20:41:45-03","UFSC","FLOR","8696","PreservedSpecimen","Plantae",NA,"Poales","Xyridaceae","Xyris","hatschbachii","Xyris hatschbachii","L.B.Sm. & Downs","Lozano, E.D.","Reitz, R.; Klein, R.M.","17483","1965","12","12",NA,"Brasil","Paraná","Ponta Grossa","Rodovia do Café, Rio Tibagi.","-50.1618995666504","-25.0949993133545",NA,"erva","FLOR0008696",NA,"900","900","2015","46557","auto",NA,NA,NA,NA,NA,NA,NA,NA
