"record_id","modified","institutionCode","collectionCode","catalogNumber","basisOfRecord","kingdom","phylum","order","family","genus","specificEpithet","scientificName","scientificNameAuthorship","identifiedBy","recordedBy","recordNumber","year","month","day","continentOcean","country","stateProvince","locality","minimumElevationInMeters","maximumElevationInMeters","preparationType","occurrenceRemarks","barcode","imagecode","county","decimalLongitude","decimalLatitude","yearIdentified","monthIdentified","dayIdentified","verbatimLongitude","verbatimLatitude","coordinatePrecision","geoFlag","typeStatus","infraspecificEpithet","fieldNumber","individualCount","class"
"1","2021-03-15 16:37:00-03","NY","NYBG","00643799","PreservedSpecimen","Plantae","Magnoliophyta","Dioscoreales","Dioscoreaceae","Dioscorea","rumicoides","Dioscorea rumicoides","Griseb.","G. M. Barroso; E. F. Guimarães","B. D. Sucre","6361","1969","11","25","South America","Brazil","Rio de Janeiro","Guanabara, Reserva da Mata da Tijuca, pelo Grajau","160","220","sheet","<a href='http://sweetgum.nybg.org/science/vh/specimen_details.php?irn=534194' target='other'> <mi>dwc_moreinfo</mi></a>","NY00643799","NY00643799_01",NA,NA,NA,NA,NA,NA,NA,NA,NA,NA,NA,NA,NA,NA,NA
"2","2021-03-15 16:37:00-03","NY","NYBG","01032677","PreservedSpecimen","Plantae","Magnoliophyta","Dioscoreales","Dioscoreaceae","Dioscorea","rumicoides","Dioscorea rumicoides","Griseb.","R. S. Couto","Eunice","s.n.","1968","01","27","South America","Brazil","Goiás","caminho da Serra Dourada.",NA,NA,"sheet","<a href='http://sweetgum.nybg.org/science/vh/specimen_details.php?irn=1201916' target='other'> <mi>dwc_moreinfo</mi></a>","NY01032677","NY01032677_01",NA,NA,NA,NA,NA,NA,NA,NA,NA,NA,NA,NA,NA,NA,NA
"3","2021-03-15 16:37:00-03","NY","NYBG","00643800","PreservedSpecimen","Plantae","Magnoliophyta","Dioscoreales","Dioscoreaceae","Dioscorea","rumicoides","Dioscorea rumicoides","Griseb.",NA,"B. D. Sucre","9921","1973","04","02","South America","Brazil","Rio de Janeiro","Serra de Barata, Reserva da Represa do Piraraquara, Realengo","100","100","sheet","Material coletado de tuberculos em cultura no fitoterio do S.B.S. e provenientes da coleta D. Sucre 7478 <a href='http://sweetgum.nybg.org/science/vh/specimen_details.php?irn=534196' target='other'> <mi>dwc_moreinfo</mi></a>","NY00643800","NY00643800_01",NA,NA,NA,NA,NA,NA,NA,NA,NA,NA,NA,NA,NA,NA,NA
"4","2021-03-15 16:37:00-03","NY","NYBG","00643801","PreservedSpecimen","Plantae","Magnoliophyta","Dioscoreales","Dioscoreaceae","Dioscorea","rumicoides","Dioscorea rumicoides","Griseb.","L. B. Smith","L. B. Smith","11774","1957","02","24","South America","Brazil","Santa Catarina","6 km west of Popí, on the road to Sant'António","200","350","sheet","<a href='http://sweetgum.nybg.org/science/vh/specimen_details.php?irn=534195' target='other'> <mi>dwc_moreinfo</mi></a>","NY00643801","NY00643801_01","Itapiranga","-53.7119","-27.1694",NA,NA,NA,NA,NA,NA,NA,NA,NA,NA,NA,NA
"5","2021-03-15 16:37:00-03","NY","NYBG","01032570","PreservedSpecimen","Plantae","Magnoliophyta","Dioscoreales","Dioscoreaceae","Dioscorea","rumicoides","Dioscorea rumicoides","Griseb.","R. S. Couto","E. P. Heringer","15594","1978","10","06","South America","Brazil","Distrito Federal","mata próximo à Escola Fazendaria.",NA,NA,"sheet","<a href='http://sweetgum.nybg.org/science/vh/specimen_details.php?irn=1200992' target='other'> <mi>dwc_moreinfo</mi></a>","NY01032570","NY01032570_01","Brasília","-47.9294","-15.7797",NA,NA,NA,NA,NA,NA,NA,NA,NA,NA,NA,NA
"6","2020-06-29 11:30:06-03","UFRJ","RFA","37138","PreservedSpecimen","Plantae",NA,NA,"Dioscoreaceae","Dioscorea","rumicoides","Dioscorea rumicoides","Griseb.","R. S. Couto","R. S. Couto; C. P. Bove, P. Baleeiro, A. Oliveira","201","2009","06","08",NA,"Brasil","Goiás","Balneário do Rio Bezerra, na estrada Campos Belos para Assaias (TO-050)",NA,NA,NA,"Trepadeira, material em frutos","RFA23915",NA,"Campos Belos","-46.831111","-13.026944","2009","06","08","46º49'52''W","13º1'37''S",NA,NA,NA,NA,NA,NA,NA
"7","2020-06-29 11:30:06-03","UFRJ","RFA","37178","PreservedSpecimen","Plantae",NA,NA,"Dioscoreaceae","Dioscorea","rumicoides","Dioscorea rumicoides","Griseb.","R.S.Couto","R.S.Couto; J.M.A.Braga","99","2007","12","14",NA,"Brasil","Distrito Federal","DF 150, KM 11. Rua do Mato. Fazenda Morada do Sol.",NA,NA,NA,"Caule com ala cartilaginosa nos três eixos de cor verde-caro com nuances de vinoso. Folhas verde-escuro na face adaxial e verde-claro com partes vinho na face abaxial. Sistema radicular com raízes entumecidas. Sistema radicular. Coletad","RFA30244",NA,"Brasília","-47.9296989440918","-15.7797002792358","2011","05","17",NA,NA,"70570","auto",NA,NA,NA,NA,NA
"8","2020-06-29 11:30:06-03","UFRJ","RFA","37034","PreservedSpecimen","Plantae",NA,NA,"Dioscoreaceae","Dioscorea","rumicoides","Dioscorea rumicoides","Griseb.","R.S. Couto","R.S. Couto; C.P. Bove, P. Baleeiro, A. Oliveira.","193","2009","06","04",NA,"Brasil","Goiás","Encontro das Águas, Chapada dos Veadeiros, encontro dos rios São Miguel e Tocantinzinho",NA,NA,NA,"Trepadeira em área da mata próximo ao rio Tocantizinho. Caule com alas cartilaginosas, pecíolo alado. Frutos atingindo a maturação, com as bordas cartilaginosas. Material em cultivo","RFA23771",NA,"Colinas do Sul","-48.0783004760742","-14.1513996124268","2009","06","04",NA,NA,"58154","auto",NA,NA,NA,NA,NA
"9","2021-03-31 13:37:38-03","MN","R","50895","PreservedSpecimen","Plantae",NA,NA,"Dioscoreaceae","Dioscorea","rumicoides","Dioscorea rumicoides","Griseb.","Barroso, G.M.",NA,NA,"1887","01",NA,NA,"Brasil","Rio de Janeiro",NA,NA,NA,NA,NA,NA,NA,NA,NA,NA,"1969","11","23",NA,NA,NA,NA,NA,NA,NA,NA,NA
"10","2021-03-31 13:37:38-03","MN","R","122771","PreservedSpecimen","Plantae",NA,NA,"Dioscoreaceae","Dioscorea","rumicoides","Dioscorea rumicoides","Griseb.","Smith, L.B.","Smith, L.B.; Klein, R.M.",NA,"1957","02","24",NA,"Brasil","Santa Catarina",NA,"200","200",NA,NA,NA,NA,"Itapiranga","-53.7122001647949","-27.1693992614746","1957",NA,NA,NA,NA,"18767","auto",NA,NA,NA,NA,NA
"11","2016-02-02 14:38:04-02","BGBM","B","B 10 0004147","S","Plantae",NA,NA,"Dioscoreaceae","Dioscorea","rumicoides","Dioscorea rumicoides","Griseb.",NA,"F. Sellow","48",NA,NA,NA,"Middle and South America","Brazil",NA,NA,NA,NA,NA,"<a href=http://herbarium.bgbm.org/object/B100004147 target=other class=eLink> <mi>dwc_moreinfo</mi> </a>","B100004147","B100004147 B100004147_1",NA,NA,NA,NA,NA,NA,NA,NA,NA,NA,"lectotype",NA,NA,NA,NA
"12","2016-02-02 14:38:04-02","BGBM","B","B 10 0247747","S","Plantae",NA,NA,"Dioscoreaceae","Dioscorea","rumicoides","Dioscorea rumicoides var. longibracteata","R.Knuth",NA,"A. F. Regnell","1246","1868",NA,NA,"Middle and South America","Brazil",NA,"Minas Geraes, Caldas.",NA,NA,NA,"<a href=http://herbarium.bgbm.org/object/B100247747 target=other class=eLink> <mi>dwc_moreinfo</mi> </a>","B100247747","B100247747",NA,NA,NA,NA,NA,NA,NA,NA,NA,NA,"lectotype","var. longibracteata",NA,NA,NA
"13","2016-02-02 14:38:04-02","BGBM","B","B 10 0247747","S","Plantae",NA,NA,"Dioscoreaceae","Dioscorea","rumicoides","Dioscorea rumicoides var. longibracteata","R.Knuth",NA,"A. F. Regnell","1246","1868",NA,NA,"Middle and South America","Brazil",NA,"Minas Geraes, Caldas.",NA,NA,NA,"<a href=http://herbarium.bgbm.org/object/B100247747 target=other class=eLink> <mi>dwc_moreinfo</mi> </a>","B100247747","B100247747",NA,NA,NA,NA,NA,NA,NA,NA,NA,NA,"lectotype","var. longibracteata",NA,NA,NA
"14","2019-11-21 14:34:59-03","UFJF","CESJ","47002","PreservedSpecimen","Plantae","Angiosperma",NA,"Dioscoreaceae","Dioscorea","rumicoides","Dioscorea rumicoides","Griseb.","C.N. Matozinhos","P.L. Viana; N.F.O. Mota","1967","2006","02","26","América do Sul","Brasil","Minas Gerais","Serra Negra, Burro de Ouro",NA,NA,NA,"Planta escandente em campo de altitude. Flores cremes.","CESJ047002",NA,"Rio Preto","-43.8278007507324","-22.0891990661621","2006","04",NA,NA,NA,"20815","auto",NA,NA,NA,NA,NA
"15","2021-04-07 11:42:59-03","UFMS","CGMS","76036","PreservedSpecimen","Plantae",NA,NA,"Dioscoreaceae","Dioscorea","rumicoides","Dioscorea rumicoides","Griseb.","D. Araújo","S.N. Moreira; V.J. Pott & A. Pott","999","2012","05","02",NA,"Brasil","Mato Grosso do Sul","Fazenda Feliz.","195","195",NA,"Flor creme, fruto castanho claro. Habitat: Solo orgânico encharcado. Relevo plano deprimido. Campo graminoso úmido com Mauritia flexuosa em domínio de Cerrado. Borda de mata ciliar. Habito: Trepadeira anfíbia.","CGMS1108991",NA,"Terenos","-55.2625","-20.4619444","2012","05","02","-55,2625","-20,4619444",NA,NA,NA,NA,NA,NA,NA
"16","2021-04-07 11:42:59-03","UFMS","CGMS","76035","PreservedSpecimen","Plantae",NA,NA,"Dioscoreaceae","Dioscorea","rumicoides","Dioscorea rumicoides","Griseb.","D. Araújo","S.N. Moreira; V.J. Pott & A. Pott","998","2012","05","02",NA,"Brasil","Mato Grosso do Sul","Fazenda Feliz.","195","195",NA,"Flor creme, fruto castanho claro. Habitat: Solo orgânico encharcado. Relevo plano deprimido. Campo graminoso úmido com Mauritia flexuosa em domínio de Cerrado. Borda de mata ciliar. Habito: Trepadeira anfíbia.","CGMS1108990",NA,"Terenos","-55.2625","-20.4619444","2012","05","02","-55,2625","-20,4619444",NA,NA,NA,NA,NA,NA,NA
"17","2019-08-20 10:00:12-03","UNICAMP","UEC","63066","S","Plantae","Liliopsida",NA,"Dioscoreaceae","Dioscorea","rumicoides","Dioscorea rumicoides","Griseb.","Kirizawa, M","Bernacci, LC","25944","1990","02","01",NA,"Brazil","São Paulo","Fazenda São Vicente, Mata mesófila semidecídua. Interior da mata.",NA,NA,NA,"Liana, folhas arroxeadas no lado inferior; flores verdes.","UEC092786","UEC092786","Campinas","-47.060001373291","-22.8999996185303","1996","06","16",NA,NA,"23900","auto",NA,NA,NA,NA,NA
"18","2020-04-22 16:26:27-03","UFPB","JPB","21704","PreservedSpecimen","Plantae","Angiosperma","Monocotyledon","Dioscoreaceae","Dioscorea","rumicoides","Dioscorea rumicoides","Griseb.","Araújo, D","Agra, MF","3758","1996","06","25","Southern America","Brasil","Paraíba","São José da Mata, Fazenda Pedro da Costa Agra, estrada para Soledade, 16 Km Oeste do centro de Camina Grande.","500","510",NA,"; HABITAT: Vegetação arbustivo-arbórea, tipica de Caatinga dos Cariris, formado por espécies caducifolias e espinhosas.; DESC: Trepadeira; fl. amarela; fr. capsular.",NA,NA,"Campina Grande","-35.866667","-7.766667","2011","11","03","-35.866667","-7.766667",NA,NA,NA,NA,NA,NA,NA
"19","2020-04-27 16:09:29-03","UFES","VIES","23359","S","Plantae",NA,NA,"Dioscoreaceae","Dioscorea","rumicoides","Dioscorea rumicoides","Griseb.","G.M. Barroso, E.F. Guimarães et D. Sucre","D. Sucre","7478","1971","02","17",NA,"Brasil","Rio de Janeiro","Antigo Estado da Guanabara. Serra do Barata, Reserva do Piracuara.",NA,NA,NA,NA,"VIES023359","VIES023359","Rio de Janeiro","-43.2075004577637","-22.9027996063232","1971","02",NA,NA,NA,"57442","auto",NA,NA,NA,NA,NA
"20","2020-12-21 16:22:55-03","MBM","MBM","179880","PreservedSpecimen","Plantae",NA,NA,"Dioscoreaceae","Dioscorea","rumicoides","Dioscorea rumicoides","Griseb.","Pedralli, G.","Hatschbach, G.; Pott, A.; Silva, J.M.; Pott, A.; Silva, J.M.","62442","1995","05","07","Southern America","Brazil","Mato Grosso","Rod. MT-248, 16km O da cidade",NA,NA,NA,NA,"MBM179880","MBM179880","Jauru","-58.8664016723633","-15.3418998718262",NA,NA,NA,NA,NA,"40234","auto",NA,NA,NA,NA,NA
"21","2020-12-21 16:22:55-03","MBM","MBM","425636","PreservedSpecimen","Plantae",NA,NA,"Dioscoreaceae","Dioscorea","rumicoides","Dioscorea rumicoides","Griseb.","Sucre; Barroso; Guimarraes","Sucre, D.","7478","1971","02","17","Southern America","Brazil","Rio de Janeiro","Serra do Barata, Antigo estado da Guanabara, Reserva do Piracuara",NA,NA,NA,"Dióica, destrogera, rupícola, umbrófila. Tuberculos pouco enterrados e cobertos por densa camada de matéria orgânica de forma discoide com meristema central (até 13cm de diâmetro e 4cm de espessura), margem lobada com os lobos ocasio","MBM425636",NA,"Rio de Janeiro","-43.2075004577637","-22.9027996063232","1971","11",NA,NA,NA,"57442","auto",NA,NA,NA,NA,NA
"22","2020-12-21 16:22:55-03","MBM","MBM","425640","PreservedSpecimen","Plantae",NA,NA,"Dioscoreaceae","Dioscorea","rumicoides","Dioscorea rumicoides","Griseb.","Sucre, D.","Sucre, D.","9921","1973","04","02","Southern America","Brazil","Rio de Janeiro","Serra do Barata, Reserva da Represa do Piraraquara, Realengo",NA,NA,NA,"Material coletado de tubérculos em cultura no fitotério do S.B.S. e proveniente da coleta Sucre, D. 7478. Pedunculo e rachis amarelos, ovário idem. Sépalas e pétalas creme. Frutos novos verde escuro. Frutos maduros na carpoteca.","MBM425640",NA,"Rio de Janeiro","-43.2075004577637","-22.9027996063232","1971",NA,NA,NA,NA,"57442","auto",NA,NA,NA,NA,NA
"23","2015-09-30 22:03:18-03","MNHN","RECOLNAT_MNHN_P","P00748438","PreservedSpecimen",NA,NA,NA,"Dioscoreaceae","Dioscorea","rumicoides","Dioscorea rumicoides","Griseb.",NA,"Glaziou, A.",NA,NA,NA,NA,NA,"Brésil",NA,"Mato Masao, Tapabina",NA,NA,"hb","Donné par Mme Simard, sa fille, en 1907 <a href='http://coldb.mnhn.fr/catalognumber/mnhn/p/p00748438' target='other'> <mi>dwc_moreinfo</mi></a>","P00748438","P00748438_01 P00748438_02",NA,NA,NA,NA,NA,NA,NA,NA,NA,NA,"paratype",NA,"14349",NA,NA
"24","2014-04-04 05:46:00-03","MO","MOBOT","619281","PreservedSpecimen","Plantae",NA,NA,"Dioscoreaceae","Dioscorea","rumicoides","Dioscorea rumicoides","Griseb.",NA,"Rodolfo Vásquez|Nestor Jaramillo","Vásquez Martínez 1574","1981","3","31","South America","Peru","Ucayali","Bosque Nacional Alexander Von Humboldt. Bosque primario.","270.00000000",NA,NA,NA,NA,NA,"Coronel Portillo","-74.75","-8.66666",NA,NA,NA,NA,NA,NA,NA,NA,NA,"387","3",NA
"25","2014-01-02 05:36:00-02","MO","MOBOT","3329878","PreservedSpecimen","Plantae",NA,NA,"Dioscoreaceae","Dioscorea","rumicoides","Dioscorea rumicoides","Griseb.","Luzmila Arroyo P","D. Villarroel|Marcelo Vargas|F. Seidel","Villarroel Segarra 443","2006","2","7","South America","Bolivia","Santa Cruz","Comunidad de Bella Vista, Camino principal entre la escuela y el sendero del Chorro del Fraile, Bosque semidecíduo Chiquitano.","1715.00000000",NA,NA,NA,NA,NA,"Florida","-64.6763889","-18.3319445",NA,NA,NA,NA,NA,NA,NA,NA,NA,NA,"1",NA
"26","2008-05-27 22:02:00-03","MO","MOBOT","1091640","PreservedSpecimen","Plantae",NA,NA,"Dioscoreaceae","Dioscorea","rumicoides","Dioscorea rumicoides","Griseb.","T. Killeen (USZ, MO)","Timothy J. Killeen|M. Toledo G.","Killeen 7877","1996","5","2","South America","Bolivia","Santa Cruz","Concesión Minera Don Mario, 100 km al NE de San Juan; bosque seco chiquitano, dosel dominado por Anadenanthera colubrina y Poeppigia procera.","280.00000000","350.00000000",NA,NA,NA,NA,"Chiquitos","-59.6825","-17.33833",NA,NA,NA,NA,NA,NA,NA,NA,NA,NA,"8",NA
"27","2008-05-27 22:02:00-03","MO","MOBOT","1091710","PreservedSpecimen","Plantae",NA,NA,"Dioscoreaceae","Dioscorea","rumicoides","Dioscorea rumicoides","Griseb.","M. Toledo (USZ)","Timothy J. Killeen|M. Toledo G.","Killeen 7944","1996","5","3","South America","Bolivia","Santa Cruz","Concesión Don Mario; orilla del aereopuerto; bosque alto deciduo dominado por Calycophyllum, Amburana y Caesalpinia.","300.00000000",NA,NA,NA,NA,NA,"Chiquitos","-59.68055","-17.33861",NA,NA,NA,NA,NA,NA,NA,NA,NA,NA,"5",NA
"28","2012-03-18 05:12:00-03","MO","MOBOT","1195397","PreservedSpecimen","Plantae",NA,NA,"Dioscoreaceae","Dioscorea","rumicoides","Dioscorea rumicoides","Griseb.","F. Mamani (USZ)","Fabiana Mamani M.","Mamani M. 457A","1995","2","20","South America","Bolivia","Santa Cruz","Lomerio. A 12 km al Norte de la comunidad Las Trancas. Parcelas permanente del proyecto Bolfor, Las Trancas 95. Bosque seco chiquitano. Especies muy frecuentes de Anadenanthera colubrina, Poeppigia procera, etc. Suelos lateríticos.","450.00000000",NA,NA,NA,NA,NA,"Nuflo de Chavez","-61.84638","-16.52027",NA,NA,NA,NA,NA,NA,NA,NA,NA,NA,NA,NA
"29","2008-05-27 22:02:00-03","MO","MOBOT","1716529","PreservedSpecimen","Plantae",NA,NA,"Dioscoreaceae","Dioscorea","rumicoides","Dioscorea rumicoides","Griseb.","A. Fuentes","Bonifacio Mostacedo C.|V. Medina","Mostacedo C. 3581","1998","3","8","South America","Bolivia","Santa Cruz","Campamento Las Trancas, Lomerio. Las Lajas. Rocas lateriticas. Especies características: Urera baccifera, Cereus tacuaralensis, Sterculia apetala, Monvillea cavendishii.","400.00000000",NA,NA,NA,NA,NA,"Nuflo de Chavez","-61.84805","-16.52166",NA,NA,NA,NA,NA,NA,NA,NA,NA,NA,NA,NA
"30","2015-09-25 06:24:00-03","MO","MOBOT","1805463","PreservedSpecimen","Plantae",NA,NA,"Dioscoreaceae","Dioscorea","rumicoides","Dioscorea rumicoides","Griseb.",NA,"René Chávez A.","Chávez Alfaro 3385","1976","1","6","South America","Peru","Cusco","Quiteni.","700.00000000",NA,NA,NA,NA,NA,"La Convención",NA,NA,NA,NA,NA,NA,NA,NA,NA,NA,NA,NA,NA,NA
"31","2020-08-29 18:15:00-03","MO","MOBOT","2696979","PreservedSpecimen","Plantae",NA,NA,"Dioscoreaceae","Dioscorea","rumicoides","Dioscorea rumicoides","Griseb.","M. Nee (NY)","L. Cayola","Cayola Pérez 1604","2005","3","15","South America","Bolivia","La Paz","Parque Nacional Madidi, NW de Apolo. Bosque andino semideciduo del sector de Yarimita, con Anadenanthera colubrina, Warscecwiczia coccinea, Myrcia sp. Ladera pronunciada con exposición NW, pendiente 100 %. Plantas secadas en campo.","996.00000000",NA,NA,NA,NA,NA,"Franz Tamayo","-68.6858333","-14.5602778",NA,NA,NA,NA,NA,NA,NA,NA,NA,"05-07","1",NA
"32","2011-06-27 08:43:00-03","MO","MOBOT","3038783","PreservedSpecimen","Plantae",NA,NA,"Dioscoreaceae","Dioscorea","rumicoides","Dioscorea rumicoides","Griseb.",NA,"F. Sellow","Sellow 48","1814",NA,NA,"South America","Brazil",NA,NA,NA,NA,NA,NA,NA,NA,NA,NA,NA,NA,NA,NA,NA,NA,NA,NA,NA,NA,NA,NA,NA
"33","2016-11-15 05:15:00-02","MO","MOBOT","3039094","PreservedSpecimen","Plantae",NA,NA,"Dioscoreaceae","Dioscorea","rumicoides","Dioscorea rumicoides","Griseb.",NA,"Antonio C. Krapovickas|Carmen L. Cristóbal","Krapovickas 34495","1979","1","31","South America","Brazil","Mato Grosso do Sul","Ponte do Grego, río Aquidauana, 48 Km N de Terenos. Voluble, tallo con costillas.",NA,NA,NA,NA,NA,NA,NA,NA,NA,NA,NA,NA,NA,NA,NA,NA,NA,NA,NA,NA,NA
"34","2012-03-18 05:12:00-03","MO","MOBOT","965162","PreservedSpecimen","Plantae",NA,NA,"Dioscoreaceae","Dioscorea","rumicoides","Dioscorea rumicoides","Griseb.","O. Tellez (MEXU)","Fabiana Mamani M.","Mamani M. 457","1995","3","20","South America","Bolivia","Santa Cruz","Area de estudio del proyecto BOLFOR, Las Trancas-95. Bosque semideciduo chiquitano, vegetación de los alrededores de laja.","450.00000000",NA,NA,NA,NA,NA,"Nuflo de Chavez","-61.84638","-16.52027",NA,NA,NA,NA,NA,NA,NA,NA,NA,NA,"7",NA
"35","2008-05-27 22:02:00-03","MO","MOBOT","968976","PreservedSpecimen","Plantae",NA,NA,"Dioscoreaceae","Dioscorea","rumicoides","Dioscorea rumicoides","Griseb.","O. Tellez (MEXU)","Antony Jardim","Jardim 1958","1995","3","31","South America","Bolivia","Santa Cruz","Las Trancas, Lomerio cerca las parcelas de Bolfor. Bosque seco chiquitano de Anadenanthera con afloramientos grande de laja.","400.00000000",NA,NA,NA,NA,NA,"Nuflo de Chavez","-61.83916","-16.54583",NA,NA,NA,NA,NA,NA,NA,NA,NA,NA,NA,NA
"36","2020-07-10 09:45:42-03","MBML","MBML-HERBARIO","52502",NA,"Plantae",NA,NA,"Dioscoreaceae","Dioscorea","rumicoides","Dioscorea rumicoides","Griseb.","Barroso, Guimarães & Sucre/II-1971","D. Sucre","7478","1971","02","17",NA,"Brasil","Rio de Janeiro","Antigo Estado da Guanabara. Serra do Barata, Reserva do Piracuara",NA,NA,NA,"Dioica, Destrogera, anual, rupicola, umbrofila. Crescendo em formação de mata. Tuberculos pouco enterrados e cobertos por densa camada de matéria orgânica de forma discoide com meristema central (até 13cm de diâmetro e 4cm de espessura","MBML052502","MBML052502_1 MBML052502_2","Rio de Janeiro","-43.2075004577637","-22.9027996063232",NA,NA,NA,NA,NA,"57442","auto",NA,NA,NA,NA,NA
"37","2014-11-06 16:16:53-02","UFPB","EAN","9722","S","Plantae",NA,NA,"Dioscoreaceae","Dioscorea","rumicoides","Dioscorea rumicoides","Griseb.",NA,"S. Pitrez; A.Almeida & G.Trajano.","213","2003","04","30",NA,"Brasil","Paraíba","Faz. Santa Helena.",NA,NA,NA,NA,NA,NA,"Serraria","-35.633","-6.82",NA,NA,NA,NA,NA,"13605","auto",NA,NA,NA,NA,NA
"38","2014-11-06 16:16:53-02","UFPB","EAN","9896","S","Plantae",NA,NA,"Dioscoreaceae","Dioscorea","rumicoides","Dioscorea rumicoides","Griseb.",NA,"S. Pitrez; A.Almeida; W.Felix & G.Trajano.","398","2003","07","21",NA,"Brasil","Paraíba","Pedra de Santo Antonio",NA,NA,NA,NA,NA,NA,"Fagundes","-35.775","-7.355",NA,NA,NA,NA,NA,"15100","auto",NA,NA,NA,NA,NA
"39","2014-11-06 16:16:53-02","UFPB","EAN","9813","S","Plantae",NA,NA,"Dioscoreaceae","Dioscorea","rumicoides","Dioscorea rumicoides","Griseb.",NA,"S. Pitrez; A.Almeida & L.P.Felix","380","2003","07","17",NA,"Brasil","Paraíba","Pedra de Santo Antonio",NA,NA,NA,NA,NA,NA,"Fagundes","-35.775","-7.355",NA,NA,NA,NA,NA,"15100","auto",NA,NA,NA,NA,NA
"40","2014-11-06 16:16:53-02","UFPB","EAN","9725","S","Plantae",NA,NA,"Dioscoreaceae","Dioscorea","rumicoides","Dioscorea rumicoides","Griseb.",NA,"S. Pitrez; A.Almeida & G.Trajano.","226","2003","05","02",NA,"Brasil","Paraíba","Faz. Santa Helena.",NA,NA,NA,NA,NA,NA,"Serraria","-35.633","-6.82",NA,NA,NA,NA,NA,"13605","auto",NA,NA,NA,NA,NA
"41","2014-11-06 16:16:53-02","UFPB","EAN","9728","S","Plantae",NA,NA,"Dioscoreaceae","Dioscorea","rumicoides","Dioscorea rumicoides","Griseb.",NA,"A.Almeida; S.Pitrez & G.Trajano.","366","2003","06","26",NA,"Brasil","Paraíba","Faz. Santa Helena.",NA,NA,NA,NA,NA,NA,"Serraria","-35.633","-6.82",NA,NA,NA,NA,NA,"13605","auto",NA,NA,NA,NA,NA
"42","2014-11-06 16:16:53-02","UFPB","EAN","9720","S","Plantae",NA,NA,"Dioscoreaceae","Dioscorea","rumicoides","Dioscorea rumicoides","Griseb.",NA,"S. Pitrez; A.Almeida & G.Trajano.","228","2003","05","03",NA,"Brasil","Paraíba",NA,NA,NA,NA,NA,NA,NA,"Serraria","-35.633","-6.82",NA,NA,NA,NA,NA,"13605","auto",NA,NA,NA,NA,NA
"43","2021-03-01 11:53:42-03","UFPE","UFP","69929","PreservedSpecimen","Plantae",NA,"Dioscoreales","Dioscoreaceae","Dioscorea","rumicoides","Dioscorea rumicoides","Griseb.","Araújo, D","Mendes, K; Chagas, MA","729","2011","06","20",NA,"Brasil","Pernambuco",NA,"700","700",NA,"Trepadeira.; Subida florestal do afloramento rochoso. Caatinga arbórea.","UFP069929",NA,"São Caetano","-36.186861","-8.239361","2011","11","07","-36.186861","-8.239361",NA,NA,NA,NA,NA,NA,NA
"44","2020-09-12 05:00:02-03","US","US","2269700","PreservedSpecimen","Plantae",NA,"Liliales","Dioscoreaceae","Dioscorea","rumicoides","Dioscorea rumicoides","Griseb.",NA,"L. Smith, Klein, R. & J. Schnorrenberger","11774","1957","2","21","South America - Neotropics","Brazil","Itapiranga","Forest and ruderal, 6km west of Popí, on the road to Sant´António","200","350",NA,NA,"US01329599","US01329599_01",NA,NA,NA,NA,NA,NA,NA,NA,NA,NA,NA,NA,NA,"1","Monocotyledonae"
"45","2020-09-12 05:00:02-03","US","US","2562791","PreservedSpecimen","Plantae",NA,"Liliales","Dioscoreaceae","Dioscorea","rumicoides","Dioscorea rumicoides","Griseb.",NA,"O. Handro","173","1950","3","27","South America - Neotropics","Brazil","Botucatu","Cultivada no Jardim Botânico de São Paulo",NA,NA,NA,NA,"US01329600","US01329600_01",NA,NA,NA,NA,NA,NA,NA,NA,NA,NA,NA,NA,NA,"1","Monocotyledonae"
"46","2020-09-02 16:24:07-03","Cenargen","CEN","12312","PreservedSpecimen","Plantae",NA,NA,"Dioscoreaceae","Dioscorea","rumicoides","Dioscorea rumicoides","Griseb.","G. M. Barroso","Dimitri Sucre Benjamin","7478","1971","11","17",NA,"Brasil",NA,"Serra do Batata. Rio de Janeiro.","720","720","Exsicatas","Doação do Jardim Botânico do Rio de Janeiro - RB (146484). Rio de Janeiro.","CEN00012312","CEN00012312",NA,NA,NA,"1971","11",NA,NA,NA,NA,NA,NA,NA,NA,"1",NA
"47","2019-09-04 20:03:00-03","F","FMNH-SEEDPLANTS",NA,"PreservedSpecimen","Plantae","Spermatophyta",NA,"Dioscoreaceae","Dioscorea","rumicoides","Dioscorea rumicoides",NA,NA,"F. Sellow",NA,NA,NA,NA,"South America","Brazil",NA,NA,NA,NA,NA,NA,NA,NA,NA,"-52.8731","-10.8339",NA,NA,NA,NA,NA,NA,NA,"Type [status unknown]",NA,NA,NA,"Monocotyledoneae"
"48","2020-11-12 16:59:02-03","UEL","FUEL","11297","PreservedSpecimen","Plantae","Tracheophyta","Dioscoreales","Dioscoreaceae","Dioscorea","rumicoides","Dioscorea rumicoides","Griseb.","Kirizawa, M","Francisco das Chagas e Silva","1639","1993","04","29",NA,"Brasil","Paraná","Mata dos Godoy, Transecto II",NA,NA,NA,NA,"FUEL020289",NA,"Londrina","-51.1627998352051","-23.3103008270264","2005","06",NA,NA,NA,"63728","auto",NA,NA,NA,NA,NA
"49","2020-11-12 16:59:02-03","UEL","FUEL","11412","PreservedSpecimen","Plantae","Tracheophyta","Dioscoreales","Dioscoreaceae","Dioscorea","rumicoides","Dioscorea rumicoides","Griseb.","Carneiro, JS","Francisco das Chagas e Silva","1626","1993","01","08",NA,"Brasil","Paraná","Barranco rio Tibagi, Próximo à área do projeto Tibagi",NA,NA,NA,NA,"FUEL020288",NA,"Sapopema","-50.5802993774414","-23.9108009338379","2005","08","18",NA,NA,"21990","auto",NA,NA,NA,NA,NA
"50","2017-09-11 17:09:32-03","UnB","HBVIRTFLBRAS",NA,"O","Plantae",NA,NA,"Dioscoreaceae","Dioscorea","rumicoides","Dioscorea rumicoides","Griseb.",NA,"Sellow, F","s.n.",NA,NA,NA,"Southern America","Brazil","Rio de Janeiro",NA,NA,NA,NA,NA,NA,NA,NA,NA,NA,NA,NA,NA,NA,NA,NA,NA,NA,NA,NA,NA,NA
"51","2017-09-11 17:09:32-03","UnB","HBVIRTFLBRAS",NA,"O","Plantae",NA,NA,"Dioscoreaceae","Dioscorea","rumicoides","Dioscorea rumicoides","Griseb.",NA,"Sellow, F","s.n.",NA,NA,NA,"Southern America","Brazil","Rio de Janeiro",NA,NA,NA,NA,NA,NA,NA,NA,NA,NA,NA,NA,NA,NA,NA,NA,NA,NA,NA,NA,NA,NA
"52","2020-11-26 10:00:09-03","IBt","SP","377061","S","Plantae",NA,NA,"Dioscoreaceae","Dioscorea","rumicoides","Dioscorea rumicoides","Griseb.",NA,"Chagas Silva, F","1639","1993","04","29",NA,"Brasil","Paraná",NA,NA,NA,NA,NA,NA,NA,"Londrina","-51.1627998352051","-23.3103008270264",NA,NA,NA,NA,NA,"63728","auto",NA,NA,NA,NA,NA
