"record_id","modified","institutionCode","collectionCode","catalogNumber","basisOfRecord","kingdom","phylum","order","family","genus","specificEpithet","scientificName","scientificNameAuthorship","identifiedBy","recordedBy","recordNumber","year","month","day","continentOcean","country","stateProvince","county","locality","decimalLongitude","decimalLatitude","preparationType","occurrenceRemarks","barcode","imagecode","minimumElevationInMeters","maximumElevationInMeters","yearIdentified","verbatimLongitude","verbatimLatitude","class","typeStatus","relatedCatalogItem"
"1","2021-03-15 16:37:00-03","NY","NYBG","00749306","PreservedSpecimen","Plantae","Magnoliophyta","Lamiales","Gesneriaceae","Goyazia","petraea","Goyazia petraea","(S.M.Phillips) Wiehler","L. E. Skog","D. Philcox","4689","1968","04","02","South America","Brazil","Mato Grosso","Barra do Garças","C. 11 km. W. of km. 90, Xavantina-Aragarças road. Vale dos Sonhos","-52.23","-14.63","sheet","<a href='http://sweetgum.nybg.org/science/vh/specimen_details.php?irn=889616' target='other'> <mi>dwc_moreinfo</mi></a>","NY00749306","NY00749306_01",NA,NA,NA,NA,NA,NA,NA,NA
"2","2021-03-15 16:37:00-03","NY","NYBG","00749331","PreservedSpecimen","Plantae","Magnoliophyta","Lamiales","Gesneriaceae","Goyazia","petraea","Goyazia petraea","(S.M.Phillips) Wiehler","L. E. Skog","H. S. Irwin","17262","1966","06","16","South America","Brazil","Mato Grosso",NA,"Summit, Serra Azul. Ca. 75 km. S. of Xavantina [Nova Xavantina]. Drainage of the Upper Rio Araguaia.","-52.23","-15.28","sheet","<a href='http://sweetgum.nybg.org/science/vh/specimen_details.php?irn=889617' target='other'> <mi>dwc_moreinfo</mi></a>","NY00749331","NY00749331_01","600","600",NA,NA,NA,NA,NA,NA
"3","2019-12-12 15:31:44-03","UFABC","HUFABC","000380","PreservedSpecimen","Plantae","Angiospermas",NA,"Gesneriaceae","Goyazia","petraea","Goyazia petraea","(S.M. Phillips) Wiehler","A.O. Araujo","Araujo, AO; A.P. Moraes; F.W. Amorim","1079","2013","01","27",NA,"Brasil","Mato Grosso","Vale dos sonhos","Serra do Roncador, Estrada de terra a oeste da Rodovia Vale dos Sonhos-Nova Xavantina (BR 158), logo após a ponte do córrego Pelego. Afloramento de ambos os lados da estrada, 500m antes do final do asfalto.","-52.261806","-15.857111",NA,"Erva com rizoma, em local sombrado nas frestas das rochas. População grande, em ambos os lados da estrada. Corola lilas externamente, com todos os lobos brancos, internamente branco, pintas lilases. Local do tipo G. petraea","HUFABC000380","HUFABC000380",NA,NA,"2014","-52.261806","-15.857111",NA,NA,NA
"4","2019-12-12 15:31:44-03","UFABC","HUFABC","000379","PreservedSpecimen","Plantae","Angiospermas",NA,"Gesneriaceae","Goyazia","petraea","Goyazia petraea","(S.M. Phillips) Wiehler","A.O. Araujo","Araujo, AO; A.P. Moraes; F.W. Amorim; A. Aranda; R. Bueno","1067","2013","01","24",NA,"Brasil","Mato Grosso","Chapada dos Guimarães","Parque Nacional Chapada dos Guimarães, trilha da Casa de Pedra para o Morro de São Jerônimo, no paredão do lado esquerdo da trilha, parte inferior e superior do paredão.","-55.837861","-15.438",NA,"Erva com rizoma, nas frestas das rochas, local sombrado e úmido. Corola lilas externamente, com lobos brancos, lobo abaxial pintado de lilas, internamente branco com pintas lilases.","HUFABC000379","HUFABC000379 HUFABC000379_1",NA,NA,"2014","-55.837861","-15.438",NA,NA,NA
"5","2019-12-12 15:31:44-03","UFABC","HUFABC","000378","PreservedSpecimen","Plantae","Angiospermas",NA,"Gesneriaceae","Goyazia","petraea","Goyazia petraea","(S.M. Phillips) Wiehler","A.O. Araujo","Araujo, AO; A.P. Moraes; F.W. Amorim; A. Aranda; R. Bueno","1065","2013","01","24",NA,"Brasil","Mato Grosso","Chapada dos Guimarães","Parque Nacional Chapada dos Guimarães, vários locais da Casa de Pedras.","-55.83325","-15.428889",NA,"Erva com rizoma, nas frestas das rochas, local sombrado, interior da floresta. Corola lilas externamente, com lobos brancos, lobo abaxial pintado de lilas, internamente branco com pintas lilases.","HUFABC000378","HUFABC000378 HUFABC000378_1",NA,NA,"2014","-55.83325","-15.428889",NA,NA,NA
"6","2019-12-12 15:31:44-03","UFABC","HUFABC","000377","PreservedSpecimen","Plantae","Angiospermas",NA,"Gesneriaceae","Goyazia","petraea","Goyazia petraea","(S.M. Phillips) Wiehler","A.O. Araujo","Araujo, AO; A.P. Moraes; F.W. Amorim; A. Aranda; R. Bueno","1062","2013","01","23",NA,"Brasil","Mato Grosso","Chapada dos Guimarães","Parque Nacional Chapada dos Guimarães, estrada Cuiabá-Chapada dos Guimarães, trilha do Apiário Buriti, entre 300 e 500m da loja. Floresta úmida, em afloramento arenítico, local sombrado.","-55.842083","-15.379111",NA,"Erva com rizoma, nas frestas das rochas, local sombrado. Corola rosa claro na base, com lobos brancos externamente, internamente branco com pintas lilases.","HUFABC000377","HUFABC000377 HUFABC000377_1",NA,NA,"2014","-55.842083","-15.379111",NA,NA,NA
"7","2020-02-08 09:31:47-03","NBC","NL-BOTANY","WAG.1826220","PreservedSpecimen","Plantae",NA,"Lamiales","Gesneriaceae","Goyazia","petraea","Goyazia petraea","(S.M.Phillips) Wiehler",NA,"Hunt DR",NA,"1966","06","19","Southern America","Brazil","Mato Grosso",NA,"Brazil. Mato Grosso: Serra Azul, c. 7 km west of Barra do Garças - Xavantina road, 77 km from Barra do Garças.",NA,NA,NA,"Sandstone conglomerate cliffs, in shade.<a href=https://data.biodiversitydata.nl/naturalis/specimen/WAG.1826220 target=other class=eLink> <mi>dwc_moreinfo</mi></a>","NL-WAG1826220","NL-WAG1826220",NA,NA,NA,NA,NA,"Magnoliopsidae","isotype","WAG0001459"
"8","2020-02-08 09:31:47-03","NBC","NL-BOTANY","WAG.1826221","PreservedSpecimen","Plantae",NA,"Lamiales","Gesneriaceae","Goyazia","petraea","Goyazia petraea","(S.M.Phillips) Wiehler","Skog LE","Hatschbach GG; Anderson WR; Barneby RC; Gates B",NA,"1975","02","13","Southern America","Brazil","Mato Grosso",NA,"Chapada dos Guimarães.",NA,NA,NA,"Paredões sombrios da base da chapada.<a href=https://data.biodiversitydata.nl/naturalis/specimen/WAG.1826221 target=other class=eLink> <mi>dwc_moreinfo</mi></a>","NL-WAG1826221","NL-WAG1826221",NA,NA,NA,NA,NA,"Magnoliopsidae",NA,"WAG0110730"
