"record_id","modified","institutionCode","collectionCode","catalogNumber","basisOfRecord","kingdom","phylum","order","family","genus","specificEpithet","scientificName","scientificNameAuthorship","identifiedBy","recordedBy","recordNumber","year","month","day","continentOcean","country","stateProvince","locality","preparationType","occurrenceRemarks","barcode","county","decimalLongitude","decimalLatitude","coordinatePrecision","geoFlag","yearIdentified","monthIdentified","verbatimLongitude","verbatimLatitude","imagecode","class","relatedCatalogItem","dayIdentified","individualCount","minimumElevationInMeters","maximumElevationInMeters","fieldNumber","typeStatus"
"1","2021-03-15 16:37:00-03","NY","NYBG","01168533","PreservedSpecimen","Plantae","Magnoliophyta","Ericales","Sapotaceae","Pradosia","decipiens","Pradosia decipiens","Ducke","T. D. Pennington","M. J. G. Hopkins","1499","1994","10","28","South America","Brazil","Amazonas","Manaus. Reserva Florestal Ducke-Igarapé do Acará","sheet","<a href='http://sweetgum.nybg.org/science/vh/specimen_details.php?irn=1329800' target='other'> <mi>dwc_moreinfo</mi></a>","NY01168533",NA,NA,NA,NA,NA,NA,NA,NA,NA,NA,NA,NA,NA,NA,NA,NA,NA,NA
"2","2021-03-15 16:37:00-03","NY","NYBG","01168532","PreservedSpecimen","Plantae","Magnoliophyta","Ericales","Sapotaceae","Pradosia","decipiens","Pradosia decipiens","Ducke","T. D. Pennington","P. A. C. L. Assunção","833","1998","04","09","South America","Brazil","Amazonas","Reserva Florestal Ducke, Manaus-Itacoatiara, Km 26. Floresta de Vertente.","sheet","<a href='http://sweetgum.nybg.org/science/vh/specimen_details.php?irn=1328236' target='other'> <mi>dwc_moreinfo</mi></a>","NY01168532","Manaus","-60.0250015258789","-3.10193991661072","138090","auto",NA,NA,NA,NA,NA,NA,NA,NA,NA,NA,NA,NA,NA
"3","2021-03-30 12:49:38-03","EAO","IAN","171555","PreservedSpecimen","Plantae","Dicotiledônea",NA,"Sapotaceae","Pradosia","decipiens","Pradosia decipiens","Ducke","Ribeiro, JELS","Souza, MAD de; Pereira, EC","474","1997","12","02","Southern America","Brasil","Amazonas","Reserva Florestal Ducke, Manaus-Itacoatiara, km 26. Próximo ao Acará. Planta fichada: 4838-05.",NA,"Árvore, aproximadamente 15m x 16cm DAP. Pedicelo verde-claro; cálice amarelado, pétalas e estames branco. Cheiro azedo.","IAN171555","Manaus","-59.966667","-2.883333",NA,NA,"1997","12","-59.966667","-2.883333",NA,NA,NA,NA,NA,NA,NA,NA,NA
"4","2021-03-30 12:49:38-03","EAO","IAN","171646","PreservedSpecimen","Plantae","Dicotiledônea",NA,"Sapotaceae","Pradosia","decipiens","Pradosia decipiens","Ducke","Pennington, TD","Ribeiro, JELS; Assunção, PACL","1579","1995","03","23","Southern America","Brasil","Amazonas","Reserva Florestal Ducke, Manaus-Itacoatiara, km 26. Igarapé do Acará. Floresta de Baixio. Baixio, argiloso. Planta fichada: 910-05.",NA,"Árvore. Dossel. Tronco DAP=50cm, aspecto circular. Raíz superficial e sapopema convexa, assimétrica, A>C (1,7m-1m), ramificada. Ritidoma marrom-esbranquiçado, com cicatrizes alaranjadas, rígido, liso, desprendimento em placas circulare","IAN171646","Manaus","-59.966667","-2.883333",NA,NA,"1998","02","-59.966667","-2.883333",NA,NA,NA,NA,NA,NA,NA,NA,NA
"5","2021-03-30 12:49:38-03","EAO","IAN","171666","PreservedSpecimen","Plantae","Dicotiledônea",NA,"Sapotaceae","Pradosia","decipiens","Pradosia decipiens","Ducke","Pennington, TD","Ribeiro, JELS; Pereira, EC","1950","1997","11","19","Southern America","Brasil","Amazonas","Reserva Florestal Ducke, Manaus-Itacoatiara, km 26. Floresta de Baixio. Planta fichada: 4843-05.",NA,"Árvore de 18m de altura. Botões verdes.","IAN171666","Manaus","-59.966667","-2.883333",NA,NA,"1998","03","-59.966667","-2.883333",NA,NA,NA,NA,NA,NA,NA,NA,NA
"6","2021-03-30 12:49:38-03","EAO","IAN","167015","PreservedSpecimen","Plantae","Dicotiledônea",NA,"Sapotaceae","Pradosia","decipiens","Pradosia decipiens","Ducke","Pennington, TD","Brito, JM de; Ribeiro, JELS","31","1997","09","09","Southern America","Brasil","Amazonas","Reserva Florestal Ducke, Manaus-Itacoatiara, km 26. Acará. Floresta de Baixio. Solo argiloso.",NA,"Árvore. Dossel. Tronco DAP=50cm, aspecto circular. Raiz superficial e sapopema convexa, assimétrica, A>C (1,7m, 1m), ramificada. Ritidoma marron-esbranquiçado, com cicatrizes alaranjadas, rígido, liso, desprendimento em placas circular","IAN167015","Itacoatiara","-59.966667","-2.883333",NA,NA,"1998","02","-59.966667","-2.883333",NA,NA,NA,NA,NA,NA,NA,NA,NA
"7","2021-04-08 17:44:12-03","EAO","IAN","XILO7189X","PreservedSpecimen","Plantae","Dicotiledônea",NA,"Sapotaceae","Pradosia","decipiens","Pradosia decipiens","Ducke",NA,"Ferreira, AM; Ferreira, GC","s.n","2002","10","23","Southern America","Brasil","Pará","Área de exploração 2002.",NA,"Árvore, 32m alt. x 2,20m CAP; base com sapopemas tabulares, até 2,5m do solo; fuste tortuoso, 22m alt.; ritidoma marrom-avermelhado, áspero, escamoso, desprendimento de pequenas placas papiráceas; lenticelas elípticas em linhas vert","IANXILO7189X","Moju","-48.7689018249512","-1.88389003276825","186920","auto",NA,NA,NA,NA,NA,NA,NA,NA,NA,NA,NA,NA,NA
"8","2021-04-08 17:44:12-03","EAO","IAN",NA,"PreservedSpecimen","Plantae","Dicotiledônea",NA,"Sapotaceae","Pradosia","decipiens","Pradosia decipiens","Ducke",NA,"Ferreira, AM; Ferreira, GC","s.n","2002","10","23","Southern America","Brasil","Pará","Área de exploração 2002.",NA,"Árvore, 32m alt. x 2,20m CAP; base com sapopemas tabulares, até 2,5m do solo; fuste tortuoso, 22m alt.; ritidoma marrom-avermelhado, áspero, escamoso, desprendimento de pequenas placas papiráceas; lenticelas elípticas em linhas verticais, alaranjadas",NA,"Moju","-48.7689018249512","-1.88389003276825","186920","auto",NA,NA,NA,NA,NA,NA,NA,NA,NA,NA,NA,NA,NA
"9","2021-04-08 17:44:12-03","EAO","IAN",NA,"PreservedSpecimen","Plantae","Dicotiledônea",NA,"Sapotaceae","Pradosia","decipiens","Pradosia decipiens","Ducke",NA,"Ferreira, AM; Ferreira, GC","s.n.","2002","10","23","Southern America","Brasil","Pará","Área de exploração 2002.",NA,"Árvore, 32m alt. x 2,20m CAP; base com sapopemas tabulares, até 2,5m do solo; fuste tortuoso, 22m alt.; ritidoma marrom-avermelhado, áspero, escamoso, desprendimento de pequenas placas papiráceas; lenticelas elípticas em linhas verticais, alaranjadas",NA,"Moju","-48.7689018249512","-1.88389003276825","186920","auto",NA,NA,NA,NA,NA,NA,NA,NA,NA,NA,NA,NA,NA
"10","2021-04-08 17:44:12-03","EAO","IAN","7189","PreservedSpecimen","Plantae","Dicotiledônea",NA,"Sapotaceae","Pradosia","decipiens","Pradosia decipiens","Ducke",NA,"Ferreira, AM; Ferreira, GC","s.n.","2002","10","23","Southern America","Brasil","Pará","Área de exploração 2002.",NA,"Árvore, 32m alt. x 2,20m CAP; base com sapopemas tabulares, até 2,5m do solo; fuste tortuoso, 22m alt.; ritidoma marrom-avermelhado, áspero, escamoso, desprendimento de pequenas placas papiráceas; lenticelas elípticas em linhas vertica","IAN007189","Moju","-48.7689018249512","-1.88389003276825","186920","auto",NA,NA,NA,NA,"IAN007189_f",NA,NA,NA,NA,NA,NA,NA,NA
"11","2021-04-08 17:44:12-03","EAO","IAN","XILO7189X","PreservedSpecimen","Plantae","Dicotiledônea",NA,"Sapotaceae","Pradosia","decipiens","Pradosia decipiens","Ducke",NA,"Ferreira, AM; Ferreira, GC","s.n","2002","10","23","Southern America","Brasil","Pará","Área de exploração 2002.",NA,"Árvore, 32m alt. x 2,20m CAP; base com sapopemas tabulares, até 2,5m do solo; fuste tortuoso, 22m alt.; ritidoma marrom-avermelhado, áspero, escamoso, desprendimento de pequenas placas papiráceas; lenticelas elípticas em linhas vert","IANXILO7189X","Moju","-48.7689018249512","-1.88389003276825","186920","auto",NA,NA,NA,NA,NA,NA,NA,NA,NA,NA,NA,NA,NA
"12","2020-02-08 09:04:46-03","NBC","NL-BOTANY","U.1592798","PreservedSpecimen","Plantae",NA,"Ericales","Sapotaceae","Pradosia","decipiens","Pradosia decipiens","Ducke","Pennington TD","Assunção PACL",NA,"1998","04","09","Southern America","Brazil","Amazonas",NA,NA,"<a href=https://data.biodiversitydata.nl/naturalis/specimen/U.1592798 target=other class=eLink> <mi>dwc_moreinfo</mi></a>","NL-U1592798",NA,"-59.966667","-2.883333",NA,NA,NA,NA,"-59.966667","-2.883333","NL-U1592798","Magnoliopsidae","U 0132938",NA,NA,NA,NA,NA,NA
"13","2020-02-08 09:04:46-03","NBC","NL-BOTANY","U.1592799","PreservedSpecimen","Plantae",NA,"Ericales","Sapotaceae","Pradosia","decipiens","Pradosia decipiens","Ducke","Pennington TD","Hopkins MJG",NA,"1994","10","28","Southern America","Brazil","Amazonas",NA,NA,"<a href=https://data.biodiversitydata.nl/naturalis/specimen/U.1592799 target=other class=eLink> <mi>dwc_moreinfo</mi></a>","NL-U1592799",NA,"-59.966667","-2.883333",NA,NA,"1998","02","-59.966667","-2.883333","NL-U1592799","Magnoliopsidae","U 0131485","01",NA,NA,NA,NA,NA
"14","2014-10-02 12:41:13-03","FEMACT","MIRR","9431","S","Plantae",NA,NA,"Sapotaceae","Pradosia","decipiens","Pradosia decipiens","Ducke",NA,"Farias H.L.S.","96","2011","03","26",NA,"Brasil","Roraima","Igarapé Traíra, Mata de Galeria,, 2°75°57.04N e 7°32°64.08O",NA,"Espécime de hábito arbóreo, base reta, fuste cilíndrico, casca com aparência fendida com desprendimento de placas lenhosas, folhas concolor com venação eucampdódroma, consistência cartácea sem flores e sem frutos, ambiente de mata de galeria.",NA,"Mucajaí","-60.978722","2.39325",NA,NA,NA,NA,"-60.978722","2.39325",NA,NA,NA,NA,NA,NA,NA,NA,NA
"15","2020-12-20 21:19:26-03","UFV","VIC","024892","PreservedSpecimen","Plantae",NA,NA,"Sapotaceae","Pradosia","decipiens","Pradosia decipiens","Ducke",NA,"Ribeiro, J.E.L.S.; et al.","1950","1997","11","19",NA,"Brasil","Manaus","Reserva Florestal Ducke",NA,"Floresta de baixio, Árvore de 18 m, botões verdes.","VIC024892","Itacotiara",NA,NA,NA,NA,NA,NA,NA,NA,"VIC024892",NA,NA,NA,NA,NA,NA,NA,NA
"16","2021-03-01 16:41:14-03","UNICAMP","UEC","102589","S","Plantae","Magnoliopsida",NA,"Sapotaceae","Pradosia","decipiens","Pradosia decipiens","Ducke","Pennington, TD","Brito, JM; Ribeiro, JELS; Pereira, EC; Silva, CF","31","1997","09","09",NA,"Brazil","Amazonas","Reserva Florestal Ducke, Manaus-Itacoatiara, km 26.",NA,"Árvore. Tronco DAP=50 cm, aspecto circular. Raiz superficial e sapopema convexa, assimétrica, A>C (1,7m,1m), ramificada. Ritidoma marrom-esbranquiçado, com cicatrizes alaranjadas, rígido, liso, desprendimento em placas circulares, de i","UEC047775","Manaus","-59.966667","-2.883333",NA,NA,"1998","02","-59.966667","-2.883333","UEC047775",NA,NA,NA,NA,NA,NA,NA,NA
"17","2021-03-01 16:41:14-03","UNICAMP","UEC","113259","S","Plantae","Magnoliopsida",NA,"Sapotaceae","Pradosia","decipiens","Pradosia decipiens","Ducke","Pennington, TD","Ribeiro, JELS; Assunção, PACL","1579","1995","03","23",NA,"Brazil","Amazonas","Reserva Florestal Ducke, Manaus-Itacoatiara, km 26.",NA,"Árvore. Tronco DAP= 50cm, aspecto circular. Raiz superficial e sapopema convexa, assimétrica, A>C (1,7m,1m), ramificada. Ritidoma marrom-esbranquiçado, com cicatrizes alaranjadas, rígido, liso, desprendimento em placas circulares, de i","UEC047774","Manaus","-59.966667","-2.883333",NA,NA,"1998","02","-59.966667","-2.883333","UEC047774",NA,NA,NA,NA,NA,NA,NA,NA
"18","2019-11-19 14:09:26-03","UFRPE","PEUFR","35277","PreservedSpecimen","Plantae",NA,NA,"Sapotaceae","Pradosia","decipiens","Pradosia decipiens","Ducke","J. E. L. S. Ribeiro","M. A. D. de Souza; E. da C. Pereira; C. F. da Silva; Z. A. Pinheiro","474","1997","12","02",NA,"Brasil","Amazonas","Reserva Florestal Ducke. Km 26.",NA,"Árvore aproximadamente 15x16cm DAP. Flores com cheiro azedo; pedicelo verde-claro; cálice amarelado; pétalas brancas; estames brancos.","PEUFR035277","Manaus/Itacoatiara","-59.966667","-2.883333",NA,NA,"1997","12","59°58'00''W","02°53'00''S",NA,NA,NA,NA,NA,NA,NA,NA,NA
"19","2020-12-21 16:44:52-03","MBM","MBM","243271","PreservedSpecimen","Plantae",NA,NA,"Sapotaceae","Pradosia","decipiens","Pradosia decipiens","Ducke","Pennington, T.D.","Ribeiro, J.E.L.S.; et al.; et al.","1579",NA,NA,NA,"Southern America","Brazil","Amazonas","Reserva Florestal Ducke, Igarapé do Acará",NA,NA,"MBM243271","Manaus","-60.0250015258789","-3.10193991661072","138090","auto",NA,NA,NA,NA,"MBM243271",NA,NA,NA,NA,NA,NA,NA,NA
"20","2021-02-11 17:21:42-03","UFPR","UPCB","42323","PreservedSpecimen","Plantae",NA,NA,"Sapotaceae","Pradosia","decipiens","Pradosia decipiens","Ducke","Pennington, T.D.","Ribeiro, J.E.L.S.","1950","1997","11","19",NA,"Brasil","Amazonas","Reserva Florestal Ducke, 02°53'S e 59°58'W",NA,"Árvore, 18m, botões verdes..",NA,"Manaus","-59.966667","-2.883333",NA,NA,"1998","03","-59.966667","-2.883333",NA,NA,NA,NA,NA,NA,NA,NA,NA
"21","2014-11-02 19:09:00-02","MO","MOBOT","3316525","PreservedSpecimen","Plantae",NA,NA,"Sapotaceae","Pradosia","decipiens","Pradosia decipiens","Ducke","Pennington, T.D.","Michael J.G. Hopkins","Hopkins 1499","1994","10","28","South America","Brazil","Amazonas","Reserva Florestal Ducke, Manaus-Itacoatiara, km 26. Igarapé do Acará. Floresta de Baixio. Árvore. Solo argiloso, dossel. Tronco DAP=50 cm, aspecto circular. Raíz superficial e sapopema convexa, assimétrica, AC (1,7 m, 1m), ramificada.",NA,NA,NA,NA,"-59.96666","-2.88333",NA,NA,NA,NA,NA,NA,NA,NA,NA,NA,NA,NA,NA,NA,NA
"22","2018-06-28 11:52:00-03","MO","MOBOT","101052880","PreservedSpecimen","Plantae",NA,NA,"Sapotaceae","Pradosia","decipiens","Pradosia decipiens","Ducke","M. H. Terra-Araujo","M.H. Terra-Araújo|Fernanda A. Carvalho","Terra-Araújo 676","2009","10","17","South America","Brazil","Amazonas","Reserva Florestal Adolpho Ducke. AM 010, Km 26. Igarapé do Acará, floresta de campinarana.",NA,NA,NA,"Manaus","-59.9666667","-2.9297223",NA,NA,NA,NA,NA,NA,NA,NA,NA,NA,"1",NA,NA,NA,NA
"23","2014-04-05 06:07:00-03","MO","MOBOT","3327714","PreservedSpecimen","Plantae",NA,NA,"Sapotaceae","Pradosia","decipiens","Pradosia decipiens","Ducke","Pennington, T.D.","P. A. Costa Lima Assunção|E. da C. Pereira|C. Fernandes da Silva","Assunção 833","1998","4","9","South America","Brazil","Amazonas","Reserva Florestal Ducke, Manaus-Itacoatiara, km 26. Floresta de Baixio. Árvore.",NA,NA,NA,NA,"-59.96666","-2.88333",NA,NA,NA,NA,NA,NA,NA,NA,NA,NA,NA,NA,NA,NA,NA
"24","2020-08-31 08:55:02-03","INPA","INPA","138678","S","Plantae","Dicotyledon Asterids","Ericales","Sapotaceae","Pradosia","decipiens","Pradosia decipiens","Ducke","Pennington, TD","Ferreira, CAC","7044","1986","03","31","Southern America","Brasil","Amazonas","Estrada da UHE de Balbina, próx. igarapé do Barret, Estrada da Usina Hidrelétrica de Balbina, próximo ao Igarapé do Barreto.",NA,NA,"INPA0138678","Presidente Figueiredo","-60","-1.033333",NA,NA,"2000",NA,"-60","-1.033333","INPA0138678 INPA0138678_e",NA,NA,NA,NA,NA,NA,NA,NA
"25","2021-01-10 20:43:22-03","INPA","INPA","179250","S","Plantae","Dicotyledon Asterids","Ericales","Sapotaceae","Pradosia","decipiens","Pradosia decipiens","Ducke","Pennington, TD","Hopkins, MJG","1499","1994","10","28","Southern America","Brasil","Amazonas","Reserva Florestal Adolfo Ducke, Igarapé do Acará.",NA,NA,"INPA0179250","Manaus","-59.966667","-2.883333",NA,NA,NA,NA,"-59.966667","-2.883333","INPA0179250 INPA0179250_e",NA,NA,NA,NA,NA,NA,NA,NA
"26","2021-01-10 20:43:22-03","INPA","INPA","179318","S","Plantae","Dicotyledon Asterids","Ericales","Sapotaceae","Pradosia","decipiens","Pradosia decipiens","Ducke","Pennington, TD","Ribeiro, JELS","1579","1995","03","23","Southern America","Brasil","Amazonas","Reserva Florestal Adolfo Ducke, Igarapé do Acará.",NA,NA,"INPA0179318","Manaus","-59.966667","-2.883333",NA,NA,NA,NA,"-59.966667","-2.883333",NA,NA,NA,NA,NA,NA,NA,NA,NA
"27","2021-01-10 20:43:22-03","INPA","INPA","191583","S","Plantae","Dicotyledon Asterids","Ericales","Sapotaceae","Pradosia","decipiens","Pradosia decipiens","Ducke","Pennington, TD","Brito, JM de","31","1997","09","09","Southern America","Brasil","Amazonas","Reserva Florestal Adolfo Ducke, Ácara",NA,NA,"INPA0191583","Manaus","-59.966667","-2.883333",NA,NA,"1998","02","-59.966667","-2.883333","INPA0191583 INPA0191583_e",NA,NA,NA,NA,NA,NA,NA,NA
"28","2021-01-10 20:43:22-03","INPA","INPA","191602","S","Plantae","Dicotyledon Asterids","Ericales","Sapotaceae","Pradosia","decipiens","Pradosia decipiens","Ducke","Pennington, TD","Ribeiro, JELS","1950","1997","11","19","Southern America","Brasil","Amazonas","Reserva Florestal Adolfo Ducke",NA,NA,"INPA0191602","Manaus","-59.966667","-2.883333",NA,NA,"1998","03","-59.966667","-2.883333","INPA0191602 INPA0191602_e",NA,NA,NA,NA,NA,NA,NA,NA
"29","2021-01-10 20:43:22-03","INPA","INPA","191745","S","Plantae","Dicotyledon Asterids","Ericales","Sapotaceae","Pradosia","decipiens","Pradosia decipiens","Ducke","Ribeiro, JELS","Souza, MAD de","474","1997","12","02","Southern America","Brasil","Amazonas","Reserva Florestal Adolfo Ducke, Próx. ao Acará.",NA,NA,"INPA0191745","Manaus","-59.966667","-2.883333",NA,NA,"1997","12","-59.966667","-2.883333","INPA0191745 INPA0191745_e",NA,NA,NA,NA,NA,NA,NA,NA
"30","2021-01-10 20:43:22-03","INPA","INPA","192597","S","Plantae","Dicotyledon Asterids","Ericales","Sapotaceae","Pradosia","decipiens","Pradosia decipiens","Ducke","Pennington, TD","Assunção, PACL","833","1998","04","09","Southern America","Brasil","Amazonas","Reserva Florestal Adolfo Ducke",NA,NA,"INPA0192597","Manaus","-59.966667","-2.883333",NA,NA,"1999","02","-59.966667","-2.883333","INPA0192597 INPA0192597_e",NA,NA,NA,NA,NA,NA,NA,NA
"31","2021-01-10 20:43:22-03","INPA","INPA","232988","S","Plantae","Dicotyledon Asterids","Ericales","Sapotaceae","Pradosia","decipiens","Pradosia decipiens","Ducke","Terra-Araujo, MH","Castilho, CV de","503","2002","01","09","Southern America","Brasil","Amazonas","Reserva Florestal Adolfo Ducke, Rodovia Manaus-Itacoatiara, km 26. Trilha L-O2, km 6.5.",NA,NA,"INPA0232988","Manaus","-59.910159","-2.927591",NA,NA,"2011","01","-59.910159","-2.927591","INPA0232988 INPA0232988_e",NA,NA,NA,NA,"59","59",NA,NA
"32","2021-01-10 20:43:22-03","INPA","INPA","250448","S","Plantae","Dicotyledon Asterids","Ericales","Sapotaceae","Pradosia","decipiens","Pradosia decipiens","Ducke","Terra-Araujo, MH","Terra-Araujo, MH","676","2009","10","17","Southern America","Brasil","Amazonas","Reserva Florestal Adolfo Ducke, AM 010, Km 26.",NA,NA,"INPA0250448","Manaus","-59.966667","-2.9298",NA,NA,"2011","06","-59.966667","-2.9298","INPA0250448 INPA0250448_e",NA,NA,"02",NA,NA,NA,NA,NA
"33","2020-09-12 05:00:02-03","US","US","3439064","PreservedSpecimen","Plantae",NA,"Ebenales","Sapotaceae","Pradosia","decipiens","Pradosia decipiens","Ducke",NA,"J. Brito, J. E.L. S. Ribeiro, E. C. Pereira & C. F. Silva","31","1997","9","9","South America - Neotropics","Brazil","Amazonas","Reserva Ducke Amazonas. Reserva Florestal Ducke, Manaus-Itacoatiara, km 26. Acara Floresta de Baixio.",NA,NA,"US02706170",NA,"-59.97","-2.88",NA,NA,NA,NA,NA,NA,"US02706170_01","Dicotyledonae",NA,NA,"1",NA,NA,NA,NA
"34","2020-09-12 05:00:02-03","US","US","3564218","PreservedSpecimen","Plantae",NA,"Ebenales","Sapotaceae","Pradosia","decipiens","Pradosia decipiens","Ducke",NA,"J. E.L. S. Ribeiro & P. A. Assunçao","1579","1995","3","23","South America - Neotropics","Brazil","Amazonas","Reserva Ducke Amazonas. Reserva Florestal Ducke, Manaus-Itacoatiara, km 26. Igarape do Acara. Floresta de Baixio.",NA,NA,"US02706171",NA,"-59.97","-2.88",NA,NA,NA,NA,NA,NA,"US02706171_01","Dicotyledonae",NA,NA,"1",NA,NA,NA,NA
"35","2019-11-13 11:31:50-03","USP","SPF","141782","PreservedSpecimen","Plantae",NA,NA,"Sapotaceae","Pradosia","decipiens","Pradosia decipiens","Ducke","Pennington, TD","Ribeiro, JELS","1579","1995","03","23",NA,"Brasil","Amazonas","Reserva Florestal Adolpho Ducke",NA,NA,"SPF00141782","Manaus","-59.966667","-2.883333",NA,NA,"1998","02","-59.966667","-2.883333",NA,NA,NA,NA,NA,NA,NA,NA,NA
"36","2019-11-13 11:31:50-03","USP","SPF","141783","PreservedSpecimen","Plantae",NA,NA,"Sapotaceae","Pradosia","decipiens","Pradosia decipiens","Ducke","Ribeiro, JELS","Souza, MAD","474","1997","12","02",NA,"Brasil","Amazonas","Reserva Florestal Adolpho Ducke",NA,NA,"SPF00141783","Manaus","-59.966667","-2.883333",NA,NA,"1997","12","-59.966667","-2.883333",NA,NA,NA,NA,NA,NA,NA,NA,NA
"37","2014-04-30 11:09:27-03","FSL","HFSL","4814","S","Plantae",NA,NA,"Sapotaceae","Pradosia","decipiens","Pradosia decipiens","Ducke","Pennington, T.D.","Ferreira, C.A.C.; et al.","7044","1986","03","31","Southern America","Brasil","Amazonas","Estrada da UHE de Balbina, próximo ao igarapé do B, Estrada da UHE de Balbina, próximo ao igarapé do Barreto. Mata de terra firme, solo argilo-arenoso.",NA,"Árvore de 15 m de altura x 25 cm de diâmetro. Frutos imaturos verdes. Madeira dura com cerne castanho, alburno creme. Látex branco. ; DE",NA,"Presidente Figueiredo","-60","-1.033333",NA,NA,"2000","01","-60","-1.033333",NA,NA,NA,"01",NA,NA,NA,NA,NA
"38","2018-12-03 12:36:30-02","F","FMNH-SEEDPLANTS",NA,"PreservedSpecimen","Plantae","Spermatophyta",NA,"Sapotaceae","Pradosia","decipiens","Pradosia decipiens",NA,"RRC ID Flag","M. A. D. de Souza","474",NA,NA,NA,"South America","Brazil","Amazonas",NA,NA,NA,NA,NA,NA,NA,NA,NA,NA,NA,NA,NA,NA,"Dicotyledoneae",NA,NA,NA,NA,NA,"474",NA
"39","2015-04-16 14:15:18-03","F","FMNH-SEEDPLANTS","V0317519F","PreservedSpecimen","Plantae","Spermatophyta",NA,"Sapotaceae","Pradosia","decipiens","Pradosia decipiens",NA,NA,NA,NA,NA,NA,NA,"South America","Brazil",NA,NA,NA,NA,"V0317519F",NA,"-52.8731","-10.8339",NA,NA,NA,NA,NA,NA,"V0317519F_01","Dicotyledoneae",NA,NA,NA,NA,NA,NA,NA
"40","2009-11-26 13:56:34-02","INPA","INPAW","10093","S","Plantae",NA,NA,"Sapotaceae","Pradosia","decipiens","Pradosia decipiens","Ducke",NA,"Ferreira, C.A.C.","7044","1986","03","31",NA,"Brasil","Amazonas",NA,NA,NA,NA,"Presidente Figueiredo","-60.025","-2.03444","229398","auto",NA,NA,NA,NA,NA,NA,NA,NA,NA,NA,NA,NA,NA
"41","2021-02-23 13:23:08-03","MN","R-TIPOS","54689","PreservedSpecimen","Plantae",NA,NA,"Sapotaceae","Pradosia","decipiens","Pradosia decipiens","Ducke",NA,"Ducke, W.A.","JB - 24860","1932","12","02",NA,"Brasil","Amazonas","Cachoeira baixa do Rio Tarumá",NA,NA,"R000054689","Manaus","-60.0250015258789","-3.10193991661072","138090","auto",NA,NA,NA,NA,"R000054689_001",NA,NA,NA,NA,NA,NA,NA,"Isotypus"
"42","2021-03-19 18:13:09-03","UFMT","UFMT","22427","S","Plantae",NA,NA,"Sapotaceae","Pradosia","decipiens","Pradosia decipiens","Ducke","Ribeiro, J.E.L.S.","Souza, M.A.D.; Pereira, E.C.; Silva, C.F.; Pinheiro, Z.A.","474","1997","12","02",NA,"Brasil","Amazonas","Reserva Florestal Ducke, Manaus-Itacoatiara, Km 26. Próx. ao Aracá.",NA,"Árvore aprox. 15m x 16cm DAP, pedicelo verde-claro, cálice amarelado, pétalas e estames branco, cheiro azedo.&nf;Planta fichada 4838-05",NA,NA,"-59.966667","-2.883333",NA,NA,"1997","12","-59.966667","-2.883333",NA,NA,NA,NA,NA,NA,NA,NA,NA
"43","2020-01-31 10:39:39-03","IFAM","EAFM","12671","PreservedSpecimen","Plantae",NA,NA,"Sapotaceae","Pradosia","decipiens","Pradosia decipiens","Ducke","Terra-Araujo, M.H.","Castilho, C.V.; Pereira, E da C; Souza, S.S. de; Santos, A.E. & Pieroni, G.","503","2002","01","09",NA,"Brasil","Amazonas","Reserva Florestal Adolfo Ducke, Rodovia Manaus-Itacoatiara, km 26. Trilha L-O2, km 6.5.",NA,"; DESC: Árvore de dossel. Base acanalada. Ritidoma amarelado com manchas alaranjadas. Esxudato branco nas folhas. DAP:33.9 cm. Fruto imaturo.",NA,"Manaus","-59.910159","-2.927591",NA,NA,"2011","01","-59.910159","-2.927591",NA,NA,NA,NA,NA,"59","59",NA,NA
"44","2020-09-24 08:25:36-03","IBt","SP","330613","S","Plantae",NA,NA,"Sapotaceae","Pradosia","decipiens","Pradosia decipiens","Ducke",NA,"Hopkins, MJG","1499","1994","10","28",NA,"Brasil","Amazonas","Reserva Florestal Ducke",NA,NA,NA,"Manaus","-60.0250015258789","-3.10193991661072","138090","auto",NA,NA,NA,NA,NA,NA,NA,NA,NA,NA,NA,NA,NA
"45","2020-10-15 10:09:38-03","IBt","SP","342147","S","Plantae",NA,NA,"Sapotaceae","Pradosia","decipiens","Pradosia decipiens","Ducke",NA,"Assunção, PACL","833","1998","04","09",NA,"Brasil","Amazonas","Reserva Florestal Ducke",NA,NA,NA,"Manaus","-60.0250015258789","-3.10193991661072","138090","auto",NA,NA,NA,NA,NA,NA,NA,NA,NA,NA,NA,NA,NA
"46","2014-09-23 10:59:44-03","G","G","G00439603","S","Plantae",NA,NA,"Sapotaceae","Pradosia","decipiens","Pradosia decipiens","Ducke","?","Ducke, A.","24860","1932","12","02","AMERIQUE DU SUD","Brazil","Amazonas",NA,NA,"Coordinate uncertainty: Precision undefined Image URL: No picture available on the institution's web site","G00439603","Manaus","-60.02111111","-3.11861111",NA,NA,NA,NA,"-60.02111111","-3.11861111",NA,NA,NA,NA,NA,NA,NA,NA,"ISOTYPUS of Pradosia decipiens Ducke"
