"record_id","modified","institutionCode","collectionCode","catalogNumber","basisOfRecord","kingdom","phylum","family","genus","specificEpithet","scientificName","scientificNameAuthorship","identifiedBy","typeStatus","recordedBy","recordNumber","year","month","day","country","stateProvince","county","locality","decimalLongitude","decimalLatitude","verbatimLongitude","verbatimLatitude","occurrenceRemarks","barcode","imagecode","coordinatePrecision","geoFlag","continentOcean","yearIdentified","monthIdentified","minimumElevationInMeters","maximumElevationInMeters","class","order","dayIdentified"
"1","2021-03-25 09:28:15-03","UNICAMP","UEC","69906","S","Plantae","Magnoliopsida","Solanaceae","Calibrachoa","eglandulata","Calibrachoa eglandulata","Stehmann & Semir","Stehmann, JR; Semir, J","holotypus","Stehmann, JR; Dutilh, JHA","1534","1994","11","04","Brazil","Santa Catarina","Urubici","Estrada da Serra do Corvo Branco, em direção a Urubici (após subida da Serra)","-49.812778","-28.220778","-49.812778","-28.220778","Erva a arbusto decumbentes, em barranco em beira de estrada; flores com corola com tubo externamente amarelo, com nervuras marcadas (listras) e limbo magenta; estames abrindo-se próximos à boca do tubo","UEC060884","UEC060884",NA,NA,NA,NA,NA,NA,NA,NA,NA,NA
"2","2021-03-01 16:41:25-03","UNICAMP","UEC","77945","S","Plantae","Magnoliopsida","Solanaceae","Calibrachoa","eglandulata","Calibrachoa eglandulata","Stehmann & Semir",NA,NA,"Stehmann, JR; Borba, EL; Ippolito, A; Reis, C","1764","1995","12","06","Brazil","Santa Catarina","Urubici","Estrada Serra do Corvo Branco.","-49.5917015075684","-28.0149993896484",NA,NA,"Subarbusto; ramos inicialmente eretos, posteriormente flexuosos, corola base estriada amarela, fauce amarela, limbo magenta.; Em barranco rochoso na beira da estrada.","UEC058391","UEC058391","30102","auto",NA,NA,NA,NA,NA,NA,NA,NA
"3","2021-03-01 16:41:25-03","UNICAMP","UEC","77946","S","Plantae","Magnoliopsida","Solanaceae","Calibrachoa","eglandulata","Calibrachoa eglandulata","Stehmann & Semir",NA,NA,"Stehmann, JR; Borba, EL; Ippolito, A; Reis, C","1765","1995","12","06","Brazil","Santa Catarina","Urubici","Estrada Serra do Corvo Branco.","-49.5917015075684","-28.0149993896484",NA,NA,"Subarbusto; ramos inicialmente eretos, posteriormente flexuosos, corola base estriada amarela, fauce amarela, limbo magenta.; Em barranco rochoso na beira da estrada.","UEC058392","UEC058392","30102","auto",NA,NA,NA,NA,NA,NA,NA,NA
"4","2021-03-01 16:41:25-03","UNICAMP","UEC","77947","S","Plantae","Magnoliopsida","Solanaceae","Calibrachoa","eglandulata","Calibrachoa eglandulata","Stehmann & Semir",NA,NA,"Stehmann, JR; Borba, EL; Ippolito, A; Reis, C","1763","1995","12","06","Brazil","Santa Catarina","Urubici","Estrada Serra do Corvo Branco.","-49.5917015075684","-28.0149993896484",NA,NA,"Subarbusto; ramos inicialmente eretos, posteriormente flexuosos, corola base estriada amarela, fauce amarela, limbo magenta.; Em barranco rochoso na beira da estrada.","UEC058389","UEC058389","30102","auto",NA,NA,NA,NA,NA,NA,NA,NA
"5","2020-12-04 13:19:44-03","UDESC","LUSC","4853","PreservedSpecimen","Plantae",NA,"Solanaceae","Calibrachoa","eglandulata","Calibrachoa eglandulata","Stehmann & Semir","Murilo",NA,"Murilo","6","2006","10","19","Brasil","Santa Catarina","Lages",NA,"-50.326099395752","-27.8160991668701",NA,NA,NA,"LUSC001113","LUSC001113","70701","auto",NA,NA,NA,NA,NA,NA,NA,NA
"6","2020-12-21 16:45:23-03","MBM","MBM","218698","PreservedSpecimen","Plantae",NA,"Solanaceae","Calibrachoa","eglandulata","Calibrachoa eglandulata","Stehmann & Semir",NA,"PARATYPE","Stehmann, J.R.; Borba, E.L.; Ippolito, A.; Reis, C.; Borba, E.L.; Ippolito, A.; Reis, C.","1763","1995","12","06","Brazil","Santa Catarina","Urubici","Serra do Corvo Branco, Estrada Serra do Corvo Branco","-49.5917015075684","-28.0149993896484",NA,NA,"Subarbusto; ramos inicialmente eretos, posteriormente flexuosos; corola base estriada amarela, fauce amarela, limbo magenta.; Em barranco rochoso na beira da estrada.","MBM218698","MBM218698","30102","auto","Southern America",NA,NA,NA,NA,NA,NA,NA
"7","2020-12-21 16:45:23-03","MBM","MBM","399902","PreservedSpecimen","Plantae",NA,"Solanaceae","Calibrachoa","eglandulata","Calibrachoa eglandulata","Stehmann & Semir","Lozano, E.D.",NA,"Lozano, E.D.; Engels, M.E.; Engels, M.E.","2273","2013","12","12","Brazil","Paraná","Guarapuava","Rodovia BR-277, sentido Candói","-51.999444","-25.534056","-51.999444","-25.534056","Subarbusto, 70 cm, flores lilases.; Campos de Guarapuava, campo úmido.","MBM399902","MBM399902",NA,NA,"Southern America","2015",NA,NA,NA,NA,NA,NA
"8","2020-12-21 16:45:23-03","MBM","MBM","399907","PreservedSpecimen","Plantae",NA,"Solanaceae","Calibrachoa","eglandulata","Calibrachoa eglandulata","Stehmann & Semir","Lozano, E.D.",NA,"Lozano, E.D.; Engels, M.E.; Engels, M.E.","2300","2013","12","12","Brazil","Paraná","Candói","Fazenda Capão Redondo","-51.803222","-25.423556","-51.803222","-25.423556","Subarbusto, 50 cm, flores lilases.; Campos de Guarapuava, campo úmido.","MBM399907","MBM399907",NA,NA,"Southern America","2015",NA,NA,NA,NA,NA,NA
"9","2020-12-21 16:45:23-03","MBM","MBM","400139","PreservedSpecimen","Plantae",NA,"Solanaceae","Calibrachoa","eglandulata","Calibrachoa eglandulata","Stehmann & Semir","Lozano, E.D.",NA,"Motta, J.T.; Silva, J.M.; Silva, J.M.","4438","2014","11","22","Brazil","Paraná","Coronel Domingos Soares","São João","-52.040083","-26.194222","-52.040083","-26.194222","Subarbusto; flor vinosa com o interior do tubo amarelo.; Em campo na borda da mata; Floresta Ombrófila Mista.","MBM400139","MBM400139",NA,NA,"Southern America","2015","03","1045","1045",NA,NA,NA
"10","2020-12-11 11:41:42-03","UFMG","BHCB","104868","PreservedSpecimen","Plantae","Dicotyledon","Solanaceae","Calibrachoa","eglandulata","Calibrachoa eglandulata","Stehmann & Semir",NA,NA,"Fregonezi, J","s.n.","2006","11","30","Brasil","Santa Catarina","Urubici","Estrada Urubici- Serra do Corvo Branco, ponto 28","-49.406647","-28.042331","-49.406647","-28.042331",NA,"BHCB022979",NA,NA,NA,"Southern America",NA,NA,NA,NA,NA,NA,NA
"11","2020-12-11 11:41:42-03","UFMG","BHCB","104869","PreservedSpecimen","Plantae","Dicotyledon","Solanaceae","Calibrachoa","eglandulata","Calibrachoa eglandulata","Stehmann & Semir",NA,NA,"Fregonezi, J","s.n.","2006","11","30","Brasil","Santa Catarina","Urubici","Estrada Urubici-Serra do Corvo Branco, ponto 29","-49.408489","-28.042969","-49.408489","-28.042969",NA,"BHCB022980",NA,NA,NA,"Southern America",NA,NA,NA,NA,NA,NA,NA
"12","2020-12-11 11:41:42-03","UFMG","BHCB","104877","PreservedSpecimen","Plantae","Dicotyledon","Solanaceae","Calibrachoa","eglandulata","Calibrachoa eglandulata","Stehmann & Semir",NA,NA,"Fregonezi, J","s.n.","2006","11","30","Brasil","Santa Catarina","Urubici","Estrada Serr Corvo Branco-Cpo dos Padres, barranco na estrada da Pousada Rio Canoas a 4km d pto 26","-49.3725","-28.025556","-49.3725","-28.025556",NA,"BHCB022978",NA,NA,NA,"Southern America",NA,NA,NA,NA,NA,NA,NA
"13","2020-12-11 11:41:42-03","UFMG","BHCB","192526","PreservedSpecimen","Plantae","Dicotyledon","Solanaceae","Calibrachoa","eglandulata","Calibrachoa eglandulata","Stehmann & Semir",NA,NA,"Augsten, M; Stehmann, JR","1128","2018","11","02","Brasil","Santa Catarina","Urubici","Estrada para Serra do Corvo Branco","-49.409444","-28.043333","-49.409444","-28.043333","PLANTA PRENSADA EM ÁLCOOL; Flores rosas","BHCB192526",NA,NA,NA,"Southern America",NA,NA,"960","960",NA,NA,NA
"14","2020-12-11 11:41:42-03","UFMG","BHCB","80079","PreservedSpecimen","Plantae","Dicotyledon","Solanaceae","Calibrachoa","eglandulata","Calibrachoa eglandulata","Stehmann & Semir",NA,NA,"Stehmann, JR; Lorenz, AP; Castro, IB; Heller, AA","3343","2002","12","04","Brasil","Santa Catarina","Urubici","estrada para a Serra do Corvo branco","-49.409731","-28.043422","-49.409731","-28.043422","Subarbusto decubente; flores com corola magenta, fauce amarela; afloramento rochoso","BHCB022981",NA,NA,NA,"Southern America",NA,NA,"991","991",NA,NA,NA
"15","2020-12-11 11:41:42-03","UFMG","BHCB","99783","PreservedSpecimen","Plantae","Dicotyledon","Solanaceae","Calibrachoa","eglandulata","Calibrachoa eglandulata","Stehmann & Semir",NA,NA,"Stehmann, JR; Mentz, LA; Fregonezi, JN; Teles, AM","4402","2005","11","26","Brasil","Santa Catarina","São Joaquim","Estrada para a Serra do Corvo Branco","-49.9317016601562","-28.2938995361328",NA,NA,"Erva, pendente em barranco na beira da estrada; flores magenta, com fauce amarela, com listras escuras. material preservado em alcool antes da secagem.; Erva; flores magenta com fauce amarela, com litras escuras; Pendente em barranco","BHCB001983","BHCB001983","48290","auto","Southern America",NA,NA,"948","948",NA,NA,NA
"16","2020-12-11 11:41:42-03","UFMG","BHCB","116967","PreservedSpecimen","Plantae","Dicotyledon","Solanaceae","Calibrachoa","eglandulata","Calibrachoa eglandulata","Stehmann & Semir",NA,NA,"Fregonezi, J; Ramos, A","38","2007","11","16","Brasil","Santa Catarina","Bom Jardim da Serra","Pto9","-49.624698638916","-28.3369007110596",NA,NA,"Arbusto ca. 4 m altura. Folhas verdes na face superior e face inferior mais clara. Flores esverdeada","BHCB022487",NA,"32577","auto","Southern America",NA,NA,NA,NA,NA,NA,NA
"17","2019-08-08 04:35:00-03","MO","MOBOT","2282381","PreservedSpecimen","Plantae",NA,"Solanaceae","Calibrachoa","eglandulata","Calibrachoa eglandulata","Stehmann & Semir",NA,"Isotype","J.R. Stehmann|J. H. A. Dutilh","Stehmann 1534","1994","11","4","Brazil","Santa Catarina",NA,"Urubici. Estrada da Serra do Corvo Branco em direcão a Urubici (após subida da Serra).",NA,NA,NA,NA,NA,NA,NA,NA,NA,"South America",NA,NA,NA,NA,NA,NA,NA
"18","2019-10-07 09:18:05-03","UEFS","HUEFS","75253","PreservedSpecimen","Plantae","Angiospermae","Solanaceae","Calibrachoa","eglandulata","Calibrachoa eglandulata","Stehmann & Semir",NA,NA,"Stehmann, J.R.","3343","2002","12","04","Brasil","Santa Catarina","Urubici","Estrada para serra do Corvo Branco.","-49.409722","-28.043333","49W24'35''","28S2'36''",NA,"HUEFS0075253","HUEFS0075253",NA,NA,NA,NA,NA,"991","991","Asteranae","Solanales",NA
"19","2020-08-20 20:42:12-03","UFSC","FLOR","64327","PreservedSpecimen","Plantae",NA,"Solanaceae","Calibrachoa","eglandulata","Calibrachoa eglandulata","Stehmann & Semir","Lozano, E.D.",NA,"Lozano, E.D.; Engels, M.E.","2300","2013","12","12","Brasil","Paraná","Candói","Fazenda Capão Redondo.","-51.803333","-25.423611","51º48'12''W","25º25'25''S","Subarbusto, 50cm, flores lilases","FLOR0064327","FLOR0064327",NA,NA,NA,"2015",NA,NA,NA,NA,"Solanales",NA
"20","2021-02-08 12:45:29-03","UFRGS","ICN","184916","S","Plantae","Dicotyledon","Solanaceae","Calibrachoa","eglandulata","Calibrachoa eglandulata","Stehmann & Semir",NA,NA,"John, AL W; Mäder, G","ALWJ4","2015","11","19","Brasil","SC","Urubici",NA,"-49.405833","-28.042222","-49.405833","-28.042222","barranco rochoso","ICN00032980",NA,NA,NA,"América do Sul","2015","11",NA,NA,NA,NA,"19"
"21","2021-02-08 12:45:29-03","UFRGS","ICN","147466","S","Plantae","Dicotyledon","Solanaceae","Calibrachoa","eglandulata","Calibrachoa eglandulata","Stehmann & Semir","Stehmann, JR",NA,"Vendruscolo, GS","585","2006","10","17","Brasil","SC","Urubici","estrada secundária para a Pousada Rio Canoas","-49.5917015075684","-28.0149993896484",NA,NA,"Erva com 0,3 m de altura, flores roxas.; Região de Estepe, beira da estrada.","ICN00033041",NA,"30102","auto","América do Sul",NA,NA,"1400","1400",NA,NA,NA
