"record_id","modified","institutionCode","collectionCode","catalogNumber","basisOfRecord","kingdom","phylum","family","genus","specificEpithet","scientificName","scientificNameAuthorship","identifiedBy","yearIdentified","monthIdentified","recordedBy","recordNumber","year","month","day","continentOcean","country","stateProvince","county","locality","decimalLongitude","decimalLatitude","coordinatePrecision","occurrenceRemarks","geoFlag","verbatimLongitude","verbatimLatitude","minimumElevationInMeters","maximumElevationInMeters","barcode","imagecode","fieldNumber","preparationType","class","order","typeStatus","relatedCatalogItem"
"1","2019-10-09 11:10:07-03","UFBA","ALCB","029870","PreservedSpecimen","Plantae","Dicotyledon","Asteraceae","Chaptalia","chapadensis","Chaptalia chapadensis","D.J.N.Hind","Hind, DJN","2000","09","Guedes, ML","s/n","1997","06","28","Southern America","Brasil","Bahia","Palmeiras","Chapada Diamantina, Morro do Pai Inácio","-41.5588989257812","-12.5289001464844","20767","Ca. 30 cm. Folhas discolores, face abaxial esbranquiçada. Capítulos com flores do disco e do raio alvas.","auto",NA,NA,NA,NA,NA,NA,NA,NA,NA,NA,NA,NA
"2","2019-10-09 11:10:07-03","UFBA","ALCB","135075","PreservedSpecimen","Plantae","Dicotyledon","Asteraceae","Chaptalia","chapadensis","Chaptalia chapadensis","D.J.N.Hind","Roque, N","2018","12","Alunos de Botânica BIOC05; Roque, N","08","2018","11","17","Southern America","Brasil","Bahia","Rio de Contas","Brumadinho, Trilha para o Vale do Queiroz.","-39.886667","-13.283333",NA,"folhas em roseta, discolores. Brácteas involucrais verdes, flores com corola alva.",NA,"-39.886667","-13.283333","1444","1444","ALCB061801","ALCB061801",NA,NA,NA,NA,NA,NA
"3","2019-10-09 11:10:07-03","UFBA","ALCB","127350","PreservedSpecimen","Plantae","Dicotyledon","Asteraceae","Chaptalia","chapadensis","Chaptalia chapadensis","D.J.N.Hind","Calvo, J","2017","02","Calvo, J","7380","2016","12","24","Southern America","Brasil","Bahia","Palmeiras","Valle de Capão, trilha a Pati","-41.486111","-12.676389",NA,"wet silt-clay soil",NA,"-41.486111","-12.676389","1270","1270","ALCB044062","ALCB044062",NA,NA,NA,NA,NA,NA
"4","2019-10-09 11:10:07-03","UFBA","ALCB","16061","PreservedSpecimen","Plantae","Dicotyledon","Asteraceae","Chaptalia","chapadensis","Chaptalia chapadensis","D.J.N.Hind","Hind, DJN","2000","09","Guedes, ML","662","1983","06","29","Southern America","Brasil","Bahia","Palmeiras","Chapada Diamantina, Morro do Pai Inácio","-41.472222","-12.45",NA,"Folhas membranáceas, discolores, face adaxial verde e abaxial esbranquiçada. Capítulos com brácteas involucrais esverdeadas e flores do raio alvas.",NA,"-41.472222","-12.45",NA,NA,NA,NA,NA,NA,NA,NA,NA,NA
"5","2019-10-09 11:10:07-03","UFBA","ALCB","16284","PreservedSpecimen","Plantae","Dicotyledon","Asteraceae","Chaptalia","chapadensis","Chaptalia chapadensis","D.J.N.Hind","Hind, DJN","2000","09","Lobo, CMB","s/n","1982","10","01","Southern America","Brasil","Bahia","Lençóis","Chapada Diamantina","-41.383333","-12.566667",NA,"Caule arroxeado. Flores brancas.",NA,"-41.383333","-12.566667",NA,NA,NA,NA,NA,NA,NA,NA,NA,NA
"6","2019-10-09 11:10:07-03","UFBA","ALCB","89080","PreservedSpecimen","Plantae","Dicotyledon","Asteraceae","Chaptalia","chapadensis","Chaptalia chapadensis","D.J.N.Hind","Roque, N","2009","07","Roque, N; Acevedo-Rodríguez, P; Funk, V; Keeley, S","2188","2009","07","07","Southern America","Brasil","Bahia","Lençóis","Chapada Diamantina, Morro do Pai Inácio","-41.3899993896484","-12.563099861145","47385","em fendas de rocha, folhas fortemente discolores, face adaxial verde-brilhante. Brácteas involucrais verde-cinéreas, flores alvas.","auto",NA,NA,NA,NA,NA,NA,NA,NA,NA,NA,NA,NA
"7","2021-03-01 16:23:39-03","UNICAMP","UEC","202693","S","Plantae","Magnoliopsida","Asteraceae","Chaptalia","chapadensis","Chaptalia chapadensis","D.J.N.Hind",NA,NA,NA,"Scatigna, AV; Carmo, JAM","1030","2016","01","17",NA,"Brazil","Bahia","Rio de Contas","Serra das Almas. Trilha para Pico das Almas. Campo rupestre.","-41.949722","-13.518889",NA,"Erva, ca. 20 cm. Flor branca, folhas discolores.",NA,"-41.949722","-13.518889",NA,NA,"UEC200168","UEC200168",NA,NA,NA,NA,NA,NA
"8","2015-09-04 09:44:38-03","MNHN","RECOLNAT_MNHN_P","P04267201","PreservedSpecimen",NA,NA,"Asteraceae","Chaptalia","chapadensis","Chaptalia chapadensis","(L.) D.J.N.Hind","Roque",NA,NA,"Harley, R.M.|Mayo, S.J.|Storr, R.M.|Santos, T.S.|Pinheiro, R.S.",NA,"1977","3","18",NA,"Brasil","Bahia",NA,"Brazil. Estado da Bahia, Serra das Almas. Middle N.E. slopes of the Pico das Almas, ca. 25 km. W.N.W. of the Vila do Rio de Contas. Bahia, Nordeste, Brasil, América do Sul","-41.95","-13.55",NA,". . Field work sponsered by the Royal Botanical Garden, Kew, and the Academia Brasileira de Ciências, and carried out with the collaboration of the Centro de Pesquisas do Cacau, Itabuna, Bahia, January-April 1977 <a href='http://coldb.mnhn.fr/catalognumber/mnhn/p/p04267201' target='other'> <mi>dwc_moreinfo</mi></a>",NA,NA,NA,"1500","1600","P04267201","P04267201_01","19618","hb",NA,NA,NA,NA
"9","2020-12-11 11:32:36-03","UFMG","BHCB","180265","PreservedSpecimen","Plantae","Dicotyledon","Asteraceae","Chaptalia","chapadensis","Chaptalia chapadensis","D.J.N.Hind",NA,NA,NA,"Fernandes, AC; Viana, PL; Mota, NFO; Paula, LFA; Jorge, TB","217","2010","10","13","Southern America","Brasil","Bahia","Rio de Contas","Pico das Almas, Trilha subida para o pico.","-41.935556","-13.54975",NA,"Campo rupestre",NA,"-41.935556","-13.54975","1519","1519","BHCB032633",NA,NA,NA,NA,NA,NA,NA
"10","2019-10-07 09:11:16-03","UEFS","HUEFS","66497","PreservedSpecimen","Plantae","Angiospermae","Asteraceae","Chaptalia","chapadensis","Chaptalia chapadensis","D.J.N.Hind",NA,NA,NA,"Mori, S.A.","14388","1981","06","12",NA,"Brasil","Bahia","Palmeiras","Pai Inácio, BR 242 W of Lençóis at km 232.","-41.5588989257812","-12.5289001464844","20767","Campo rupestre","auto",NA,NA,NA,NA,"HUEFS0066497",NA,NA,NA,"Asteranae","Asterales","Isótipo",NA
"11","2019-10-07 09:11:16-03","UEFS","HUEFS","134811","PreservedSpecimen","Plantae","Angiospermae","Asteraceae","Chaptalia","chapadensis","Chaptalia chapadensis","D.J.N.Hind","L.M.Moura","2011","11","Conceição, A.A.","2880","2008","04","11",NA,"Brasil","Bahia","Mucugê","Serra do Esbarrancado. Guiné.","-41.5","-12.75",NA,"Campo rupestre.",NA,"41W30'","12S45'","1400","1400","HUEFS0134811","HUEFS0134811",NA,NA,"Asteranae","Asterales",NA,NA
"12","2019-10-07 09:11:16-03","UEFS","HUEFS","192374","PreservedSpecimen","Plantae","Angiospermae","Asteraceae","Chaptalia","chapadensis","Chaptalia chapadensis","D.J.N.Hind",NA,NA,NA,"Almeida-Silva, G.","249","2012","07","27",NA,"Brasil","Bahia","Palmeiras","Parque Nacional Chapada Diamantina - Serra do Candombá.","-41.508889","-12.623889",NA,"Campo rupestre dominado por Vellozia sincorana, queimado a ca. 40 dias.",NA,"41W30'32''","12S37'26''","1200","1200","HUEFS0192374","HUEFS0192374",NA,NA,"Asteranae","Asterales",NA,NA
"13","2019-10-07 09:11:16-03","UEFS","HUEFS","6109","PreservedSpecimen","Plantae","Angiospermae","Asteraceae","Chaptalia","chapadensis","Chaptalia chapadensis","D.J.N.Hind","D.J.N.Hind & H.P.Bautista","2000","09","Queiroz, L.P.de","620","1983","06","29",NA,"Brasil","Bahia","Palmeiras",NA,"-41.466667","-12.466667",NA,NA,NA,"41W28'","12S28'","1000","1400","HUEFS0006109","HUEFS0006109",NA,NA,"Asteranae","Asterales",NA,NA
"14","2019-10-07 09:11:16-03","UEFS","HUEFS","66496","PreservedSpecimen","Plantae","Angiospermae","Asteraceae","Chaptalia","chapadensis","Chaptalia chapadensis","D.J.N.Hind",NA,NA,NA,"Carvalho, A.M.de","1017","1981","12","19",NA,"Brasil","Bahia","Palmeiras","Pai Inácio, km 224 da Rodovia BR 242. Vale entre os blocos que compõem o conjunto.","-41.5588989257812","-12.5289001464844","20767",NA,"auto",NA,NA,NA,NA,"HUEFS0066496",NA,NA,NA,"Asteranae","Asterales","Isoparátipo",NA
"15","2020-07-23 11:58:54-03","CEPLAC","CEPEC","27393","PreservedSpecimen","Plantae",NA,"Asteraceae","Chaptalia","chapadensis","Chaptalia chapadensis",NA,"D. J. N. Hind",NA,NA,"S. A. Mori","14388","1981","06","12",NA,"Brasil","Bahia","palmeiras","Pai Inácio, BR-242 a W de Lençóis KM 232.","-41.5588989257812","-12.5289001464844","20767",NA,"auto",NA,NA,NA,NA,NA,NA,NA,NA,NA,NA,"Holótipo","30/12/1999"
"16","2020-07-23 11:58:54-03","CEPLAC","CEPEC","28635","PreservedSpecimen","Plantae",NA,"Asteraceae","Chaptalia","chapadensis","Chaptalia chapadensis",NA,"D. J. N. Hind",NA,NA,"A. M. de Carvalho","1017","1981","12","19",NA,"Brasil","Bahia","palmeiras","Pai Inacio, Km 224 da BR-242. Vale entre os blocos que compõem o conjunto.","-41.5588989257812","-12.5289001464844","20767",NA,"auto","0W0'0","0S0'0",NA,NA,NA,NA,NA,NA,NA,NA,"Isoparalectotipo","30/12/2000"
