"record_id","modified","institutionCode","collectionCode","catalogNumber","basisOfRecord","kingdom","phylum","order","family","genus","specificEpithet","scientificName","scientificNameAuthorship","identifiedBy","recordedBy","recordNumber","year","month","day","continentOcean","country","stateProvince","locality","decimalLongitude","decimalLatitude","preparationType","occurrenceRemarks","barcode","imagecode","county","minimumElevationInMeters","maximumElevationInMeters","class","yearIdentified","monthIdentified","dayIdentified","relatedCatalogItem","verbatimLongitude","verbatimLatitude","coordinatePrecision","geoFlag","typeStatus","fieldNumber","individualCount"
"1","2021-03-15 16:37:00-03","NY","NYBG","00935882","PreservedSpecimen","Plantae","Magnoliophyta","Magnoliales","Annonaceae","Annona","glaucophylla","Annona glaucophylla","R.E.Fr.","W. Morawetz; H. Rainer","G. C. G. Argent","6736","1967","10","12","South America","Brazil","Mato Grosso","Olaria, just S.W. of Xavantina","-52.23","-14.63","sheet","<a href='http://sweetgum.nybg.org/science/vh/specimen_details.php?irn=1015257' target='other'> <mi>dwc_moreinfo</mi></a>","NY00935882","NY00935882_01",NA,NA,NA,NA,NA,NA,NA,NA,NA,NA,NA,NA,NA,NA,NA
"2","2021-03-15 16:37:00-03","NY","NYBG","00836212","PreservedSpecimen","Plantae","Magnoliophyta","Magnoliales","Annonaceae","Annona","glaucophylla","Annona glaucophylla","R.E.Fr.","W. Morawetz; H. Rainer","G. G. Hatschbach","45860","1982","12","10","South America","Brazil","Mato Grosso do Sul","Amambai, arredores","-55.2256","-23.1044","sheet","<a href='http://sweetgum.nybg.org/science/vh/specimen_details.php?irn=920823' target='other'> <mi>dwc_moreinfo</mi></a>","NY00836212","NY00836212_01","Amambaí",NA,NA,NA,NA,NA,NA,NA,NA,NA,NA,NA,NA,NA,NA
"3","2021-03-15 16:37:00-03","NY","NYBG","00836236","PreservedSpecimen","Plantae","Magnoliophyta","Magnoliales","Annonaceae","Annona","glaucophylla","Annona glaucophylla","R.E.Fr.","W. Morawetz; H. Rainer","H. S. Irwin","6679","1964","10","09","South America","Brazil","Mato Grosso","Ca. 75 km. N. of Xavantina.","-52.3657","-13.585","sheet","<a href='http://sweetgum.nybg.org/science/vh/specimen_details.php?irn=920820' target='other'> <mi>dwc_moreinfo</mi></a>","NY00836236","NY00836236_01",NA,"300","400",NA,NA,NA,NA,NA,NA,NA,NA,NA,NA,NA,NA
"4","2020-02-08 09:38:17-03","NBC","NL-BOTANY","U.1071919","PreservedSpecimen","Plantae",NA,"Magnoliales","Annonaceae","Annona","glaucophylla","Annona glaucophylla","R.E.Fr.",NA,"Hatschbach GG",NA,"1971","01","24","Southern America","Brazil","Minas Gerais",NA,NA,NA,NA,"<a href=https://data.biodiversitydata.nl/naturalis/specimen/U.1071919 target=other class=eLink> <mi>dwc_moreinfo</mi></a>","NL-U1071919","NL-U1071919",NA,NA,NA,"Magnoliopsidae","1992","08","01","U 0144945",NA,NA,NA,NA,NA,NA,NA
"5","2020-02-08 09:38:17-03","NBC","NL-BOTANY","U.1071920","PreservedSpecimen","Plantae",NA,"Magnoliales","Annonaceae","Annona","glaucophylla","Annona glaucophylla","R.E.Fr.",NA,"Hatschbach GG",NA,"1982","12","10","Southern America","Brazil","Mato Grosso","Amambai arrededores, Mato Grosso do Sul",NA,NA,NA,"<a href=https://data.biodiversitydata.nl/naturalis/specimen/U.1071920 target=other class=eLink> <mi>dwc_moreinfo</mi></a>","NL-U1071920","NL-U1071920",NA,NA,NA,"Magnoliopsidae",NA,NA,NA,"U 0011073",NA,NA,NA,NA,NA,NA,NA
"6","2020-11-19 10:22:34-03","CPAP","CPAP","16296","PreserverdSpecimen","Plantae",NA,NA,"Annonaceae","Annona","glaucophylla","Annona glaucophylla","R.E.Fr.","R. M. Silva","Hatschbach, G.","63671","1995","10","20",NA,"Brasil","MT","Rodovia Chapada dos Guimarães a Água Fria, km 30-35",NA,NA,NA,"Ereta. FLOR: creme. AMBIENTE: Campo cerrado.",NA,NA,"Chapa dos Guimarães",NA,NA,NA,"1996",NA,NA,NA,NA,NA,NA,NA,NA,NA,NA
"7","2020-11-19 10:22:34-03","CPAP","CPAP","23984","PreserverdSpecimen","Plantae",NA,NA,"Annonaceae","Annona","glaucophylla","Annona glaucophylla","R.E.Fr.","A.Pott","Pott, A.","11903","2004","10","12",NA,"Brasil","MS","Rodovia BR-163, km 330, fazenda Santa Maria.","-54.842778","-21.726111",NA,"Subarbusto ereto 30-80cm de altura, com xilopódio. FLOR: botão esverdeado. FRUTO: ausente. INTERESSE: Invasora de pastagem.. FREQUÊNCIA: Esparsa. AMBIENTE: Pastagem degradada em área de cerradão.. SUBSTRATO: Solo latossolo vermelho. RELEVO: plano.",NA,NA,"Rio Brilhante","345","345",NA,NA,NA,NA,NA,"54°50'34W","21°43'34S",NA,NA,NA,NA,NA
"8","2021-04-07 11:40:44-03","UFMS","CGMS","14505","PreservedSpecimen","Plantae",NA,NA,"Annonaceae","Annona","glaucophylla","Annona glaucophylla","R.E.Fr.",NA,"A. Pott; V.J. Pott; A.C.M. Cristaldo; O.A. Corsino Jr.","12261","2004","11","12",NA,"Brasil","Mato Grosso do Sul","Fazenda Ponte Nova, SW de Paranaíba.","-52.9944444","-19.0575",NA,"Flor amarelada. Folha verde-clara. Discolor. Habitat: Cerrado sensu stricto. Solo arenoso, concrecionário, laterítico. Relevo encosta. Habito: Subarbusto subereto. Ocasional. 60 cm de altura.","CGMS1043983",NA,"Paranaíba","460","460",NA,NA,NA,NA,NA,"-52,9944444","-19,0575",NA,NA,NA,NA,NA
"9","2021-04-07 11:40:44-03","UFMS","CGMS","58835","PreservedSpecimen","Plantae",NA,NA,"Annonaceae","Annona","glaucophylla","Annona glaucophylla","R.E.Fr.","A. Pott","A. Pott; V.J. Pott","11903","2004","10","12",NA,"Brasil","Mato Grosso do Sul","Rodovia BR-163 Km 330, Fazenda Santa Maria.","-54.8427777","-21.7261111",NA,"Botão floral esverdeado. Fruto ausente. Habitat: Pastagem degradada em área de cerradão. Solo latossolo vermelho. Relevo plano. Habito: Subarbusto ereto. 30-80 cm de altura, com xilopódio. Freqüente.","CGMS001563",NA,"Rio Brilhante","345","345",NA,"2009",NA,NA,NA,"-54,8427777","-21,7261111",NA,NA,NA,NA,NA
"10","2021-04-07 11:40:44-03","UFMS","CGMS","60816","PreservedSpecimen","Plantae",NA,NA,"Annonaceae","Annona","glaucophylla","Annona glaucophylla","R.E.Fr.",NA,"Josiane F. Santos; A.C.M. Cristaldo","89","2002","03","01",NA,"Brasil","Mato Grosso do Sul","Reserva Embrapa-CNPGC.","-54.6464004516602","-20.4428005218506",NA,"Verde. ausente. Parte inferior da pétala rosada. Habitat: Cerrado. Solo latossolo vermelho. Releva plano. Habito: Subarbusto. 0,5 m de altura.","CGMS1093820",NA,"Campo Grande",NA,NA,NA,NA,NA,NA,NA,NA,NA,"161190","auto",NA,NA,NA
"11","2021-04-07 11:40:44-03","UFMS","CGMS","16638","PreservedSpecimen","Plantae",NA,NA,"Annonaceae","Annona","glaucophylla","Annona glaucophylla","R.E.Fr.","A. Pott; V.J. Pott","J.M. Longo; L.P. Tadei; C. Aoki","70","2004","10","29",NA,"Brasil","Mato Grosso do Sul","Nascente do Rio Sucuriú.","-53.1291999816895","-18.5438995361328",NA,"Flor amarelada. Habitat: Cerrado. Habito: Subarbusto subereto. 0,60m de altura.","CGMS1045936",NA,"Costa Rica",NA,NA,NA,NA,NA,NA,NA,NA,NA,"76958","auto",NA,NA,NA
"12","2021-04-07 11:40:44-03","UFMS","CGMS","9445","PreservedSpecimen","Plantae",NA,NA,"Annonaceae","Annona","glaucophylla","Annona glaucophylla","R.E.Fr.","A. Pott & V.J. Pott","A. Sangalli; M.V. Camargo",NA,"1999","12","29",NA,"Brasil","Mato Grosso do Sul","Fazenda Santa Madalena.","-54.8055992126465","-22.2210998535156",NA,NA,"CGMS001565",NA,"Dourados",NA,NA,NA,"2012","03","21",NA,NA,NA,"74744","auto",NA,NA,NA
"13","2021-04-07 11:40:44-03","UFMS","CGMS","58834","PreservedSpecimen","Plantae",NA,NA,"Annonaceae","Annona","glaucophylla","Annona glaucophylla","R.E.Fr.",NA,"A. Pott; I.S. Dutra","14046","2006","02","23",NA,"Brasil","Mato Grosso do Sul","Estrada de fazendas, 0,5 km sul da Rodovia MS-382, a 5 km de Guia Lopes da Laguna para Bonito.","-56.114200592041","-21.457799911499",NA,"Flor esverdeada com tépalas internas vermelhas. Fruto imaturo glauco. Habitat: Pastagem de Brachiaria com regeneração de cerrado. Solo arenoso. Relevo quase plano. Habito: Subarbusto. 0,6-1,2 m de altura. Ocasional.","CGMS001562",NA,"Guia Lopes da Laguna",NA,NA,NA,NA,NA,NA,NA,NA,NA,"44012","auto",NA,NA,NA
"14","2020-04-22 16:17:13-03","UFPB","JPB","2352","PreservedSpecimen","Plantae","Angiosperma","Dicotyledon","Annonaceae","Annona","glaucophylla","Annona glaucophylla","R.E.Fr.","Bazante, ML","Chaves, MJ","192","1968","10","11","Southern America","Brasil","Mato Grosso",NA,NA,NA,NA,"; HABITAT: Cerrado.; DESC: Subarbusto com xilopódio folhas amplexicaule.",NA,NA,"Xavantina",NA,NA,NA,"2016","12","05",NA,NA,NA,NA,NA,NA,NA,NA
"15","2020-12-21 16:11:53-03","MBM","MBM","24470","PreservedSpecimen","Plantae",NA,NA,"Annonaceae","Annona","glaucophylla","Annona glaucophylla","R.E. Fries","Rooden, J. van","Hatschbach, G.","26098","1971","01","24","Southern America","Brazil","Mato Grosso","Fazenda Bela Vista",NA,NA,NA,NA,"MBM024470","MBM024470","Rio Brilhante",NA,NA,NA,NA,NA,NA,NA,NA,NA,NA,NA,NA,NA,NA
"16","2020-12-21 16:11:53-03","MBM","MBM","67014","PreservedSpecimen","Plantae",NA,NA,"Annonaceae","Annona","glaucophylla","Annona glaucophylla","R.E. Fries",NA,"Krapovickas, A.; et al.; et al.","34357","1979","01","19","Southern America","Brazil","Mato Grosso","68km E de Ponta Porã, camino a Dourados",NA,NA,NA,NA,"MBM067014","MBM067014","Ponta Porã",NA,NA,NA,NA,NA,NA,NA,NA,NA,NA,NA,NA,NA,NA
"17","2020-12-21 16:11:53-03","MBM","MBM","78232","PreservedSpecimen","Plantae",NA,NA,"Annonaceae","Annona","glaucophylla","Annona glaucophylla","R.E. Fries","Johnson, D.M.","Hatschbach, G.","45860","1982","12","10","Southern America","Brazil","Mato Grosso","Amambai, arredores",NA,NA,NA,NA,"MBM078232","MBM078232","Amambai",NA,NA,NA,NA,NA,NA,NA,NA,NA,NA,NA,NA,NA,NA
"18","2020-12-21 16:11:53-03","MBM","MBM","184071","PreservedSpecimen","Plantae",NA,NA,"Annonaceae","Annona","glaucophylla","Annona glaucophylla","R.E. Fries","Mello-Silva, R.","Hatschbach, G.; Pott, A.; Barboza, E.; Pott, A.; Barboza, E.","63671","1995","10","20","Southern America","Brazil","Mato Grosso","Rodovia para Água Fria, km 30-35","-55.749698638916","-15.460599899292",NA,NA,"MBM184071","MBM184071","Chapada dos Guimarães",NA,NA,NA,NA,NA,NA,NA,NA,NA,"107042","auto",NA,NA,NA
"19","2015-10-02 20:58:59-03","MNHN","RECOLNAT_MNHN_P","P00734945","PreservedSpecimen",NA,NA,NA,"Annonaceae","Annona","glaucophylla","Annona glaucophylla","R.E.Fr.","Rainer","Hassler, E.",NA,NA,"12",NA,NA,"Paraguay",NA,"In regione cursus superioris fluminis Apa",NA,NA,"hb","<a href='http://coldb.mnhn.fr/catalognumber/mnhn/p/p00734945' target='other'> <mi>dwc_moreinfo</mi></a>","P00734945","P00734945_01",NA,NA,NA,NA,NA,NA,NA,NA,NA,NA,NA,NA,"isotype","Iter ad Paraguariam septentrionalem/8119",NA
"20","2017-08-29 08:06:00-03","MO","MOBOT","1474327","PreservedSpecimen","Plantae",NA,NA,"Annonaceae","Annona","glaucophylla","Annona glaucophylla","R.E. Fr.","H. Rainer (WU)","Elsa M. Zardini|Leongino Guerrero","Zardini 54039","2000","5","8","South America","Paraguay","Amambay","Trail to Arroyo Estrella.","-56.4380555","-22.1211111",NA,NA,NA,NA,NA,NA,NA,NA,NA,NA,NA,NA,NA,NA,NA,NA,NA,"1203","3"
"21","2008-05-27 22:02:00-03","MO","MOBOT","1476599","PreservedSpecimen","Plantae",NA,NA,"Annonaceae","Annona","glaucophylla","Annona glaucophylla","R.E. Fr.","H. Rainer (WU)","Elsa M. Zardini|M. Vera","Zardini 54335","2000","5","11","South America","Paraguay","Concepción","Around Sargento José E. López. Cerrado scrub.","-56.87888","-22.55166",NA,NA,NA,NA,NA,NA,NA,NA,NA,NA,NA,NA,NA,NA,NA,NA,NA,"1206","1"
"22","2020-07-22 14:41:00-03","MO","MOBOT","2493694","PreservedSpecimen","Plantae",NA,NA,"Annonaceae","Annona","glaucophylla","Annona glaucophylla","R.E. Fr.","Spichiger, R.","Émile Hassler","Hassler 8119","1902","12",NA,"South America","Paraguay","Concepción","In campis in regione cursus superioris fluminis Apa. Inter ad paraguariam septentrionalem",NA,NA,NA,NA,NA,NA,NA,NA,NA,NA,NA,NA,NA,NA,NA,NA,NA,NA,NA,NA,"1"
"23","2020-08-31 09:11:58-03","INPA","INPA","42458","S","Plantae","Dicotyledon Magnoliids","Magnoliales","Annonaceae","Annona","glaucophylla","Annona glaucophylla","R.E.Fr.","Rooden, J van","Prance, GT","18967","1973","10","14","Southern America","Brasil","Mato Grosso","Véu de Noiva, Vicinity of Veu de Noiva; Chapada dos Guimarães.","-56.181847","-14.860616",NA,NA,"INPA0042458","INPA0042458 INPA0042458_1e INPA0042458_e INPA0042458_e1 INPA0042458_nd",NA,NA,NA,NA,"1971",NA,NA,NA,"-56.181847","-14.860616",NA,NA,NA,NA,NA
"24","2019-09-05 15:28:00-03","F","FMNH-SEEDPLANTS",NA,"PreservedSpecimen","Plantae","Spermatophyta",NA,"Annonaceae","Annona","glaucophylla","Annona glaucophylla",NA,NA,"E. Hassler","8119","1901","12",NA,"South America","Paraguay",NA,NA,"-58.1689","-23.2025",NA,NA,NA,NA,NA,NA,NA,"Dicotyledoneae",NA,NA,NA,NA,NA,NA,NA,NA,"Type [status unknown]",NA,NA
"25","2018-02-26 18:31:34-03","UFMT","UFMT","1103","S","Plantae",NA,NA,"Annonaceae","Annona","glaucophylla","Annona glaucophylla","R.E.Fr.","Silva, R.M.","Cordeiro, I.; Catharino, E.L.M.; Ribeiro, W.; Simonetti, C.; Machado, C.","1095","1992","11","22",NA,"Brasil","Mato Grosso do Sul","Estrada entre Bataguaçu e Brasilândia, Fazenda Santa Encarnação.","-52.4221992492676","-21.7141990661621",NA,"Subarbusto, alt. 1,0m. botões verdes, folhas adultas glaucas, castanhas quando jovens.; Cerrado sensu stricto, colinas de arenito caiuã.",NA,NA,"Bataguaçu",NA,NA,NA,NA,NA,NA,NA,NA,NA,"65610","auto",NA,NA,NA
"26","2019-11-21 09:58:17-03","IBt","SP","263733","S","Plantae",NA,NA,"Annonaceae","Annona","glaucophylla","Annona glaucophylla","R.E.Fr.","Rainer, H","Cordeiro, I; Catharino, ELM; Ribeiro, W; Simonetti, C; Machado, C","1058","1992","11","22",NA,"Brasil","Mato Grosso do Sul","Estrada entre Bataguassu e Brasilândia. Fazenda Santa Encarnação","-52.4221992492676","-21.7141990661621",NA,NA,"SP023133","SP023133","Bataguassu",NA,NA,NA,"2006",NA,NA,NA,NA,NA,"65610","auto",NA,NA,NA
"27","2019-11-21 09:58:17-03","IBt","SP","263738","S","Plantae",NA,NA,"Annonaceae","Annona","glaucophylla","Annona glaucophylla","R.E.Fr.","Rainer, H","Cordeiro, I; Catharino, ELM; Ribeiro, W; Simonetti, C; Machado, C","1095","1992","11","22",NA,"Brasil","Mato Grosso do Sul","Estrada entre Bataguassu e Brasilândia. Fazenda Santa Encarnação","-52.4221992492676","-21.7141990661621",NA,NA,"SP023134","SP023134","Bataguassu",NA,NA,NA,"2006",NA,NA,NA,NA,NA,"65610","auto",NA,NA,NA
